[
{"status do contrato":"Vigentes","categoria produto":"Medicamentos","id contrato":2173188,"razão social do cliente":"Unimed Vitória Cooperativa de Trabalho Médico","valor unitário":474.3570000000,"quantidade acordada":"Não Estipulado","dias para encerramento do acordo":"56","cnpj cliente":"27.578.434/0015-25","título":"ACORDO REF. MEDICAMENTOS ASTRAZENECA - AX REF 0001-00466","produto":"CALQUENCE 100 MG COMP","fim vigência":"2026-03-31T23:59:00Z","tipo de acordo":"Por período","data solicitação":"17/06/2025","início vigência":"2025-06-17T00:00:00Z"},
{"status do contrato":"Vigentes","categoria produto":"Medicamentos","id contrato":5318251,"razão social do cliente":"Unimed Vitória Cooperativa de Trabalho Médico","valor unitário":364.6300000000,"quantidade acordada":"Não Estipulado","dias para encerramento do acordo":"56","cnpj cliente":"27.578.434/0015-25","título":"OL PONTUAL - ITENS GSK - AX 0001-00522","produto":"ZEJULA 100MG - CAPS DURA","fim vigência":"2026-03-31T23:59:00Z","tipo de acordo":"Por período","data solicitação":"27/10/2025","início vigência":"2025-10-27T00:00:00Z"},
{"status do contrato":"Vigentes","categoria produto":"Medicamentos","id contrato":5358259,"razão social do cliente":"Unimed Vitória Cooperativa de Trabalho Médico","valor unitário":20.4150000000,"quantidade acordada":"Não Estipulado","dias para encerramento do acordo":"56","cnpj cliente":"27.578.434/0015-25","título":"ACORDO REF. MEDICAMENTOS ASTRAZENECA - AX REF 0001-00466","produto":"ARIMIDEX 1MG - COMP","fim vigência":"2026-03-31T23:59:00Z","tipo de acordo":"Por período","data solicitação":"11/11/2025","início vigência":"2025-11-11T00:00:00Z"},
{"status do contrato":"Vigentes","categoria produto":"Medicamentos","id contrato":5358259,"razão social do cliente":"Unimed Vitória Cooperativa de Trabalho Médico","valor unitário":11950.8420000000,"quantidade acordada":"Não Estipulado","dias para encerramento do acordo":"56","cnpj cliente":"27.578.434/0015-25","título":"ACORDO REF. MEDICAMENTOS ASTRAZENECA - AX REF 0001-00466","produto":"IMFINZI 500MG/10ML - FA (?C)","fim vigência":"2026-03-31T23:59:00Z","tipo de acordo":"Por período","data solicitação":"11/11/2025","início vigência":"2025-11-11T00:00:00Z"},
{"status do contrato":"Vigentes","categoria produto":"Medicamentos","id contrato":5358259,"razão social do cliente":"Unimed Vitória Cooperativa de Trabalho Médico","valor unitário":450.6390000000,"quantidade acordada":"Não Estipulado","dias para encerramento do acordo":"56","cnpj cliente":"27.578.434/0015-25","título":"ACORDO REF. MEDICAMENTOS ASTRAZENECA - AX REF 0001-00466","produto":"CALQUENCE 100 MG COMP","fim vigência":"2026-03-31T23:59:00Z","tipo de acordo":"Por período","data solicitação":"11/11/2025","início vigência":"2025-11-11T00:00:00Z"},
{"status do contrato":"Vigentes","categoria produto":"Medicamentos","id contrato":2173188,"razão social do cliente":"Unimed Vitória Cooperativa de Trabalho Médico","valor unitário":11950.8420000000,"quantidade acordada":"Não Estipulado","dias para encerramento do acordo":"56","cnpj cliente":"27.578.434/0015-25","título":"ACORDO REF. MEDICAMENTOS ASTRAZENECA - AX REF 0001-00466","produto":"IMFINZI 500MG/10ML - FA (?C)","fim vigência":"2026-03-31T23:59:00Z","tipo de acordo":"Por período","data solicitação":"17/06/2025","início vigência":"2025-06-17T00:00:00Z"},
{"status do contrato":"Vigentes","categoria produto":"Medicamentos","id contrato":5318251,"razão social do cliente":"Unimed Vitória Cooperativa de Trabalho Médico","valor unitário":3313.9000000000,"quantidade acordada":"Não Estipulado","dias para encerramento do acordo":"56","cnpj cliente":"27.578.434/0015-25","título":"OL PONTUAL - ITENS GSK - AX 0001-00522","produto":"NUCALA 40MG/0,4 ML SOL INJ SER PREENCHIDA","fim vigência":"2026-03-31T23:59:00Z","tipo de acordo":"Por período","data solicitação":"27/10/2025","início vigência":"2025-10-27T00:00:00Z"},
{"status do contrato":"Vigentes","categoria produto":"Medicamentos","id contrato":5318251,"razão social do cliente":"Unimed Vitória Cooperativa de Trabalho Médico","valor unitário":8404.8200000000,"quantidade acordada":"Não Estipulado","dias para encerramento do acordo":"56","cnpj cliente":"27.578.434/0015-25","título":"OL PONTUAL - ITENS GSK - AX 0001-00522","produto":"NUCALA 100MG CANETA 1ML","fim vigência":"2026-03-31T23:59:00Z","tipo de acordo":"Por período","data solicitação":"27/10/2025","início vigência":"2025-10-27T00:00:00Z"},
{"status do contrato":"Vigentes","categoria produto":"Medicamentos","id contrato":2173188,"razão social do cliente":"Unimed Vitória Cooperativa de Trabalho Médico","valor unitário":3.3020000000,"quantidade acordada":"Não Estipulado","dias para encerramento do acordo":"56","cnpj cliente":"27.578.434/0015-25","título":"ACORDO REF. MEDICAMENTOS ASTRAZENECA - AX REF 0001-00466","produto":"FORXIGA 30COM 10MG","fim vigência":"2026-03-31T23:59:00Z","tipo de acordo":"Por período","data solicitação":"17/06/2025","início vigência":"2025-06-17T00:00:00Z"},
{"status do contrato":"Vigentes","categoria produto":"Medicamentos","id contrato":5358259,"razão social do cliente":"Unimed Vitória Cooperativa de Trabalho Médico","valor unitário":3.3020000000,"quantidade acordada":"Não Estipulado","dias para encerramento do acordo":"56","cnpj cliente":"27.578.434/0015-25","título":"ACORDO REF. MEDICAMENTOS ASTRAZENECA - AX REF 0001-00466","produto":"FORXIGA 30COM 10MG","fim vigência":"2026-03-31T23:59:00Z","tipo de acordo":"Por período","data solicitação":"11/11/2025","início vigência":"2025-11-11T00:00:00Z"},
{"status do contrato":"Vigentes","categoria produto":"Medicamentos","id contrato":2173188,"razão social do cliente":"Unimed Vitória Cooperativa de Trabalho Médico","valor unitário":51.3950000000,"quantidade acordada":"Não Estipulado","dias para encerramento do acordo":"56","cnpj cliente":"27.578.434/0015-25","título":"ACORDO REF. MEDICAMENTOS ASTRAZENECA - AX REF 0001-00466","produto":"CICLOSSILICATO DE ZIRCONIO SACHE 5 GR","fim vigência":"2026-03-31T23:59:00Z","tipo de acordo":"Por período","data solicitação":"17/06/2025","início vigência":"2025-06-17T00:00:00Z"},
{"status do contrato":"Vigentes","categoria produto":"Medicamentos","id contrato":5358259,"razão social do cliente":"Unimed Vitória Cooperativa de Trabalho Médico","valor unitário":7769.8850000000,"quantidade acordada":"Não Estipulado","dias para encerramento do acordo":"56","cnpj cliente":"27.578.434/0015-25","título":"ACORDO REF. MEDICAMENTOS ASTRAZENECA - AX REF 0001-00466","produto":"TEZSPIRE 110MG/ML SER 1,91 ML","fim vigência":"2026-03-31T23:59:00Z","tipo de acordo":"Por período","data solicitação":"11/11/2025","início vigência":"2025-11-11T00:00:00Z"},
{"status do contrato":"Vigentes","categoria produto":"Medicamentos","id contrato":5358259,"razão social do cliente":"Unimed Vitória Cooperativa de Trabalho Médico","valor unitário":5.6740000000,"quantidade acordada":"Não Estipulado","dias para encerramento do acordo":"56","cnpj cliente":"27.578.434/0015-25","título":"ACORDO REF. MEDICAMENTOS ASTRAZENECA - AX REF 0001-00466","produto":"NOLVADEX 20MG - COMP","fim vigência":"2026-03-31T23:59:00Z","tipo de acordo":"Por período","data solicitação":"11/11/2025","início vigência":"2025-11-11T00:00:00Z"},
{"status do contrato":"Vigentes","categoria produto":"Medicamentos","id contrato":2173188,"razão social do cliente":"Unimed Vitória Cooperativa de Trabalho Médico","valor unitário":626.0430000000,"quantidade acordada":"Não Estipulado","dias para encerramento do acordo":"56","cnpj cliente":"27.578.434/0015-25","título":"ACORDO REF. MEDICAMENTOS ASTRAZENECA - AX REF 0001-00466","produto":"TRUQAP 64COM 160MG","fim vigência":"2026-03-31T23:59:00Z","tipo de acordo":"Por período","data solicitação":"17/06/2025","início vigência":"2025-06-17T00:00:00Z"},
{"status do contrato":"Vigentes","categoria produto":"Medicamentos","id contrato":5358259,"razão social do cliente":"Unimed Vitória Cooperativa de Trabalho Médico","valor unitário":672.7370000000,"quantidade acordada":"Não Estipulado","dias para encerramento do acordo":"56","cnpj cliente":"27.578.434/0015-25","título":"ACORDO REF. MEDICAMENTOS ASTRAZENECA - AX REF 0001-00466","produto":"ZOLADEX 10,8MG - SERINGA (?C)","fim vigência":"2026-03-31T23:59:00Z","tipo de acordo":"Por período","data solicitação":"11/11/2025","início vigência":"2025-11-11T00:00:00Z"},
{"status do contrato":"Vigentes","categoria produto":"Medicamentos","id contrato":2173188,"razão social do cliente":"Unimed Vitória Cooperativa de Trabalho Médico","valor unitário":413.0710000000,"quantidade acordada":"Não Estipulado","dias para encerramento do acordo":"56","cnpj cliente":"27.578.434/0015-25","título":"ACORDO REF. MEDICAMENTOS ASTRAZENECA - AX REF 0001-00466","produto":"ZOLADEX 3,6MG  - SERINGA (?C)","fim vigência":"2026-03-31T23:59:00Z","tipo de acordo":"Por período","data solicitação":"17/06/2025","início vigência":"2025-06-17T00:00:00Z"},
{"status do contrato":"Vigentes","categoria produto":"Medicamentos","id contrato":2173188,"razão social do cliente":"Unimed Vitória Cooperativa de Trabalho Médico","valor unitário":126.0080000000,"quantidade acordada":"Não Estipulado","dias para encerramento do acordo":"56","cnpj cliente":"27.578.434/0015-25","título":"ACORDO REF. MEDICAMENTOS ASTRAZENECA - AX REF 0001-00466","produto":"IRESSA 250MG - COMP","fim vigência":"2026-03-31T23:59:00Z","tipo de acordo":"Por período","data solicitação":"17/06/2025","início vigência":"2025-06-17T00:00:00Z"},
{"status do contrato":"Vigentes","categoria produto":"Medicamentos","id contrato":2173188,"razão social do cliente":"Unimed Vitória Cooperativa de Trabalho Médico","valor unitário":5.6740000000,"quantidade acordada":"Não Estipulado","dias para encerramento do acordo":"56","cnpj cliente":"27.578.434/0015-25","título":"ACORDO REF. MEDICAMENTOS ASTRAZENECA - AX REF 0001-00466","produto":"NOLVADEX 20MG - COMP","fim vigência":"2026-03-31T23:59:00Z","tipo de acordo":"Por período","data solicitação":"17/06/2025","início vigência":"2025-06-17T00:00:00Z"},
{"status do contrato":"Vigentes","categoria produto":"Medicamentos","id contrato":2173188,"razão social do cliente":"Unimed Vitória Cooperativa de Trabalho Médico","valor unitário":1023.2340000000,"quantidade acordada":"Não Estipulado","dias para encerramento do acordo":"56","cnpj cliente":"27.578.434/0015-25","título":"ACORDO REF. MEDICAMENTOS ASTRAZENECA - AX REF 0001-00466","produto":"TAGRISSO 40MG COMP","fim vigência":"2026-03-31T23:59:00Z","tipo de acordo":"Por período","data solicitação":"17/06/2025","início vigência":"2025-06-17T00:00:00Z"},
{"status do contrato":"Vigentes","categoria produto":"Medicamentos","id contrato":5358259,"razão social do cliente":"Unimed Vitória Cooperativa de Trabalho Médico","valor unitário":635.6970000000,"quantidade acordada":"Não Estipulado","dias para encerramento do acordo":"56","cnpj cliente":"27.578.434/0015-25","título":"ACORDO REF. MEDICAMENTOS ASTRAZENECA - AX REF 0001-00466","produto":"FASLODEX 250MG/5ML - SER (?C)","fim vigência":"2026-03-31T23:59:00Z","tipo de acordo":"Por período","data solicitação":"11/11/2025","início vigência":"2025-11-11T00:00:00Z"},
{"status do contrato":"Vigentes","categoria produto":"Medicamentos","id contrato":2173188,"razão social do cliente":"Unimed Vitória Cooperativa de Trabalho Médico","valor unitário":11302.5800000000,"quantidade acordada":"Não Estipulado","dias para encerramento do acordo":"56","cnpj cliente":"27.578.434/0015-25","título":"ACORDO REF. MEDICAMENTOS ASTRAZENECA - AX REF 0001-00466","produto":"FASENRA 30MG/ML SERINGA","fim vigência":"2026-03-31T23:59:00Z","tipo de acordo":"Por período","data solicitação":"17/06/2025","início vigência":"2025-06-17T00:00:00Z"},
{"status do contrato":"Vigentes","categoria produto":"Medicamentos","id contrato":2173188,"razão social do cliente":"Unimed Vitória Cooperativa de Trabalho Médico","valor unitário":225.0290000000,"quantidade acordada":"Não Estipulado","dias para encerramento do acordo":"56","cnpj cliente":"27.578.434/0015-25","título":"ACORDO REF. MEDICAMENTOS ASTRAZENECA - AX REF 0001-00466","produto":"LYNPARZA 150MG COMP","fim vigência":"2026-03-31T23:59:00Z","tipo de acordo":"Por período","data solicitação":"17/06/2025","início vigência":"2025-06-17T00:00:00Z"},
{"status do contrato":"Vigentes","categoria produto":"Medicamentos","id contrato":5358259,"razão social do cliente":"Unimed Vitória Cooperativa de Trabalho Médico","valor unitário":225.0290000000,"quantidade acordada":"Não Estipulado","dias para encerramento do acordo":"56","cnpj cliente":"27.578.434/0015-25","título":"ACORDO REF. MEDICAMENTOS ASTRAZENECA - AX REF 0001-00466","produto":"LYNPARZA 150MG COMP","fim vigência":"2026-03-31T23:59:00Z","tipo de acordo":"Por período","data solicitação":"11/11/2025","início vigência":"2025-11-11T00:00:00Z"},
{"status do contrato":"Vigentes","categoria produto":"Medicamentos","id contrato":2173188,"razão social do cliente":"Unimed Vitória Cooperativa de Trabalho Médico","valor unitário":2824.0570000000,"quantidade acordada":"Não Estipulado","dias para encerramento do acordo":"56","cnpj cliente":"27.578.434/0015-25","título":"ACORDO REF. MEDICAMENTOS ASTRAZENECA - AX REF 0001-00466","produto":"IMFINZI 120MG/2,4 ML - FA (?C)","fim vigência":"2026-03-31T23:59:00Z","tipo de acordo":"Por período","data solicitação":"17/06/2025","início vigência":"2025-06-17T00:00:00Z"},
{"status do contrato":"Vigentes","categoria produto":"Medicamentos","id contrato":2173188,"razão social do cliente":"Unimed Vitória Cooperativa de Trabalho Médico","valor unitário":626.0430000000,"quantidade acordada":"Não Estipulado","dias para encerramento do acordo":"56","cnpj cliente":"27.578.434/0015-25","título":"ACORDO REF. MEDICAMENTOS ASTRAZENECA - AX REF 0001-00466","produto":"TRUQAP 200 MG COMP","fim vigência":"2026-03-31T23:59:00Z","tipo de acordo":"Por período","data solicitação":"17/06/2025","início vigência":"2025-06-17T00:00:00Z"},
{"status do contrato":"Vigentes","categoria produto":"Medicamentos","id contrato":5358259,"razão social do cliente":"Unimed Vitória Cooperativa de Trabalho Médico","valor unitário":1023.2340000000,"quantidade acordada":"Não Estipulado","dias para encerramento do acordo":"56","cnpj cliente":"27.578.434/0015-25","título":"ACORDO REF. MEDICAMENTOS ASTRAZENECA - AX REF 0001-00466","produto":"TAGRISSO 80MG - COMP","fim vigência":"2026-03-31T23:59:00Z","tipo de acordo":"Por período","data solicitação":"11/11/2025","início vigência":"2025-11-11T00:00:00Z"},
{"status do contrato":"Vigentes","categoria produto":"Medicamentos","id contrato":5358259,"razão social do cliente":"Unimed Vitória Cooperativa de Trabalho Médico","valor unitário":2824.0570000000,"quantidade acordada":"Não Estipulado","dias para encerramento do acordo":"56","cnpj cliente":"27.578.434/0015-25","título":"ACORDO REF. MEDICAMENTOS ASTRAZENECA - AX REF 0001-00466","produto":"IMFINZI 120MG/2,4 ML - FA (?C)","fim vigência":"2026-03-31T23:59:00Z","tipo de acordo":"Por período","data solicitação":"11/11/2025","início vigência":"2025-11-11T00:00:00Z"},
{"status do contrato":"Vigentes","categoria produto":"Medicamentos","id contrato":5358259,"razão social do cliente":"Unimed Vitória Cooperativa de Trabalho Médico","valor unitário":413.0710000000,"quantidade acordada":"Não Estipulado","dias para encerramento do acordo":"56","cnpj cliente":"27.578.434/0015-25","título":"ACORDO REF. MEDICAMENTOS ASTRAZENECA - AX REF 0001-00466","produto":"ZOLADEX 3,6MG  - SERINGA (?C)","fim vigência":"2026-03-31T23:59:00Z","tipo de acordo":"Por período","data solicitação":"11/11/2025","início vigência":"2025-11-11T00:00:00Z"},
{"status do contrato":"Vigentes","categoria produto":"Medicamentos","id contrato":5358259,"razão social do cliente":"Unimed Vitória Cooperativa de Trabalho Médico","valor unitário":225.0290000000,"quantidade acordada":"Não Estipulado","dias para encerramento do acordo":"56","cnpj cliente":"27.578.434/0015-25","título":"ACORDO REF. MEDICAMENTOS ASTRAZENECA - AX REF 0001-00466","produto":"LYNPARZA 100MG COMP","fim vigência":"2026-03-31T23:59:00Z","tipo de acordo":"Por período","data solicitação":"11/11/2025","início vigência":"2025-11-11T00:00:00Z"},
{"status do contrato":"Vigentes","categoria produto":"Medicamentos","id contrato":5358259,"razão social do cliente":"Unimed Vitória Cooperativa de Trabalho Médico","valor unitário":1023.2340000000,"quantidade acordada":"Não Estipulado","dias para encerramento do acordo":"56","cnpj cliente":"27.578.434/0015-25","título":"ACORDO REF. MEDICAMENTOS ASTRAZENECA - AX REF 0001-00466","produto":"TAGRISSO 40MG COMP","fim vigência":"2026-03-31T23:59:00Z","tipo de acordo":"Por período","data solicitação":"11/11/2025","início vigência":"2025-11-11T00:00:00Z"},
{"status do contrato":"Vigentes","categoria produto":"Medicamentos","id contrato":2173188,"razão social do cliente":"Unimed Vitória Cooperativa de Trabalho Médico","valor unitário":7769.8850000000,"quantidade acordada":"Não Estipulado","dias para encerramento do acordo":"56","cnpj cliente":"27.578.434/0015-25","título":"ACORDO REF. MEDICAMENTOS ASTRAZENECA - AX REF 0001-00466","produto":"TEZSPIRE 110MG/ML SER 1,91 ML","fim vigência":"2026-03-31T23:59:00Z","tipo de acordo":"Por período","data solicitação":"17/06/2025","início vigência":"2025-06-17T00:00:00Z"},
{"status do contrato":"Vigentes","categoria produto":"Medicamentos","id contrato":5358259,"razão social do cliente":"Unimed Vitória Cooperativa de Trabalho Médico","valor unitário":11302.5800000000,"quantidade acordada":"Não Estipulado","dias para encerramento do acordo":"56","cnpj cliente":"27.578.434/0015-25","título":"ACORDO REF. MEDICAMENTOS ASTRAZENECA - AX REF 0001-00466","produto":"FASENRA 30MG/ML SERINGA","fim vigência":"2026-03-31T23:59:00Z","tipo de acordo":"Por período","data solicitação":"11/11/2025","início vigência":"2025-11-11T00:00:00Z"},
{"status do contrato":"Vigentes","categoria produto":"Medicamentos","id contrato":2173188,"razão social do cliente":"Unimed Vitória Cooperativa de Trabalho Médico","valor unitário":672.7370000000,"quantidade acordada":"Não Estipulado","dias para encerramento do acordo":"56","cnpj cliente":"27.578.434/0015-25","título":"ACORDO REF. MEDICAMENTOS ASTRAZENECA - AX REF 0001-00466","produto":"ZOLADEX 10,8MG - SERINGA (?C)","fim vigência":"2026-03-31T23:59:00Z","tipo de acordo":"Por período","data solicitação":"17/06/2025","início vigência":"2025-06-17T00:00:00Z"},
{"status do contrato":"Vigentes","categoria produto":"Medicamentos","id contrato":2173188,"razão social do cliente":"Unimed Vitória Cooperativa de Trabalho Médico","valor unitário":20.4150000000,"quantidade acordada":"Não Estipulado","dias para encerramento do acordo":"56","cnpj cliente":"27.578.434/0015-25","título":"ACORDO REF. MEDICAMENTOS ASTRAZENECA - AX REF 0001-00466","produto":"ARIMIDEX 1MG - COMP","fim vigência":"2026-03-31T23:59:00Z","tipo de acordo":"Por período","data solicitação":"17/06/2025","início vigência":"2025-06-17T00:00:00Z"},
{"status do contrato":"Vigentes","categoria produto":"Medicamentos","id contrato":2173188,"razão social do cliente":"Unimed Vitória Cooperativa de Trabalho Médico","valor unitário":635.6970000000,"quantidade acordada":"Não Estipulado","dias para encerramento do acordo":"56","cnpj cliente":"27.578.434/0015-25","título":"ACORDO REF. MEDICAMENTOS ASTRAZENECA - AX REF 0001-00466","produto":"FASLODEX 250MG/5ML - SER (?C)","fim vigência":"2026-03-31T23:59:00Z","tipo de acordo":"Por período","data solicitação":"17/06/2025","início vigência":"2025-06-17T00:00:00Z"},
{"status do contrato":"Vigentes","categoria produto":"Medicamentos","id contrato":5358259,"razão social do cliente":"Unimed Vitória Cooperativa de Trabalho Médico","valor unitário":626.0430000000,"quantidade acordada":"Não Estipulado","dias para encerramento do acordo":"56","cnpj cliente":"27.578.434/0015-25","título":"ACORDO REF. MEDICAMENTOS ASTRAZENECA - AX REF 0001-00466","produto":"TRUQAP 200 MG COMP","fim vigência":"2026-03-31T23:59:00Z","tipo de acordo":"Por período","data solicitação":"11/11/2025","início vigência":"2025-11-11T00:00:00Z"},
{"status do contrato":"Vigentes","categoria produto":"Medicamentos","id contrato":2173188,"razão social do cliente":"Unimed Vitória Cooperativa de Trabalho Médico","valor unitário":1023.2340000000,"quantidade acordada":"Não Estipulado","dias para encerramento do acordo":"56","cnpj cliente":"27.578.434/0015-25","título":"ACORDO REF. MEDICAMENTOS ASTRAZENECA - AX REF 0001-00466","produto":"TAGRISSO 80MG - COMP","fim vigência":"2026-03-31T23:59:00Z","tipo de acordo":"Por período","data solicitação":"17/06/2025","início vigência":"2025-06-17T00:00:00Z"},
{"status do contrato":"Vigentes","categoria produto":"Medicamentos","id contrato":2173188,"razão social do cliente":"Unimed Vitória Cooperativa de Trabalho Médico","valor unitário":225.0290000000,"quantidade acordada":"Não Estipulado","dias para encerramento do acordo":"56","cnpj cliente":"27.578.434/0015-25","título":"ACORDO REF. MEDICAMENTOS ASTRAZENECA - AX REF 0001-00466","produto":"LYNPARZA 100MG COMP","fim vigência":"2026-03-31T23:59:00Z","tipo de acordo":"Por período","data solicitação":"17/06/2025","início vigência":"2025-06-17T00:00:00Z"},
{"status do contrato":"Vigentes","categoria produto":"Medicamentos","id contrato":5358259,"razão social do cliente":"Unimed Vitória Cooperativa de Trabalho Médico","valor unitário":51.3950000000,"quantidade acordada":"Não Estipulado","dias para encerramento do acordo":"56","cnpj cliente":"27.578.434/0015-25","título":"ACORDO REF. MEDICAMENTOS ASTRAZENECA - AX REF 0001-00466","produto":"CICLOSSILICATO DE ZIRCONIO SACHE 5 GR","fim vigência":"2026-03-31T23:59:00Z","tipo de acordo":"Por período","data solicitação":"11/11/2025","início vigência":"2025-11-11T00:00:00Z"},
{"status do contrato":"Vigentes","categoria produto":"Medicamentos","id contrato":5358259,"razão social do cliente":"Unimed Vitória Cooperativa de Trabalho Médico","valor unitário":626.0430000000,"quantidade acordada":"Não Estipulado","dias para encerramento do acordo":"56","cnpj cliente":"27.578.434/0015-25","título":"ACORDO REF. MEDICAMENTOS ASTRAZENECA - AX REF 0001-00466","produto":"TRUQAP 64COM 160MG","fim vigência":"2026-03-31T23:59:00Z","tipo de acordo":"Por período","data solicitação":"11/11/2025","início vigência":"2025-11-11T00:00:00Z"},
{"status do contrato":"Vigentes","categoria produto":"Medicamentos","id contrato":5358259,"razão social do cliente":"Unimed Vitória Cooperativa de Trabalho Médico","valor unitário":126.0080000000,"quantidade acordada":"Não Estipulado","dias para encerramento do acordo":"56","cnpj cliente":"27.578.434/0015-25","título":"ACORDO REF. MEDICAMENTOS ASTRAZENECA - AX REF 0001-00466","produto":"IRESSA 250MG - COMP","fim vigência":"2026-03-31T23:59:00Z","tipo de acordo":"Por período","data solicitação":"11/11/2025","início vigência":"2025-11-11T00:00:00Z"},
{"status do contrato":"Vigentes","categoria produto":"Medicamentos","id contrato":5403211,"razão social do cliente":"Associação Hospitalar de Proteção à Infância Dr. Raul Carneiro - Hospital Pequeno Príncipe","valor unitário":608.0000000000,"quantidade acordada":"Não Estipulado","dias para encerramento do acordo":"56","cnpj cliente":"76.591.569/0001-30","título":"ACORDO COMERCIAL MEDICAMENTOS PONTUAL VA ","produto":"PEGFILGRASTIM 6MG/0,6ML SOL INJ CT SER  | Seringa | ACCORD, ACCORD  PELGRAZ    Seringa, AMGEN ","fim vigência":"2026-03-31T14:32:00Z","tipo de acordo":"Por período","data solicitação":"28/11/2025","início vigência":"2025-11-28T14:32:00Z"},
{"status do contrato":"Vigentes","categoria produto":"Medicamentos","id contrato":5403211,"razão social do cliente":"Associação Hospitalar de Proteção à Infância Dr. Raul Carneiro - Hospital Pequeno Príncipe","valor unitário":398.0000000000,"quantidade acordada":"Não Estipulado","dias para encerramento do acordo":"56","cnpj cliente":"76.591.569/0001-30","título":"ACORDO COMERCIAL MEDICAMENTOS PONTUAL VA ","produto":"TOPOTECANO 4MG/4ML FRASCO AMPOLA 4ML | Frasco/Ampola | *ACCORD","fim vigência":"2026-03-31T14:32:00Z","tipo de acordo":"Por período","data solicitação":"28/11/2025","início vigência":"2025-11-28T14:32:00Z"},
{"status do contrato":"Vigentes","categoria produto":"Medicamentos","id contrato":5403211,"razão social do cliente":"Associação Hospitalar de Proteção à Infância Dr. Raul Carneiro - Hospital Pequeno Príncipe","valor unitário":929.0000000000,"quantidade acordada":"Não Estipulado","dias para encerramento do acordo":"56","cnpj cliente":"76.591.569/0001-30","título":"ACORDO COMERCIAL MEDICAMENTOS PONTUAL VA ","produto":"BUSSULFANO 6MG/ML AMPOLA 10ML","fim vigência":"2026-03-31T14:32:00Z","tipo de acordo":"Por período","data solicitação":"28/11/2025","início vigência":"2025-11-28T14:32:00Z"},
{"status do contrato":"Vigentes","categoria produto":"Medicamentos","id contrato":5403211,"razão social do cliente":"Associação Hospitalar de Proteção à Infância Dr. Raul Carneiro - Hospital Pequeno Príncipe","valor unitário":1941.8800000000,"quantidade acordada":"Não Estipulado","dias para encerramento do acordo":"56","cnpj cliente":"76.591.569/0001-30","título":"ACORDO COMERCIAL MEDICAMENTOS PONTUAL VA ","produto":"TOCILIZUMABE 200MG EM 10ML INJ | Ampola | *ROCHE","fim vigência":"2026-03-31T14:32:00Z","tipo de acordo":"Por período","data solicitação":"28/11/2025","início vigência":"2025-11-28T14:32:00Z"},
{"status do contrato":"Vigentes","categoria produto":"Medicamentos","id contrato":5403211,"razão social do cliente":"Associação Hospitalar de Proteção à Infância Dr. Raul Carneiro - Hospital Pequeno Príncipe","valor unitário":2920.0000000000,"quantidade acordada":"Não Estipulado","dias para encerramento do acordo":"56","cnpj cliente":"76.591.569/0001-30","título":"ACORDO COMERCIAL MEDICAMENTOS PONTUAL VA ","produto":"BELIMUMABE 400MG/4,8ML (80MG/ML) | Frasco/Ampola | *GLAXO/GSK","fim vigência":"2026-03-31T14:32:00Z","tipo de acordo":"Por período","data solicitação":"28/11/2025","início vigência":"2025-11-28T14:32:00Z"},
{"status do contrato":"Vigentes","categoria produto":"Medicamentos","id contrato":5403211,"razão social do cliente":"Associação Hospitalar de Proteção à Infância Dr. Raul Carneiro - Hospital Pequeno Príncipe","valor unitário":789.7600000000,"quantidade acordada":"Não Estipulado","dias para encerramento do acordo":"56","cnpj cliente":"76.591.569/0001-30","título":"ACORDO COMERCIAL MEDICAMENTOS PONTUAL VA ","produto":"TOCILIZUMABE 80MG EM 4ML INJ","fim vigência":"2026-03-31T14:32:00Z","tipo de acordo":"Por período","data solicitação":"28/11/2025","início vigência":"2025-11-28T14:32:00Z"},
{"status do contrato":"Vigentes","categoria produto":"Medicamentos","id contrato":2788350,"razão social do cliente":"Associação Beneficente Síria - Hospital do Coração","valor unitário":1325.9000000000,"quantidade acordada":"Não Estipulado","dias para encerramento do acordo":"56","cnpj cliente":"60.453.024/0003-90","título":"Acordo Comercial NR2006 Pontual Farma","produto":"Zoladex 10,8mg Microe Depot SER","fim vigência":"2026-03-31T08:07:00Z","tipo de acordo":"Por período","data solicitação":"30/07/2025","início vigência":"2025-07-30T08:07:00Z"},
{"status do contrato":"Vigentes","categoria produto":"Medicamentos","id contrato":2788350,"razão social do cliente":"Associação Beneficente Síria - Hospital do Coração","valor unitário":2068.1800000000,"quantidade acordada":"Não Estipulado","dias para encerramento do acordo":"56","cnpj cliente":"60.453.024/0003-90","título":"Acordo Comercial NR2006 Pontual Farma","produto":"Actemra IV 200mg/10ml FAM (NP)","fim vigência":"2026-03-31T08:07:00Z","tipo de acordo":"Por período","data solicitação":"30/07/2025","início vigência":"2025-07-30T08:07:00Z"},
{"status do contrato":"Vigentes","categoria produto":"Medicamentos","id contrato":2788350,"razão social do cliente":"Associação Beneficente Síria - Hospital do Coração","valor unitário":828.0600000000,"quantidade acordada":"Não Estipulado","dias para encerramento do acordo":"56","cnpj cliente":"60.453.024/0003-90","título":"Acordo Comercial NR2006 Pontual Farma","produto":"Actemra 80mg/4ml FAM (NP)","fim vigência":"2026-03-31T08:07:00Z","tipo de acordo":"Por período","data solicitação":"30/07/2025","início vigência":"2025-07-30T08:07:00Z"},
{"status do contrato":"Vigentes","categoria produto":"Medicamentos","id contrato":2788350,"razão social do cliente":"Associação Beneficente Síria - Hospital do Coração","valor unitário":2890.0000000000,"quantidade acordada":"Não Estipulado","dias para encerramento do acordo":"56","cnpj cliente":"60.453.024/0003-90","título":"Acordo Comercial NR2006 Pontual Farma","produto":"Benlysta 400mg FAM (NP)","fim vigência":"2026-03-31T08:07:00Z","tipo de acordo":"Por período","data solicitação":"30/07/2025","início vigência":"2025-07-30T08:07:00Z"},
{"status do contrato":"Vigentes","categoria produto":"Medicamentos","id contrato":2788350,"razão social do cliente":"Associação Beneficente Síria - Hospital do Coração","valor unitário":847.0000000000,"quantidade acordada":"Não Estipulado","dias para encerramento do acordo":"56","cnpj cliente":"60.453.024/0003-90","título":"Acordo Comercial NR2006 Pontual Farma","produto":"Benlysta 120mg FAM (NP)","fim vigência":"2026-03-31T08:07:00Z","tipo de acordo":"Por período","data solicitação":"30/07/2025","início vigência":"2025-07-30T08:07:00Z"},
{"status do contrato":"Vigentes","categoria produto":"Medicamentos","id contrato":2788350,"razão social do cliente":"Associação Beneficente Síria - Hospital do Coração","valor unitário":568.6100000000,"quantidade acordada":"Não Estipulado","dias para encerramento do acordo":"56","cnpj cliente":"60.453.024/0003-90","título":"Acordo Comercial NR2006 Pontual Farma","produto":"Ferinject 50mg/ml 10ml Amp | Ampola | CSL Vifor","fim vigência":"2026-03-31T08:07:00Z","tipo de acordo":"Por período","data solicitação":"30/07/2025","início vigência":"2025-07-30T08:07:00Z"},
{"status do contrato":"Vigentes","categoria produto":"Medicamentos","id contrato":2788350,"razão social do cliente":"Associação Beneficente Síria - Hospital do Coração","valor unitário":3.3760000000,"quantidade acordada":"Não Estipulado","dias para encerramento do acordo":"56","cnpj cliente":"60.453.024/0003-90","título":"Acordo Comercial NR2006 Pontual Farma","produto":"FORXIGA 10MG COMPRIMIDO | Comprimido | Bristol-Myers Squibb | Comprimido | Bristol-Myers Squibb | Comprimido | Bristol-Myers Squibb","fim vigência":"2026-03-31T08:07:00Z","tipo de acordo":"Por período","data solicitação":"30/07/2025","início vigência":"2025-07-30T08:07:00Z"},
{"status do contrato":"Vigentes","categoria produto":"Medicamentos","id contrato":2788350,"razão social do cliente":"Associação Beneficente Síria - Hospital do Coração","valor unitário":1966.7400000000,"quantidade acordada":"Não Estipulado","dias para encerramento do acordo":"56","cnpj cliente":"60.453.024/0003-90","título":"Acordo Comercial NR2006 Pontual Farma","produto":"Faslodex 250mg/5ml SER ","fim vigência":"2026-03-31T08:07:00Z","tipo de acordo":"Por período","data solicitação":"30/07/2025","início vigência":"2025-07-30T08:07:00Z"},
{"status do contrato":"Vigentes","categoria produto":"Medicamentos","id contrato":2788350,"razão social do cliente":"Associação Beneficente Síria - Hospital do Coração","valor unitário":517.5300000000,"quantidade acordada":"Não Estipulado","dias para encerramento do acordo":"56","cnpj cliente":"60.453.024/0003-90","título":"Acordo Comercial NR2006 Pontual Farma","produto":"Zoladex 3,6mg Microe Depot SER","fim vigência":"2026-03-31T08:07:00Z","tipo de acordo":"Por período","data solicitação":"30/07/2025","início vigência":"2025-07-30T08:07:00Z"},
{"status do contrato":"Vigentes","categoria produto":"Medicamentos","id contrato":2788350,"razão social do cliente":"Associação Beneficente Síria - Hospital do Coração","valor unitário":28475.5200000000,"quantidade acordada":"Não Estipulado","dias para encerramento do acordo":"56","cnpj cliente":"60.453.024/0003-90","título":"Acordo Comercial NR2006 Pontual Farma","produto":"Jemperli 50mg/ml 10ml FAM","fim vigência":"2026-03-31T08:07:00Z","tipo de acordo":"Por período","data solicitação":"30/07/2025","início vigência":"2025-07-30T08:07:00Z"},
{"status do contrato":"Vigentes","categoria produto":"Medicamentos","id contrato":2788350,"razão social do cliente":"Associação Beneficente Síria - Hospital do Coração","valor unitário":1390.9750000000,"quantidade acordada":"Não Estipulado","dias para encerramento do acordo":"56","cnpj cliente":"60.453.024/0003-90","título":"Acordo Comercial NR2006 Pontual Farma","produto":"Actemra SC 162mg/0,9ml (NP)","fim vigência":"2026-03-31T08:07:00Z","tipo de acordo":"Por período","data solicitação":"30/07/2025","início vigência":"2025-07-30T08:07:00Z"},
{"status do contrato":"Vigentes","categoria produto":"Medicamentos","id contrato":4304142,"razão social do cliente":"Unimed Chapeco Cooperativa de Trabalho Medico da Regiao Oeste Catarinense","valor unitário":406.1334000000,"quantidade acordada":"Não Estipulado","dias para encerramento do acordo":"56","cnpj cliente":"85.283.299/0004-34","título":"Acordo NR 2006","produto":"ZEJULA 100MG CAPSULA -  CAIXA 56 CAPS | Capsula | GLAXOSMITHKLINE BRASIL LTDA","fim vigência":"2026-03-31T00:00:00Z","tipo de acordo":"Por período","data solicitação":"24/09/2025","início vigência":"2025-08-21T00:00:00Z"},
{"status do contrato":"Vigentes","categoria produto":"Medicamentos","id contrato":5328174,"razão social do cliente":"Unimed de Presidente Prudente Cooperativa De Trabalho Médico","valor unitário":8619.0700000000,"quantidade acordada":"Não Estipulado","dias para encerramento do acordo":"56","cnpj cliente":"44.863.959/0001-26","título":"PONTUAL","produto":"Tezspire 210mg/1,91ml Seringa Preenchida | Seringa","fim vigência":"2026-03-31T00:00:00Z","tipo de acordo":"Por período","data solicitação":"03/11/2025","início vigência":"2025-11-03T00:00:00Z"},
{"status do contrato":"Vigentes","categoria produto":"Medicamentos","id contrato":5328174,"razão social do cliente":"Unimed de Presidente Prudente Cooperativa De Trabalho Médico","valor unitário":14058.0000000000,"quantidade acordada":"Não Estipulado","dias para encerramento do acordo":"56","cnpj cliente":"44.863.959/0001-26","título":"PONTUAL","produto":"Perjeta 420 Mg - Sol Inj Fa | Frasco/Ampola | -","fim vigência":"2026-03-31T00:00:00Z","tipo de acordo":"Por período","data solicitação":"03/11/2025","início vigência":"2025-11-03T00:00:00Z"},
{"status do contrato":"Vigentes","categoria produto":"Medicamentos","id contrato":5433322,"razão social do cliente":"Unimed São José dos Campos Cooperativa de Trabalho Médico - Santos Dumont Hospital","valor unitário":2476662.0000000000,"quantidade acordada":"Não Estipulado","dias para encerramento do acordo":"56","cnpj cliente":"60.214.517/0016-91","título":"PONTUAL FARMACEUTICA NR 2006 LTDA","produto":"ATEZOLIZUMABE 60 MG/ML 20ML - FRASCO-AMPOLA - ROCHE (REF. TECENTRIQ) | Frasco/Ampola | ROCHE (REF. TECENTRIQ)","fim vigência":"2026-03-31T00:00:00Z","tipo de acordo":"Por período","data solicitação":"14/01/2026","início vigência":"2025-11-01T00:00:00Z"},
{"status do contrato":"Vigentes","categoria produto":"Medicamentos","id contrato":5433322,"razão social do cliente":"Unimed São José dos Campos Cooperativa de Trabalho Médico - Santos Dumont Hospital","valor unitário":1332977.0000000000,"quantidade acordada":"Não Estipulado","dias para encerramento do acordo":"56","cnpj cliente":"60.214.517/0016-91","título":"PONTUAL FARMACEUTICA NR 2006 LTDA","produto":"trastuzumabe entansina 160mg/8ml frasco-ampola (geladeira)","fim vigência":"2026-03-31T00:00:00Z","tipo de acordo":"Por período","data solicitação":"14/01/2026","início vigência":"2025-11-01T00:00:00Z"},
{"status do contrato":"Vigentes","categoria produto":"Medicamentos","id contrato":2368681,"razão social do cliente":"Unimed Marília Cooperativa De Trabalho Médico","valor unitário":11328.1600000000,"quantidade acordada":"Não Estipulado","dias para encerramento do acordo":"56","cnpj cliente":"66.872.888/0001-60","título":"ACORDO COMERCIAL - ONCO - PONTUAL","produto":"KESIMPTA 20MG/0,4ML (CANETA PREENCHIDA) | Unidade","fim vigência":"2026-03-31T00:00:00Z","tipo de acordo":"Por período","data solicitação":"07/07/2025","início vigência":"2025-07-07T00:00:00Z"},
{"status do contrato":"Vigentes","categoria produto":"Medicamentos","id contrato":4304142,"razão social do cliente":"Unimed Chapeco Cooperativa de Trabalho Medico da Regiao Oeste Catarinense","valor unitário":88.6625000000,"quantidade acordada":"Não Estipulado","dias para encerramento do acordo":"56","cnpj cliente":"85.283.299/0004-34","título":"Acordo NR 2006","produto":"NUBEQA 300 MG COMPRIMIDO REVESTIDO","fim vigência":"2026-03-31T00:00:00Z","tipo de acordo":"Por período","data solicitação":"24/09/2025","início vigência":"2025-08-21T00:00:00Z"},
{"status do contrato":"Vigentes","categoria produto":"Medicamentos","id contrato":5433314,"razão social do cliente":"Unimed São José dos Campos Cooperativa de Trabalho Médico - Santos Dumont Hospital","valor unitário":133951.0000000000,"quantidade acordada":"Não Estipulado","dias para encerramento do acordo":"56","cnpj cliente":"60.214.517/0016-91","título":"PONTUAL FARMACEUTICA NR 2006 LTDA","produto":"TOXINA BOTULÍNICA TIPO A 300 UI - FRASCO-AMPOLA - GALDERMA (REF. DYSPORT) | Frasco/Ampola | GALDERMA (REF. DYSPORT)","fim vigência":"2026-03-31T00:00:00Z","tipo de acordo":"Por período","data solicitação":"14/01/2026","início vigência":"2025-12-01T00:00:00Z"},
{"status do contrato":"Vigentes","categoria produto":"Medicamentos","id contrato":5328174,"razão social do cliente":"Unimed de Presidente Prudente Cooperativa De Trabalho Médico","valor unitário":3005.0000000000,"quantidade acordada":"Não Estipulado","dias para encerramento do acordo":"56","cnpj cliente":"44.863.959/0001-26","título":"PONTUAL","produto":"Vabysmo 120mg/ml - Inj 0,24ml | Peça | -","fim vigência":"2026-03-31T00:00:00Z","tipo de acordo":"Por período","data solicitação":"03/11/2025","início vigência":"2025-11-03T00:00:00Z"},
{"status do contrato":"Vigentes","categoria produto":"Medicamentos","id contrato":2368681,"razão social do cliente":"Unimed Marília Cooperativa De Trabalho Médico","valor unitário":5.0320000000,"quantidade acordada":"Não Estipulado","dias para encerramento do acordo":"56","cnpj cliente":"66.872.888/0001-60","título":"ACORDO COMERCIAL - ONCO - PONTUAL","produto":"NOVALDEX-D 20MG COM 30 (ASTRAZENECA) - COMPRIMIDO | Comprimido | ACEITA ALTERNATIVAS","fim vigência":"2026-03-31T00:00:00Z","tipo de acordo":"Por período","data solicitação":"07/07/2025","início vigência":"2025-07-07T00:00:00Z"},
{"status do contrato":"Vigentes","categoria produto":"Medicamentos","id contrato":2368681,"razão social do cliente":"Unimed Marília Cooperativa De Trabalho Médico","valor unitário":1244.2500000000,"quantidade acordada":"Não Estipulado","dias para encerramento do acordo":"56","cnpj cliente":"66.872.888/0001-60","título":"ACORDO COMERCIAL - ONCO - PONTUAL","produto":"CABOMETYX - LEVOMALATO DE CABOZANTINIBE 40MG CX C/30 COMPRIMIDO | Unidade | -","fim vigência":"2026-03-31T00:00:00Z","tipo de acordo":"Por período","data solicitação":"07/07/2025","início vigência":"2025-07-07T00:00:00Z"},
{"status do contrato":"Vigentes","categoria produto":"Medicamentos","id contrato":5448212,"razão social do cliente":"Unimed São José dos Campos Cooperativa de Trabalho Médico - Santos Dumont Hospital","valor unitário":450.6900000000,"quantidade acordada":"1","dias para encerramento do acordo":"56","cnpj cliente":"60.214.517/0016-91","título":"Acordo de Fornecimento - 3364","produto":"ACALABRUTINIBE 100MG C/60 CAPSULAS - CAPSULAS - ASTRA ZENECA | Capsula | ASTRA ZENECA","fim vigência":"2026-03-31T00:00:00Z","tipo de acordo":"Por quantidade e período","data solicitação":"29/01/2026","início vigência":"2026-01-15T00:00:00Z"},
{"status do contrato":"Vigentes","categoria produto":"Medicamentos","id contrato":2368681,"razão social do cliente":"Unimed Marília Cooperativa De Trabalho Médico","valor unitário":372.1800000000,"quantidade acordada":"Não Estipulado","dias para encerramento do acordo":"56","cnpj cliente":"66.872.888/0001-60","título":"ACORDO COMERCIAL - ONCO - PONTUAL","produto":"ZEJULA 100MG COMP CX C/ 56 | Unidade","fim vigência":"2026-03-31T00:00:00Z","tipo de acordo":"Por período","data solicitação":"07/07/2025","início vigência":"2025-07-07T00:00:00Z"},
{"status do contrato":"Vigentes","categoria produto":"Medicamentos","id contrato":5433308,"razão social do cliente":"Unimed São José dos Campos Cooperativa de Trabalho Médico - Santos Dumont Hospital","valor unitário":38034.0000000000,"quantidade acordada":"Não Estipulado","dias para encerramento do acordo":"56","cnpj cliente":"60.214.517/0016-91","título":"PONTUAL FARMACEUTICA NR 2006 LTDA","produto":"TOSILATO DE NIRAPARIBE 100MG CAPS. - CAPSULA | Capsula | -","fim vigência":"2026-03-31T00:00:00Z","tipo de acordo":"Por período","data solicitação":"14/01/2026","início vigência":"2025-12-01T00:00:00Z"},
{"status do contrato":"Vigentes","categoria produto":"Medicamentos","id contrato":2368681,"razão social do cliente":"Unimed Marília Cooperativa De Trabalho Médico","valor unitário":849.8700000000,"quantidade acordada":"Não Estipulado","dias para encerramento do acordo":"56","cnpj cliente":"66.872.888/0001-60","título":"ACORDO COMERCIAL - ONCO - PONTUAL","produto":"BENLYSTA (BELIMUMABE) 120 MG - FRASCO/AMPOLA | Frasco/Ampola | ACEITA ALTERNATIVAS","fim vigência":"2026-03-31T00:00:00Z","tipo de acordo":"Por período","data solicitação":"07/07/2025","início vigência":"2025-07-07T00:00:00Z"},
{"status do contrato":"Vigentes","categoria produto":"Medicamentos","id contrato":2368681,"razão social do cliente":"Unimed Marília Cooperativa De Trabalho Médico","valor unitário":39950.0000000000,"quantidade acordada":"Não Estipulado","dias para encerramento do acordo":"56","cnpj cliente":"66.872.888/0001-60","título":"ACORDO COMERCIAL - ONCO - PONTUAL","produto":"OCREVUS 300 MG (OCRELIZUMABE) - FRASCO/AMPOLA | Frasco/Ampola | ACEITA ALTERNATIVAS","fim vigência":"2026-03-31T00:00:00Z","tipo de acordo":"Por período","data solicitação":"07/07/2025","início vigência":"2025-07-07T00:00:00Z"},
{"status do contrato":"Vigentes","categoria produto":"Medicamentos","id contrato":5328174,"razão social do cliente":"Unimed de Presidente Prudente Cooperativa De Trabalho Médico","valor unitário":482.3000000000,"quantidade acordada":"Não Estipulado","dias para encerramento do acordo":"56","cnpj cliente":"44.863.959/0001-26","título":"PONTUAL","produto":"Calquence 100mg - 60cap | Capsula | -","fim vigência":"2026-03-31T00:00:00Z","tipo de acordo":"Por período","data solicitação":"03/11/2025","início vigência":"2025-11-03T00:00:00Z"},
{"status do contrato":"Vigentes","categoria produto":"Medicamentos","id contrato":5433322,"razão social do cliente":"Unimed São José dos Campos Cooperativa de Trabalho Médico - Santos Dumont Hospital","valor unitário":136979.0000000000,"quantidade acordada":"Não Estipulado","dias para encerramento do acordo":"56","cnpj cliente":"60.214.517/0016-91","título":"PONTUAL FARMACEUTICA NR 2006 LTDA","produto":"Tocilizumabe 162mg/0,9ml Seringa Preenchida | Seringa | Roche","fim vigência":"2026-03-31T00:00:00Z","tipo de acordo":"Por período","data solicitação":"14/01/2026","início vigência":"2025-11-01T00:00:00Z"},
{"status do contrato":"Vigentes","categoria produto":"Medicamentos","id contrato":5328174,"razão social do cliente":"Unimed de Presidente Prudente Cooperativa De Trabalho Médico","valor unitário":10.1200000000,"quantidade acordada":"Não Estipulado","dias para encerramento do acordo":"56","cnpj cliente":"44.863.959/0001-26","título":"PONTUAL","produto":"Citarabina 100mg/ml - Sol Inj 1ml | Frasco/Ampola | -","fim vigência":"2026-03-31T00:00:00Z","tipo de acordo":"Por período","data solicitação":"03/11/2025","início vigência":"2025-11-03T00:00:00Z"},
{"status do contrato":"Vigentes","categoria produto":"Medicamentos","id contrato":2368681,"razão social do cliente":"Unimed Marília Cooperativa De Trabalho Médico","valor unitário":4207.6900000000,"quantidade acordada":"Não Estipulado","dias para encerramento do acordo":"56","cnpj cliente":"66.872.888/0001-60","título":"ACORDO COMERCIAL - ONCO - PONTUAL","produto":"COSENTYX 150MG (SECUQUINUMABE) - SERINGA PREENCH | Frasco/Ampola | ACEITA ALTERNATIVAS","fim vigência":"2026-03-31T00:00:00Z","tipo de acordo":"Por período","data solicitação":"07/07/2025","início vigência":"2025-07-07T00:00:00Z"},
{"status do contrato":"Vigentes","categoria produto":"Medicamentos","id contrato":5328174,"razão social do cliente":"Unimed de Presidente Prudente Cooperativa De Trabalho Médico","valor unitário":11269.4600000000,"quantidade acordada":"Não Estipulado","dias para encerramento do acordo":"56","cnpj cliente":"44.863.959/0001-26","título":"PONTUAL","produto":"Kesimpta 20mg/0,4ml - Ser Inj | Seringa | -","fim vigência":"2026-03-31T00:00:00Z","tipo de acordo":"Por período","data solicitação":"03/11/2025","início vigência":"2025-11-03T00:00:00Z"},
{"status do contrato":"Vigentes","categoria produto":"Medicamentos","id contrato":5328174,"razão social do cliente":"Unimed de Presidente Prudente Cooperativa De Trabalho Médico","valor unitário":126000.0000000000,"quantidade acordada":"Não Estipulado","dias para encerramento do acordo":"56","cnpj cliente":"44.863.959/0001-26","título":"PONTUAL","produto":"Imjudo 300mg Sol. Inj Frasco Ampola 15ml | Frasco/Ampola | -","fim vigência":"2026-03-31T00:00:00Z","tipo de acordo":"Por período","data solicitação":"03/11/2025","início vigência":"2025-11-03T00:00:00Z"},
{"status do contrato":"Vigentes","categoria produto":"Medicamentos","id contrato":2368681,"razão social do cliente":"Unimed Marília Cooperativa De Trabalho Médico","valor unitário":7712.1600000000,"quantidade acordada":"Não Estipulado","dias para encerramento do acordo":"56","cnpj cliente":"66.872.888/0001-60","título":"ACORDO COMERCIAL - ONCO - PONTUAL","produto":"TEZSPIRE 210MG/1,91ML SERINGA PREENCH | Unidade","fim vigência":"2026-03-31T00:00:00Z","tipo de acordo":"Por período","data solicitação":"07/07/2025","início vigência":"2025-07-07T00:00:00Z"},
{"status do contrato":"Vigentes","categoria produto":"Medicamentos","id contrato":5328174,"razão social do cliente":"Unimed de Presidente Prudente Cooperativa De Trabalho Médico","valor unitário":815.0000000000,"quantidade acordada":"Não Estipulado","dias para encerramento do acordo":"56","cnpj cliente":"44.863.959/0001-26","título":"PONTUAL","produto":"Actemra 20mg/ml - Sol Inj 4ml | Frasco/Ampola | -","fim vigência":"2026-03-31T00:00:00Z","tipo de acordo":"Por período","data solicitação":"03/11/2025","início vigência":"2025-11-03T00:00:00Z"},
{"status do contrato":"Vigentes","categoria produto":"Medicamentos","id contrato":2368681,"razão social do cliente":"Unimed Marília Cooperativa De Trabalho Médico","valor unitário":444.7600000000,"quantidade acordada":"Não Estipulado","dias para encerramento do acordo":"56","cnpj cliente":"66.872.888/0001-60","título":"ACORDO COMERCIAL - ONCO - PONTUAL","produto":"ZOLADEX 3.6 MG (ASTRA ZENECA) - SERINGA | Seringa | ACEITA ALTERNATIVAS","fim vigência":"2026-03-31T00:00:00Z","tipo de acordo":"Por período","data solicitação":"07/07/2025","início vigência":"2025-07-07T00:00:00Z"},
{"status do contrato":"Vigentes","categoria produto":"Medicamentos","id contrato":2368681,"razão social do cliente":"Unimed Marília Cooperativa De Trabalho Médico","valor unitário":3620.0000000000,"quantidade acordada":"Não Estipulado","dias para encerramento do acordo":"56","cnpj cliente":"66.872.888/0001-60","título":"ACORDO COMERCIAL - ONCO - PONTUAL","produto":"SYNAGIS 50MG - FRASCO/AMPOLA | Frasco/Ampola | ACEITA ALTERNATIVAS","fim vigência":"2026-03-31T00:00:00Z","tipo de acordo":"Por período","data solicitação":"07/07/2025","início vigência":"2025-07-07T00:00:00Z"},
{"status do contrato":"Vigentes","categoria produto":"Medicamentos","id contrato":5433322,"razão social do cliente":"Unimed São José dos Campos Cooperativa de Trabalho Médico - Santos Dumont Hospital","valor unitário":139662.0000000000,"quantidade acordada":"Não Estipulado","dias para encerramento do acordo":"56","cnpj cliente":"60.214.517/0016-91","título":"PONTUAL FARMACEUTICA NR 2006 LTDA","produto":"PERTUZUMABE 420MG/14ML - FRASCO-AMPOLA - ROCHE | Frasco/Ampola | ROCHE","fim vigência":"2026-03-31T00:00:00Z","tipo de acordo":"Por período","data solicitação":"14/01/2026","início vigência":"2025-11-01T00:00:00Z"},
{"status do contrato":"Vigentes","categoria produto":"Medicamentos","id contrato":2368681,"razão social do cliente":"Unimed Marília Cooperativa De Trabalho Médico","valor unitário":3251.0000000000,"quantidade acordada":"Não Estipulado","dias para encerramento do acordo":"56","cnpj cliente":"66.872.888/0001-60","título":"ACORDO COMERCIAL - ONCO - PONTUAL","produto":"NUCALA 40MG (MEPOLIZUMABE) SERINGA PREENCH 1ML | Unidade","fim vigência":"2026-03-31T00:00:00Z","tipo de acordo":"Por período","data solicitação":"07/07/2025","início vigência":"2025-07-07T00:00:00Z"},
{"status do contrato":"Vigentes","categoria produto":"Medicamentos","id contrato":5328174,"razão social do cliente":"Unimed de Presidente Prudente Cooperativa De Trabalho Médico","valor unitário":3048.0000000000,"quantidade acordada":"Não Estipulado","dias para encerramento do acordo":"56","cnpj cliente":"44.863.959/0001-26","título":"PONTUAL","produto":"Imfinzi 120 Mg/2,4 Ml - Sol Inj Fa 2,4 Ml | Frasco/Ampola | -","fim vigência":"2026-03-31T00:00:00Z","tipo de acordo":"Por período","data solicitação":"03/11/2025","início vigência":"2025-11-03T00:00:00Z"},
{"status do contrato":"Vigentes","categoria produto":"Medicamentos","id contrato":5433322,"razão social do cliente":"Unimed São José dos Campos Cooperativa de Trabalho Médico - Santos Dumont Hospital","valor unitário":81545.0000000000,"quantidade acordada":"Não Estipulado","dias para encerramento do acordo":"56","cnpj cliente":"60.214.517/0016-91","título":"PONTUAL FARMACEUTICA NR 2006 LTDA","produto":"TOCILIZUMABE 80MG/4ML - FRASCO/AMPOLA - ROCHE | Frasco/Ampola | ROCHE","fim vigência":"2026-03-31T00:00:00Z","tipo de acordo":"Por período","data solicitação":"14/01/2026","início vigência":"2025-11-01T00:00:00Z"},
{"status do contrato":"Vigentes","categoria produto":"Medicamentos","id contrato":2368681,"razão social do cliente":"Unimed Marília Cooperativa De Trabalho Médico","valor unitário":56.9000000000,"quantidade acordada":"Não Estipulado","dias para encerramento do acordo":"56","cnpj cliente":"66.872.888/0001-60","título":"ACORDO COMERCIAL - ONCO - PONTUAL","produto":"NEXAVAR 200 MG 60 BAYER - COMPRIMIDO | Comprimido | ACEITA ALTERNATIVAS","fim vigência":"2026-03-31T00:00:00Z","tipo de acordo":"Por período","data solicitação":"07/07/2025","início vigência":"2025-07-07T00:00:00Z"},
{"status do contrato":"Vigentes","categoria produto":"Medicamentos","id contrato":5328174,"razão social do cliente":"Unimed de Presidente Prudente Cooperativa De Trabalho Médico","valor unitário":8300.0000000000,"quantidade acordada":"Não Estipulado","dias para encerramento do acordo":"56","cnpj cliente":"44.863.959/0001-26","título":"PONTUAL","produto":"Kadcyla 100 Mg - Sol Inj Fa | Frasco/Ampola | -","fim vigência":"2026-03-31T00:00:00Z","tipo de acordo":"Por período","data solicitação":"03/11/2025","início vigência":"2025-11-03T00:00:00Z"},
{"status do contrato":"Vigentes","categoria produto":"Medicamentos","id contrato":5433314,"razão social do cliente":"Unimed São José dos Campos Cooperativa de Trabalho Médico - Santos Dumont Hospital","valor unitário":222698.0000000000,"quantidade acordada":"Não Estipulado","dias para encerramento do acordo":"56","cnpj cliente":"60.214.517/0016-91","título":"PONTUAL FARMACEUTICA NR 2006 LTDA","produto":"TOXINA BOTULINICA TIPO A 500U - FRASCO-AMPOLA - IPSEN | Frasco/Ampola | IPSEN","fim vigência":"2026-03-31T00:00:00Z","tipo de acordo":"Por período","data solicitação":"14/01/2026","início vigência":"2025-12-01T00:00:00Z"},
{"status do contrato":"Vigentes","categoria produto":"Medicamentos","id contrato":5433314,"razão social do cliente":"Unimed São José dos Campos Cooperativa de Trabalho Médico - Santos Dumont Hospital","valor unitário":134103.0000000000,"quantidade acordada":"Não Estipulado","dias para encerramento do acordo":"56","cnpj cliente":"60.214.517/0016-91","título":"PONTUAL FARMACEUTICA NR 2006 LTDA","produto":"LEVOMALATO CABOZANTINIBE 40MG CP. | Comprimido | Ipsen","fim vigência":"2026-03-31T00:00:00Z","tipo de acordo":"Por período","data solicitação":"14/01/2026","início vigência":"2025-12-01T00:00:00Z"},
{"status do contrato":"Vigentes","categoria produto":"Medicamentos","id contrato":5448212,"razão social do cliente":"Unimed São José dos Campos Cooperativa de Trabalho Médico - Santos Dumont Hospital","valor unitário":838.6000000000,"quantidade acordada":"1","dias para encerramento do acordo":"56","cnpj cliente":"60.214.517/0016-91","título":"Acordo de Fornecimento - 3364","produto":"BELIMUMABE 120MG INJETÁVEL - FRASCO-AMPOLA - GSK | Frasco/Ampola | GSK","fim vigência":"2026-03-31T00:00:00Z","tipo de acordo":"Por quantidade e período","data solicitação":"29/01/2026","início vigência":"2026-01-15T00:00:00Z"},
{"status do contrato":"Vigentes","categoria produto":"Medicamentos","id contrato":5433314,"razão social do cliente":"Unimed São José dos Campos Cooperativa de Trabalho Médico - Santos Dumont Hospital","valor unitário":67052.0000000000,"quantidade acordada":"Não Estipulado","dias para encerramento do acordo":"56","cnpj cliente":"60.214.517/0016-91","título":"PONTUAL FARMACEUTICA NR 2006 LTDA","produto":"LEVOMALATO CABOZANTINIBE 20MG CP. / IPSEN | Comprimido | IPSEN","fim vigência":"2026-03-31T00:00:00Z","tipo de acordo":"Por período","data solicitação":"14/01/2026","início vigência":"2025-12-01T00:00:00Z"},
{"status do contrato":"Vigentes","categoria produto":"Medicamentos","id contrato":2368681,"razão social do cliente":"Unimed Marília Cooperativa De Trabalho Médico","valor unitário":2607.0000000000,"quantidade acordada":"Não Estipulado","dias para encerramento do acordo":"56","cnpj cliente":"66.872.888/0001-60","título":"ACORDO COMERCIAL - ONCO - PONTUAL","produto":"XOLAIR 150MG (OMALIZUMABE) SER PREENC CX / 1 | Unidade | -","fim vigência":"2026-03-31T00:00:00Z","tipo de acordo":"Por período","data solicitação":"07/07/2025","início vigência":"2025-07-07T00:00:00Z"},
{"status do contrato":"Vigentes","categoria produto":"Medicamentos","id contrato":5328174,"razão social do cliente":"Unimed de Presidente Prudente Cooperativa De Trabalho Médico","valor unitário":410.0000000000,"quantidade acordada":"Não Estipulado","dias para encerramento do acordo":"56","cnpj cliente":"44.863.959/0001-26","título":"PONTUAL","produto":"Zoladex 3,6 Mg - 1 Ser | Seringa | -","fim vigência":"2026-03-31T00:00:00Z","tipo de acordo":"Por período","data solicitação":"03/11/2025","início vigência":"2025-11-03T00:00:00Z"},
{"status do contrato":"Vigentes","categoria produto":"Medicamentos","id contrato":5328174,"razão social do cliente":"Unimed de Presidente Prudente Cooperativa De Trabalho Médico","valor unitário":3986.0000000000,"quantidade acordada":"Não Estipulado","dias para encerramento do acordo":"56","cnpj cliente":"44.863.959/0001-26","título":"PONTUAL","produto":"Somatuline Autogel 120 Mg - Sol Inj Lib Prol Ser Pre 0,5ml | Seringa | -","fim vigência":"2026-03-31T00:00:00Z","tipo de acordo":"Por período","data solicitação":"03/11/2025","início vigência":"2025-11-03T00:00:00Z"},
{"status do contrato":"Vigentes","categoria produto":"Medicamentos","id contrato":5433322,"razão social do cliente":"Unimed São José dos Campos Cooperativa de Trabalho Médico - Santos Dumont Hospital","valor unitário":203247.0000000000,"quantidade acordada":"Não Estipulado","dias para encerramento do acordo":"56","cnpj cliente":"60.214.517/0016-91","título":"PONTUAL FARMACEUTICA NR 2006 LTDA","produto":"Tocilizumabe 200mg/10ml frasco-ampola (geladeira) - FRASCO/AMPOLA - ROCHE (Ref.Actemra) | Frasco/Ampola | ROCHE (Ref.Actemra)","fim vigência":"2026-03-31T00:00:00Z","tipo de acordo":"Por período","data solicitação":"14/01/2026","início vigência":"2025-11-01T00:00:00Z"},
{"status do contrato":"Vigentes","categoria produto":"Medicamentos","id contrato":5433322,"razão social do cliente":"Unimed São José dos Campos Cooperativa de Trabalho Médico - Santos Dumont Hospital","valor unitário":4752.0000000000,"quantidade acordada":"Não Estipulado","dias para encerramento do acordo":"56","cnpj cliente":"60.214.517/0016-91","título":"PONTUAL FARMACEUTICA NR 2006 LTDA","produto":"PIRFENIDONA 267MG - CAPSULA - ROCHE | Capsula | ROCHE","fim vigência":"2026-03-31T00:00:00Z","tipo de acordo":"Por período","data solicitação":"14/01/2026","início vigência":"2025-11-01T00:00:00Z"},
{"status do contrato":"Vigentes","categoria produto":"Medicamentos","id contrato":2368681,"razão social do cliente":"Unimed Marília Cooperativa De Trabalho Médico","valor unitário":1359.9900000000,"quantidade acordada":"Não Estipulado","dias para encerramento do acordo":"56","cnpj cliente":"66.872.888/0001-60","título":"ACORDO COMERCIAL - ONCO - PONTUAL","produto":"ACTEMRA SC 162 MG SERINGA PREENC | Unidade | -","fim vigência":"2026-03-31T00:00:00Z","tipo de acordo":"Por período","data solicitação":"07/07/2025","início vigência":"2025-07-07T00:00:00Z"},
{"status do contrato":"Vigentes","categoria produto":"Medicamentos","id contrato":4304142,"razão social do cliente":"Unimed Chapeco Cooperativa de Trabalho Medico da Regiao Oeste Catarinense","valor unitário":406.1332000000,"quantidade acordada":"Não Estipulado","dias para encerramento do acordo":"56","cnpj cliente":"85.283.299/0004-34","título":"Acordo NR 2006","produto":"ZEJULA 100MG CAPSULA  - CAIXA 28 CAPS | Capsula | GLAXOSMITHKLINE BRASIL LTDA","fim vigência":"2026-03-31T00:00:00Z","tipo de acordo":"Por período","data solicitação":"24/09/2025","início vigência":"2025-08-21T00:00:00Z"},
{"status do contrato":"Vigentes","categoria produto":"Medicamentos","id contrato":5328174,"razão social do cliente":"Unimed de Presidente Prudente Cooperativa De Trabalho Médico","valor unitário":83.9000000000,"quantidade acordada":"Não Estipulado","dias para encerramento do acordo":"56","cnpj cliente":"44.863.959/0001-26","título":"PONTUAL","produto":"Nubeqa 300mg - 120comp","fim vigência":"2026-03-31T00:00:00Z","tipo de acordo":"Por período","data solicitação":"03/11/2025","início vigência":"2025-11-03T00:00:00Z"},
{"status do contrato":"Vigentes","categoria produto":"Medicamentos","id contrato":2368681,"razão social do cliente":"Unimed Marília Cooperativa De Trabalho Médico","valor unitário":18.3200000000,"quantidade acordada":"Não Estipulado","dias para encerramento do acordo":"56","cnpj cliente":"66.872.888/0001-60","título":"ACORDO COMERCIAL - ONCO - PONTUAL","produto":"ARIMIDEX 1 MG- ASTRAZENECA 28  - COMPRIMIDO | Comprimido | ACEITA ALTERNATIVAS","fim vigência":"2026-03-31T00:00:00Z","tipo de acordo":"Por período","data solicitação":"07/07/2025","início vigência":"2025-07-07T00:00:00Z"},
{"status do contrato":"Vigentes","categoria produto":"Medicamentos","id contrato":5328174,"razão social do cliente":"Unimed de Presidente Prudente Cooperativa De Trabalho Médico","valor unitário":7829.0000000000,"quantidade acordada":"Não Estipulado","dias para encerramento do acordo":"56","cnpj cliente":"44.863.959/0001-26","título":"PONTUAL","produto":"Nucala 100mg/ml Sol Inj - Caneta Preenchida | Caneta","fim vigência":"2026-03-31T00:00:00Z","tipo de acordo":"Por período","data solicitação":"03/11/2025","início vigência":"2025-11-03T00:00:00Z"},
{"status do contrato":"Vigentes","categoria produto":"Medicamentos","id contrato":5328174,"razão social do cliente":"Unimed de Presidente Prudente Cooperativa De Trabalho Médico","valor unitário":1045.7000000000,"quantidade acordada":"Não Estipulado","dias para encerramento do acordo":"56","cnpj cliente":"44.863.959/0001-26","título":"PONTUAL","produto":"Cabometyx 60mg - Comp Rev 30comp | Comprimido | -","fim vigência":"2026-03-31T00:00:00Z","tipo de acordo":"Por período","data solicitação":"03/11/2025","início vigência":"2025-11-03T00:00:00Z"},
{"status do contrato":"Vigentes","categoria produto":"Medicamentos","id contrato":2368681,"razão social do cliente":"Unimed Marília Cooperativa De Trabalho Médico","valor unitário":89.4300000000,"quantidade acordada":"Não Estipulado","dias para encerramento do acordo":"56","cnpj cliente":"66.872.888/0001-60","título":"ACORDO COMERCIAL - ONCO - PONTUAL","produto":"NUBEQA 300MG COMP CX C/120 | Unidade","fim vigência":"2026-03-31T00:00:00Z","tipo de acordo":"Por período","data solicitação":"07/07/2025","início vigência":"2025-07-07T00:00:00Z"},
{"status do contrato":"Vigentes","categoria produto":"Medicamentos","id contrato":2368681,"razão social do cliente":"Unimed Marília Cooperativa De Trabalho Médico","valor unitário":820.0000000000,"quantidade acordada":"Não Estipulado","dias para encerramento do acordo":"56","cnpj cliente":"66.872.888/0001-60","título":"ACORDO COMERCIAL - ONCO - PONTUAL","produto":"ACTEMRA 80 MG - FRASCO/AMPOLA | Frasco/Ampola | ACEITA ALTERNATIVAS","fim vigência":"2026-03-31T00:00:00Z","tipo de acordo":"Por período","data solicitação":"07/07/2025","início vigência":"2025-07-07T00:00:00Z"},
{"status do contrato":"Vigentes","categoria produto":"Medicamentos","id contrato":5433314,"razão social do cliente":"Unimed São José dos Campos Cooperativa de Trabalho Médico - Santos Dumont Hospital","valor unitário":377621.0000000000,"quantidade acordada":"Não Estipulado","dias para encerramento do acordo":"56","cnpj cliente":"60.214.517/0016-91","título":"PONTUAL FARMACEUTICA NR 2006 LTDA","produto":"Acetado de lanreotida 120mg seringa preenchida (geladeira) | Seringa | Ipsen","fim vigência":"2026-03-31T00:00:00Z","tipo de acordo":"Por período","data solicitação":"14/01/2026","início vigência":"2025-12-01T00:00:00Z"},
{"status do contrato":"Vigentes","categoria produto":"Medicamentos","id contrato":2368681,"razão social do cliente":"Unimed Marília Cooperativa De Trabalho Médico","valor unitário":1138.7500000000,"quantidade acordada":"Não Estipulado","dias para encerramento do acordo":"56","cnpj cliente":"66.872.888/0001-60","título":"ACORDO COMERCIAL - ONCO - PONTUAL","produto":"ZOLADEX 10.8 MG (ASTRA ZENECA) - SERINGA | Seringa | ACEITA ALTERNATIVAS","fim vigência":"2026-03-31T00:00:00Z","tipo de acordo":"Por período","data solicitação":"07/07/2025","início vigência":"2025-07-07T00:00:00Z"},
{"status do contrato":"Vigentes","categoria produto":"Medicamentos","id contrato":2368681,"razão social do cliente":"Unimed Marília Cooperativa De Trabalho Médico","valor unitário":1045.2300000000,"quantidade acordada":"Não Estipulado","dias para encerramento do acordo":"56","cnpj cliente":"66.872.888/0001-60","título":"ACORDO COMERCIAL - ONCO - PONTUAL","produto":"TAGRISSO 80MG COMP CX C/ 30 | Comprimido | -","fim vigência":"2026-03-31T00:00:00Z","tipo de acordo":"Por período","data solicitação":"07/07/2025","início vigência":"2025-07-07T00:00:00Z"},
{"status do contrato":"Vigentes","categoria produto":"Medicamentos","id contrato":5433322,"razão social do cliente":"Unimed São José dos Campos Cooperativa de Trabalho Médico - Santos Dumont Hospital","valor unitário":5623916.0000000000,"quantidade acordada":"Não Estipulado","dias para encerramento do acordo":"56","cnpj cliente":"60.214.517/0016-91","título":"PONTUAL FARMACEUTICA NR 2006 LTDA","produto":"RISDIPLAM PO SOLUÇAO ORAL 0,75MG/ML FRASCO 80ML - FRASCO / ROCHE | Frasco | ROCHE","fim vigência":"2026-03-31T00:00:00Z","tipo de acordo":"Por período","data solicitação":"14/01/2026","início vigência":"2025-11-01T00:00:00Z"},
{"status do contrato":"Vigentes","categoria produto":"Medicamentos","id contrato":2368681,"razão social do cliente":"Unimed Marília Cooperativa De Trabalho Médico","valor unitário":46.7600000000,"quantidade acordada":"Não Estipulado","dias para encerramento do acordo":"56","cnpj cliente":"66.872.888/0001-60","título":"ACORDO COMERCIAL - ONCO - PONTUAL","produto":"ESBRIET 267MG (PIRFENIDONA) FRASCO C/ 270 CAPSULAS | Unidade","fim vigência":"2026-03-31T00:00:00Z","tipo de acordo":"Por período","data solicitação":"07/07/2025","início vigência":"2025-07-07T00:00:00Z"},
{"status do contrato":"Vigentes","categoria produto":"Medicamentos","id contrato":5328174,"razão social do cliente":"Unimed de Presidente Prudente Cooperativa De Trabalho Médico","valor unitário":26432.0000000000,"quantidade acordada":"Não Estipulado","dias para encerramento do acordo":"56","cnpj cliente":"44.863.959/0001-26","título":"PONTUAL","produto":"Jemperli 50mg/ml - Inj 10ml","fim vigência":"2026-03-31T00:00:00Z","tipo de acordo":"Por período","data solicitação":"03/11/2025","início vigência":"2025-11-03T00:00:00Z"},
{"status do contrato":"Vigentes","categoria produto":"Medicamentos","id contrato":5433322,"razão social do cliente":"Unimed São José dos Campos Cooperativa de Trabalho Médico - Santos Dumont Hospital","valor unitário":3936447.0000000000,"quantidade acordada":"Não Estipulado","dias para encerramento do acordo":"56","cnpj cliente":"60.214.517/0016-91","título":"PONTUAL FARMACEUTICA NR 2006 LTDA","produto":"OCRELIZUMABE 300MG/10ML - FRASCO/AMPOLA - ROCHE REF.OCREVUS | Frasco/Ampola | ROCHE REF.OCREVUS","fim vigência":"2026-03-31T00:00:00Z","tipo de acordo":"Por período","data solicitação":"14/01/2026","início vigência":"2025-11-01T00:00:00Z"},
{"status do contrato":"Vigentes","categoria produto":"Medicamentos","id contrato":2368681,"razão social do cliente":"Unimed Marília Cooperativa De Trabalho Médico","valor unitário":1324.5700000000,"quantidade acordada":"Não Estipulado","dias para encerramento do acordo":"56","cnpj cliente":"66.872.888/0001-60","título":"ACORDO COMERCIAL - ONCO - PONTUAL","produto":"CABOMETYX - LEVOMALATO DE CABOZANTINIBE 60MG COM 30 - COMPRIMIDO | Comprimido | ACEITA ALTERNATIVAS","fim vigência":"2026-03-31T00:00:00Z","tipo de acordo":"Por período","data solicitação":"07/07/2025","início vigência":"2025-07-07T00:00:00Z"},
{"status do contrato":"Vigentes","categoria produto":"Medicamentos","id contrato":5328174,"razão social do cliente":"Unimed de Presidente Prudente Cooperativa De Trabalho Médico","valor unitário":40000.0000000000,"quantidade acordada":"Não Estipulado","dias para encerramento do acordo":"56","cnpj cliente":"44.863.959/0001-26","título":"PONTUAL","produto":"Ocrevus 30 Mg/ml - Sol Inj Fa 10ml | Frasco | -","fim vigência":"2026-03-31T00:00:00Z","tipo de acordo":"Por período","data solicitação":"03/11/2025","início vigência":"2025-11-03T00:00:00Z"},
{"status do contrato":"Vigentes","categoria produto":"Medicamentos","id contrato":5328174,"razão social do cliente":"Unimed de Presidente Prudente Cooperativa De Trabalho Médico","valor unitário":524.0500000000,"quantidade acordada":"Não Estipulado","dias para encerramento do acordo":"56","cnpj cliente":"44.863.959/0001-26","título":"PONTUAL","produto":"Cabometyx 20mg - Comp Rev 30comp | Comprimido | -","fim vigência":"2026-03-31T00:00:00Z","tipo de acordo":"Por período","data solicitação":"03/11/2025","início vigência":"2025-11-03T00:00:00Z"},
{"status do contrato":"Vigentes","categoria produto":"Medicamentos","id contrato":2368681,"razão social do cliente":"Unimed Marília Cooperativa De Trabalho Médico","valor unitário":7240.0000000000,"quantidade acordada":"Não Estipulado","dias para encerramento do acordo":"56","cnpj cliente":"66.872.888/0001-60","título":"ACORDO COMERCIAL - ONCO - PONTUAL","produto":"SYNAGIS 100 MG - FRASCO/AMPOLA | Frasco/Ampola | ACEITA ALTERNATIVAS","fim vigência":"2026-03-31T00:00:00Z","tipo de acordo":"Por período","data solicitação":"07/07/2025","início vigência":"2025-07-07T00:00:00Z"},
{"status do contrato":"Vigentes","categoria produto":"Medicamentos","id contrato":2368681,"razão social do cliente":"Unimed Marília Cooperativa De Trabalho Médico","valor unitário":161.6400000000,"quantidade acordada":"Não Estipulado","dias para encerramento do acordo":"56","cnpj cliente":"66.872.888/0001-60","título":"ACORDO COMERCIAL - ONCO - PONTUAL","produto":"STIVARGA 40MG COM 84CP BAYER - COMPRIMIDO | Comprimido | ACEITA ALTERNATIVAS","fim vigência":"2026-03-31T00:00:00Z","tipo de acordo":"Por período","data solicitação":"07/07/2025","início vigência":"2025-07-07T00:00:00Z"},
{"status do contrato":"Vigentes","categoria produto":"Medicamentos","id contrato":5433314,"razão social do cliente":"Unimed São José dos Campos Cooperativa de Trabalho Médico - Santos Dumont Hospital","valor unitário":142759.0000000000,"quantidade acordada":"Não Estipulado","dias para encerramento do acordo":"56","cnpj cliente":"60.214.517/0016-91","título":"PONTUAL FARMACEUTICA NR 2006 LTDA","produto":"Levomalato cabozantinibe 60mg cx c/30 cp.","fim vigência":"2026-03-31T00:00:00Z","tipo de acordo":"Por período","data solicitação":"14/01/2026","início vigência":"2025-12-01T00:00:00Z"},
{"status do contrato":"Vigentes","categoria produto":"Medicamentos","id contrato":2368681,"razão social do cliente":"Unimed Marília Cooperativa De Trabalho Médico","valor unitário":8170.2900000000,"quantidade acordada":"Não Estipulado","dias para encerramento do acordo":"56","cnpj cliente":"66.872.888/0001-60","título":"ACORDO COMERCIAL - ONCO - PONTUAL","produto":"NUCALA 100MG (MEPOLIZUMABE) SERINGA PREENCH 1ML | Seringa | -","fim vigência":"2026-03-31T00:00:00Z","tipo de acordo":"Por período","data solicitação":"07/07/2025","início vigência":"2025-07-07T00:00:00Z"},
{"status do contrato":"Vigentes","categoria produto":"Medicamentos","id contrato":4304142,"razão social do cliente":"Unimed Chapeco Cooperativa de Trabalho Medico da Regiao Oeste Catarinense","valor unitário":9262.8700000000,"quantidade acordada":"Não Estipulado","dias para encerramento do acordo":"56","cnpj cliente":"85.283.299/0004-34","título":"Acordo NR 2006","produto":"NUCALA 100MG SOL INJ CANETA PREENCH 1ML | Caneta","fim vigência":"2026-03-31T00:00:00Z","tipo de acordo":"Por período","data solicitação":"24/09/2025","início vigência":"2025-08-21T00:00:00Z"},
{"status do contrato":"Vigentes","categoria produto":"Medicamentos","id contrato":5328174,"razão social do cliente":"Unimed de Presidente Prudente Cooperativa De Trabalho Médico","valor unitário":615.0000000000,"quantidade acordada":"Não Estipulado","dias para encerramento do acordo":"56","cnpj cliente":"44.863.959/0001-26","título":"PONTUAL","produto":"Zoladex La 10,8 Mg - 1ser | Seringa | -","fim vigência":"2026-03-31T00:00:00Z","tipo de acordo":"Por período","data solicitação":"03/11/2025","início vigência":"2025-11-03T00:00:00Z"},
{"status do contrato":"Cancelados","categoria produto":"Medicamentos","id contrato":91368,"razão social do cliente":"Unimed São José do Rio Preto - Complexo de Saúde","valor unitário":617.0000000000,"quantidade acordada":"240","dias para encerramento do acordo":"Cancelados","cnpj cliente":"45.100.138/0003-62","título":"ACORDO COMERCIAL: Medicamentos NOVARTIS","produto":"DIMETILSULFOXIDO DE TRAMETINIBE 2MG 30 CPS","fim vigência":null,"tipo de acordo":"Por quantidade","data solicitação":"16/07/2019","início vigência":null},
{"status do contrato":"Cancelados","categoria produto":"Medicamentos","id contrato":91368,"razão social do cliente":"Unimed São José do Rio Preto - Complexo de Saúde","valor unitário":170.0000000000,"quantidade acordada":"600","dias para encerramento do acordo":"Cancelados","cnpj cliente":"45.100.138/0003-62","título":"ACORDO COMERCIAL: Medicamentos NOVARTIS","produto":"MESILATO DE DABRAFENIBE 50MG 120 CAP","fim vigência":null,"tipo de acordo":"Por quantidade","data solicitação":"16/07/2019","início vigência":null},
{"status do contrato":"Cancelados","categoria produto":"Medicamentos","id contrato":87524,"razão social do cliente":"Conferência São José Do Avaí","valor unitário":158.9000000000,"quantidade acordada":"168","dias para encerramento do acordo":"Cancelados","cnpj cliente":"29.640.612/0001-20","título":"ONCOLOGIA 62519","produto":"REGORAFENIBE 40MG | Unidade | ACEITA ALTERNATIVAS","fim vigência":null,"tipo de acordo":"Por quantidade","data solicitação":"26/03/2019","início vigência":null},
{"status do contrato":"Cancelados","categoria produto":"Medicamentos","id contrato":91368,"razão social do cliente":"Unimed São José do Rio Preto - Complexo de Saúde","valor unitário":252.7000000000,"quantidade acordada":"480","dias para encerramento do acordo":"Cancelados","cnpj cliente":"45.100.138/0003-62","título":"ACORDO COMERCIAL: Medicamentos NOVARTIS","produto":"MESILATO DE DABRAFENIBE 75MG  CAPS","fim vigência":null,"tipo de acordo":"Por quantidade","data solicitação":"16/07/2019","início vigência":null},
{"status do contrato":"Cancelados","categoria produto":"Medicamentos","id contrato":1808333,"razão social do cliente":"Unimed Vitória Cooperativa de Trabalho Médico","valor unitário":941.2300000000,"quantidade acordada":"Não Estipulado","dias para encerramento do acordo":"Cancelados","cnpj cliente":"27.578.434/0015-25","título":"FORNECEDOR - PONTUAL FARMACEUTICA - DIU - 0001-00441","produto":"LEVONORGESTREL 19,5MG","fim vigência":"2026-03-31T23:59:00Z","tipo de acordo":"Por período","data solicitação":"12/05/2025","início vigência":"2025-05-12T00:00:00Z"},
{"status do contrato":"Cancelados","categoria produto":"Medicamentos","id contrato":1808333,"razão social do cliente":"Unimed Vitória Cooperativa de Trabalho Médico","valor unitário":941.2300000000,"quantidade acordada":"Não Estipulado","dias para encerramento do acordo":"Cancelados","cnpj cliente":"27.578.434/0015-25","título":"FORNECEDOR - PONTUAL FARMACEUTICA - DIU - 0001-00441","produto":"LEVONORGESTREL 52MG - 20MCG/24H  (MIRENA)","fim vigência":"2026-03-31T23:59:00Z","tipo de acordo":"Por período","data solicitação":"12/05/2025","início vigência":"2025-05-12T00:00:00Z"},
{"status do contrato":"Cancelados","categoria produto":"Medicamentos","id contrato":1833290,"razão social do cliente":"Unimed Grande Florianópolis","valor unitário":88.3700000000,"quantidade acordada":"Não Estipulado","dias para encerramento do acordo":"Cancelados","cnpj cliente":"77.858.611/0014-14","título":"ACORDO NUBEQA - PONTUAL 2025","produto":"NUBEQA (darolutamida) 300 MG CX C/ 120 CP","fim vigência":"2026-03-31T17:41:00Z","tipo de acordo":"Por período","data solicitação":"29/05/2025","início vigência":"2025-05-29T17:41:00Z"},
{"status do contrato":"Cancelados","categoria produto":"Medicamentos","id contrato":4303493,"razão social do cliente":"Unimed de Presidente Prudente Cooperativa De Trabalho Médico","valor unitário":83.9000000000,"quantidade acordada":"Não Estipulado","dias para encerramento do acordo":"Cancelados","cnpj cliente":"44.863.959/0001-26","título":"Acordo pontual","produto":"Nubeqa 300mg - 120comp","fim vigência":"2026-03-31T16:11:00Z","tipo de acordo":"Por período","data solicitação":"08/09/2025","início vigência":"2025-09-08T16:11:00Z"},
{"status do contrato":"Cancelados","categoria produto":"Medicamentos","id contrato":4303449,"razão social do cliente":"Unimed de Presidente Prudente Cooperativa De Trabalho Médico","valor unitário":3048.0000000000,"quantidade acordada":"Não Estipulado","dias para encerramento do acordo":"Cancelados","cnpj cliente":"44.863.959/0001-26","título":"Cotação para acordo comercial 8 meses","produto":"Imfinzi 120 Mg/2,4 Ml - Sol Inj Fa 2,4 Ml | Frasco/Ampola | -","fim vigência":"2026-03-31T15:58:00Z","tipo de acordo":"Por período","data solicitação":"05/09/2025","início vigência":"2025-09-05T15:58:00Z"},
{"status do contrato":"Cancelados","categoria produto":"Medicamentos","id contrato":4303449,"razão social do cliente":"Unimed de Presidente Prudente Cooperativa De Trabalho Médico","valor unitário":7829.0000000000,"quantidade acordada":"Não Estipulado","dias para encerramento do acordo":"Cancelados","cnpj cliente":"44.863.959/0001-26","título":"Cotação para acordo comercial 8 meses","produto":"Nucala 100mg/ml Sol Inj - Caneta Preenchida | Caneta","fim vigência":"2026-03-31T15:58:00Z","tipo de acordo":"Por período","data solicitação":"05/09/2025","início vigência":"2025-09-05T15:58:00Z"},
{"status do contrato":"Cancelados","categoria produto":"Medicamentos","id contrato":4303449,"razão social do cliente":"Unimed de Presidente Prudente Cooperativa De Trabalho Médico","valor unitário":3005.0000000000,"quantidade acordada":"Não Estipulado","dias para encerramento do acordo":"Cancelados","cnpj cliente":"44.863.959/0001-26","título":"Cotação para acordo comercial 8 meses","produto":"Vabysmo 120mg/ml - Inj 0,24ml | Peça | -","fim vigência":"2026-03-31T15:58:00Z","tipo de acordo":"Por período","data solicitação":"05/09/2025","início vigência":"2025-09-05T15:58:00Z"},
{"status do contrato":"Cancelados","categoria produto":"Medicamentos","id contrato":4303449,"razão social do cliente":"Unimed de Presidente Prudente Cooperativa De Trabalho Médico","valor unitário":26432.0000000000,"quantidade acordada":"Não Estipulado","dias para encerramento do acordo":"Cancelados","cnpj cliente":"44.863.959/0001-26","título":"Cotação para acordo comercial 8 meses","produto":"Jemperli 50mg/ml - Inj 10ml","fim vigência":"2026-03-31T15:58:00Z","tipo de acordo":"Por período","data solicitação":"05/09/2025","início vigência":"2025-09-05T15:58:00Z"},
{"status do contrato":"Cancelados","categoria produto":"Medicamentos","id contrato":4303449,"razão social do cliente":"Unimed de Presidente Prudente Cooperativa De Trabalho Médico","valor unitário":815.0000000000,"quantidade acordada":"Não Estipulado","dias para encerramento do acordo":"Cancelados","cnpj cliente":"44.863.959/0001-26","título":"Cotação para acordo comercial 8 meses","produto":"Actemra 20mg/ml - Sol Inj 4ml | Frasco/Ampola | -","fim vigência":"2026-03-31T15:58:00Z","tipo de acordo":"Por período","data solicitação":"05/09/2025","início vigência":"2025-09-05T15:58:00Z"},
{"status do contrato":"Cancelados","categoria produto":"Medicamentos","id contrato":4303449,"razão social do cliente":"Unimed de Presidente Prudente Cooperativa De Trabalho Médico","valor unitário":524.0500000000,"quantidade acordada":"Não Estipulado","dias para encerramento do acordo":"Cancelados","cnpj cliente":"44.863.959/0001-26","título":"Cotação para acordo comercial 8 meses","produto":"Cabometyx 20mg - Comp Rev 30comp | Comprimido | -","fim vigência":"2026-03-31T15:58:00Z","tipo de acordo":"Por período","data solicitação":"05/09/2025","início vigência":"2025-09-05T15:58:00Z"},
{"status do contrato":"Cancelados","categoria produto":"Medicamentos","id contrato":4303449,"razão social do cliente":"Unimed de Presidente Prudente Cooperativa De Trabalho Médico","valor unitário":3986.0000000000,"quantidade acordada":"Não Estipulado","dias para encerramento do acordo":"Cancelados","cnpj cliente":"44.863.959/0001-26","título":"Cotação para acordo comercial 8 meses","produto":"Somatuline Autogel 120 Mg - Sol Inj Lib Prol Ser Pre 0,5ml | Seringa | -","fim vigência":"2026-03-31T15:58:00Z","tipo de acordo":"Por período","data solicitação":"05/09/2025","início vigência":"2025-09-05T15:58:00Z"},
{"status do contrato":"Cancelados","categoria produto":"Medicamentos","id contrato":4303449,"razão social do cliente":"Unimed de Presidente Prudente Cooperativa De Trabalho Médico","valor unitário":8300.0000000000,"quantidade acordada":"Não Estipulado","dias para encerramento do acordo":"Cancelados","cnpj cliente":"44.863.959/0001-26","título":"Cotação para acordo comercial 8 meses","produto":"Kadcyla 100 Mg - Sol Inj Fa | Frasco/Ampola | -","fim vigência":"2026-03-31T15:58:00Z","tipo de acordo":"Por período","data solicitação":"05/09/2025","início vigência":"2025-09-05T15:58:00Z"},
{"status do contrato":"Cancelados","categoria produto":"Medicamentos","id contrato":4303449,"razão social do cliente":"Unimed de Presidente Prudente Cooperativa De Trabalho Médico","valor unitário":615.0000000000,"quantidade acordada":"Não Estipulado","dias para encerramento do acordo":"Cancelados","cnpj cliente":"44.863.959/0001-26","título":"Cotação para acordo comercial 8 meses","produto":"Zoladex La 10,8 Mg - 1ser | Seringa | -","fim vigência":"2026-03-31T15:58:00Z","tipo de acordo":"Por período","data solicitação":"05/09/2025","início vigência":"2025-09-05T15:58:00Z"},
{"status do contrato":"Cancelados","categoria produto":"Medicamentos","id contrato":4303449,"razão social do cliente":"Unimed de Presidente Prudente Cooperativa De Trabalho Médico","valor unitário":410.0000000000,"quantidade acordada":"Não Estipulado","dias para encerramento do acordo":"Cancelados","cnpj cliente":"44.863.959/0001-26","título":"Cotação para acordo comercial 8 meses","produto":"Zoladex 3,6 Mg - 1 Ser | Seringa | -","fim vigência":"2026-03-31T15:58:00Z","tipo de acordo":"Por período","data solicitação":"05/09/2025","início vigência":"2025-09-05T15:58:00Z"},
{"status do contrato":"Cancelados","categoria produto":"Medicamentos","id contrato":4303449,"razão social do cliente":"Unimed de Presidente Prudente Cooperativa De Trabalho Médico","valor unitário":10.1200000000,"quantidade acordada":"Não Estipulado","dias para encerramento do acordo":"Cancelados","cnpj cliente":"44.863.959/0001-26","título":"Cotação para acordo comercial 8 meses","produto":"Citarabina 100mg/ml - Sol Inj 1ml | Frasco/Ampola | -","fim vigência":"2026-03-31T15:58:00Z","tipo de acordo":"Por período","data solicitação":"05/09/2025","início vigência":"2025-09-05T15:58:00Z"},
{"status do contrato":"Cancelados","categoria produto":"Medicamentos","id contrato":4598162,"razão social do cliente":"Unimed de Presidente Prudente Cooperativa De Trabalho Médico","valor unitário":8619.0700000000,"quantidade acordada":"Não Estipulado","dias para encerramento do acordo":"Cancelados","cnpj cliente":"44.863.959/0001-26","título":"Acordo Pontual ","produto":"Tezspire 210mg/1,91ml Seringa Preenchida | Seringa","fim vigência":"2026-03-31T15:51:00Z","tipo de acordo":"Por período","data solicitação":"17/10/2025","início vigência":"2025-10-17T15:51:00Z"},
{"status do contrato":"Cancelados","categoria produto":"Medicamentos","id contrato":1848242,"razão social do cliente":"Unimed de Presidente Prudente Cooperativa De Trabalho Médico","valor unitário":126000.0000000000,"quantidade acordada":"Não Estipulado","dias para encerramento do acordo":"Cancelados","cnpj cliente":"44.863.959/0001-26","título":"COTAÇÃO PARA ACORDO COMERCIAL 4 MESES  - QUIMIO/ALTO CUSTO","produto":"Imjudo 300mg Sol. Inj Frasco Ampola 15ml | Frasco/Ampola | -","fim vigência":"2026-03-31T13:59:00Z","tipo de acordo":"Por período","data solicitação":"03/06/2025","início vigência":"2025-10-08T13:59:00Z"},
{"status do contrato":"Cancelados","categoria produto":"Medicamentos","id contrato":1848242,"razão social do cliente":"Unimed de Presidente Prudente Cooperativa De Trabalho Médico","valor unitário":14058.0000000000,"quantidade acordada":"Não Estipulado","dias para encerramento do acordo":"Cancelados","cnpj cliente":"44.863.959/0001-26","título":"COTAÇÃO PARA ACORDO COMERCIAL 4 MESES  - QUIMIO/ALTO CUSTO","produto":"Perjeta 420 Mg - Sol Inj Fa | Frasco/Ampola | -","fim vigência":"2026-03-31T13:59:00Z","tipo de acordo":"Por período","data solicitação":"03/06/2025","início vigência":"2025-10-08T13:59:00Z"},
{"status do contrato":"Cancelados","categoria produto":"Medicamentos","id contrato":1848242,"razão social do cliente":"Unimed de Presidente Prudente Cooperativa De Trabalho Médico","valor unitário":40000.0000000000,"quantidade acordada":"Não Estipulado","dias para encerramento do acordo":"Cancelados","cnpj cliente":"44.863.959/0001-26","título":"COTAÇÃO PARA ACORDO COMERCIAL 4 MESES  - QUIMIO/ALTO CUSTO","produto":"Ocrevus 30 Mg/ml - Sol Inj Fa 10ml | Frasco | -","fim vigência":"2026-03-31T13:59:00Z","tipo de acordo":"Por período","data solicitação":"03/06/2025","início vigência":"2025-10-08T13:59:00Z"},
{"status do contrato":"Cancelados","categoria produto":"Medicamentos","id contrato":1848242,"razão social do cliente":"Unimed de Presidente Prudente Cooperativa De Trabalho Médico","valor unitário":1045.7000000000,"quantidade acordada":"Não Estipulado","dias para encerramento do acordo":"Cancelados","cnpj cliente":"44.863.959/0001-26","título":"COTAÇÃO PARA ACORDO COMERCIAL 4 MESES  - QUIMIO/ALTO CUSTO","produto":"Cabometyx 60mg - Comp Rev 30comp | Comprimido | -","fim vigência":"2026-03-31T13:59:00Z","tipo de acordo":"Por período","data solicitação":"03/06/2025","início vigência":"2025-10-08T13:59:00Z"},
{"status do contrato":"Cancelados","categoria produto":"Medicamentos","id contrato":1848242,"razão social do cliente":"Unimed de Presidente Prudente Cooperativa De Trabalho Médico","valor unitário":11269.4600000000,"quantidade acordada":"Não Estipulado","dias para encerramento do acordo":"Cancelados","cnpj cliente":"44.863.959/0001-26","título":"COTAÇÃO PARA ACORDO COMERCIAL 4 MESES  - QUIMIO/ALTO CUSTO","produto":"Kesimpta 20mg/0,4ml - Ser Inj | Seringa | -","fim vigência":"2026-03-31T13:59:00Z","tipo de acordo":"Por período","data solicitação":"03/06/2025","início vigência":"2025-10-08T13:59:00Z"},
{"status do contrato":"Cancelados","categoria produto":"Medicamentos","id contrato":1848242,"razão social do cliente":"Unimed de Presidente Prudente Cooperativa De Trabalho Médico","valor unitário":24840.0000000000,"quantidade acordada":"Não Estipulado","dias para encerramento do acordo":"Cancelados","cnpj cliente":"44.863.959/0001-26","título":"COTAÇÃO PARA ACORDO COMERCIAL 4 MESES  - QUIMIO/ALTO CUSTO","produto":"Tecentriq 1200mg - Sol Inj Fa 20 Ml | Frasco/Ampola | -","fim vigência":"2026-03-31T13:59:00Z","tipo de acordo":"Por período","data solicitação":"03/06/2025","início vigência":"2025-10-08T13:59:00Z"},
{"status do contrato":"Cancelados","categoria produto":"Medicamentos","id contrato":1848242,"razão social do cliente":"Unimed de Presidente Prudente Cooperativa De Trabalho Médico","valor unitário":482.3000000000,"quantidade acordada":"Não Estipulado","dias para encerramento do acordo":"Cancelados","cnpj cliente":"44.863.959/0001-26","título":"COTAÇÃO PARA ACORDO COMERCIAL 4 MESES  - QUIMIO/ALTO CUSTO","produto":"Calquence 100mg - 60cap | Capsula | -","fim vigência":"2026-03-31T13:59:00Z","tipo de acordo":"Por período","data solicitação":"03/06/2025","início vigência":"2025-10-08T13:59:00Z"},
{"status do contrato":"Cancelados","categoria produto":"Medicamentos","id contrato":5408443,"razão social do cliente":"Unimed São José dos Campos Cooperativa de Trabalho Médico - Sede","valor unitário":39364.4700000000,"quantidade acordada":"1","dias para encerramento do acordo":"Cancelados","cnpj cliente":"60.214.517/0001-05","título":"Acordo de Fornecimento - 3323","produto":"OCRELIZUMABE 300MG/10ML - FRASCO/AMPOLA - ROCHE REF.OCREVUS","fim vigência":"2026-03-31T00:00:00Z","tipo de acordo":"Por quantidade e período","data solicitação":"05/01/2026","início vigência":"2025-11-01T00:00:00Z"},
{"status do contrato":"Cancelados","categoria produto":"Medicamentos","id contrato":5408443,"razão social do cliente":"Unimed São José dos Campos Cooperativa de Trabalho Médico - Sede","valor unitário":1369.7900000000,"quantidade acordada":"1","dias para encerramento do acordo":"Cancelados","cnpj cliente":"60.214.517/0001-05","título":"Acordo de Fornecimento - 3323","produto":"TOCILIZUMABE 162MG/0,9ML SERINGA PREENCIDA (CX C/ 4 SERINGAS) - SERINGA - ROCHE","fim vigência":"2026-03-31T00:00:00Z","tipo de acordo":"Por quantidade e período","data solicitação":"05/01/2026","início vigência":"2025-11-01T00:00:00Z"},
{"status do contrato":"Cancelados","categoria produto":"Medicamentos","id contrato":5408443,"razão social do cliente":"Unimed São José dos Campos Cooperativa de Trabalho Médico - Sede","valor unitário":815.4500000000,"quantidade acordada":"1","dias para encerramento do acordo":"Cancelados","cnpj cliente":"60.214.517/0001-05","título":"Acordo de Fornecimento - 3323","produto":"TOCILIZUMABE 80MG/4ML - FRASCO/AMPOLA - ROCHE","fim vigência":"2026-03-31T00:00:00Z","tipo de acordo":"Por quantidade e período","data solicitação":"05/01/2026","início vigência":"2025-11-01T00:00:00Z"},
{"status do contrato":"Cancelados","categoria produto":"Medicamentos","id contrato":5408443,"razão social do cliente":"Unimed São José dos Campos Cooperativa de Trabalho Médico - Sede","valor unitário":13329.7700000000,"quantidade acordada":"1","dias para encerramento do acordo":"Cancelados","cnpj cliente":"60.214.517/0001-05","título":"Acordo de Fornecimento - 3323","produto":"Trastuzumabe ENTAnsina 160mg/8ml frasco-ampola (geladeira)","fim vigência":"2026-03-31T00:00:00Z","tipo de acordo":"Por quantidade e período","data solicitação":"05/01/2026","início vigência":"2025-11-01T00:00:00Z"},
{"status do contrato":"Cancelados","categoria produto":"Medicamentos","id contrato":5408443,"razão social do cliente":"Unimed São José dos Campos Cooperativa de Trabalho Médico - Sede","valor unitário":13966.2000000000,"quantidade acordada":"1","dias para encerramento do acordo":"Cancelados","cnpj cliente":"60.214.517/0001-05","título":"Acordo de Fornecimento - 3323","produto":"PERTUZUMABE 420MG/14ML - FRASCO-AMPOLA - ROCHE","fim vigência":"2026-03-31T00:00:00Z","tipo de acordo":"Por quantidade e período","data solicitação":"05/01/2026","início vigência":"2025-11-01T00:00:00Z"},
{"status do contrato":"Cancelados","categoria produto":"Medicamentos","id contrato":5408443,"razão social do cliente":"Unimed São José dos Campos Cooperativa de Trabalho Médico - Sede","valor unitário":24766.6200000000,"quantidade acordada":"1","dias para encerramento do acordo":"Cancelados","cnpj cliente":"60.214.517/0001-05","título":"Acordo de Fornecimento - 3323","produto":"ATEZOLIZUMABE 60 MG/ML 20ML - FRASCO-AMPOLA - ROCHE (REF. TECENTRIQ)","fim vigência":"2026-03-31T00:00:00Z","tipo de acordo":"Por quantidade e período","data solicitação":"05/01/2026","início vigência":"2025-11-01T00:00:00Z"},
{"status do contrato":"Cancelados","categoria produto":"Medicamentos","id contrato":5408443,"razão social do cliente":"Unimed São José dos Campos Cooperativa de Trabalho Médico - Sede","valor unitário":47.5200000000,"quantidade acordada":"1","dias para encerramento do acordo":"Cancelados","cnpj cliente":"60.214.517/0001-05","título":"Acordo de Fornecimento - 3323","produto":"PIRFENIDONA 267MG - CAPSULA - ROCHE","fim vigência":"2026-03-31T00:00:00Z","tipo de acordo":"Por quantidade e período","data solicitação":"05/01/2026","início vigência":"2025-11-01T00:00:00Z"},
{"status do contrato":"Cancelados","categoria produto":"Medicamentos","id contrato":3668169,"razão social do cliente":"Unimed Marília Cooperativa De Trabalho Médico","valor unitário":89.2500000000,"quantidade acordada":"Não Estipulado","dias para encerramento do acordo":"Cancelados","cnpj cliente":"66.872.888/0001-60","título":"ACORDO COMERCIAL - ONCO - NR2006 PONTUAL","produto":"NUBEQA 300MG COMP CX C/120 | Unidade","fim vigência":"2026-03-31T00:00:00Z","tipo de acordo":"Por período","data solicitação":"21/08/2025","início vigência":"2025-08-20T00:00:00Z"},
{"status do contrato":"Cancelados","categoria produto":"Medicamentos","id contrato":5408443,"razão social do cliente":"Unimed São José dos Campos Cooperativa de Trabalho Médico - Sede","valor unitário":2032.4700000000,"quantidade acordada":"1","dias para encerramento do acordo":"Cancelados","cnpj cliente":"60.214.517/0001-05","título":"Acordo de Fornecimento - 3323","produto":"Tocilizumabe 200mg/10ml frasco-ampola (geladeira) - FRASCO/AMPOLA - ROCHE (Ref.Actemra)","fim vigência":"2026-03-31T00:00:00Z","tipo de acordo":"Por quantidade e período","data solicitação":"05/01/2026","início vigência":"2025-11-01T00:00:00Z"},
{"status do contrato":"Cancelados","categoria produto":"Medicamentos","id contrato":5408443,"razão social do cliente":"Unimed São José dos Campos Cooperativa de Trabalho Médico - Sede","valor unitário":56239.1600000000,"quantidade acordada":"1","dias para encerramento do acordo":"Cancelados","cnpj cliente":"60.214.517/0001-05","título":"Acordo de Fornecimento - 3323","produto":"RISDIPLAM PO SOLUÇAO ORAL 0,75MG/ML FRASCO 80ML - FRASCO / ROCHE","fim vigência":"2026-03-31T00:00:00Z","tipo de acordo":"Por quantidade e período","data solicitação":"05/01/2026","início vigência":"2025-11-01T00:00:00Z"},
{"status do contrato":"Cancelados","categoria produto":"Medicamentos","id contrato":1803767,"razão social do cliente":"Unimed Grande Florianópolis","valor unitário":13240.6400000000,"quantidade acordada":"Não Estipulado","dias para encerramento do acordo":"Cancelados","cnpj cliente":"77.858.611/0014-14","título":"ACORDO ASTRAZENECE PONTUAL - IMFINZI","produto":"IMFINZI (durvalumabe) 500 MG 10 ML | Frasco Ampolla | -","fim vigência":"2025-08-23T10:24:00Z","tipo de acordo":"Por período","data solicitação":"11/04/2025","início vigência":"2025-04-11T10:24:00Z"},
{"status do contrato":"Cancelados","categoria produto":"Medicamentos","id contrato":1803767,"razão social do cliente":"Unimed Grande Florianópolis","valor unitário":3177.7300000000,"quantidade acordada":"Não Estipulado","dias para encerramento do acordo":"Cancelados","cnpj cliente":"77.858.611/0014-14","título":"ACORDO ASTRAZENECE PONTUAL - IMFINZI","produto":"IMFINZI (durvalumabe) 120 MG 2,4 ML | Frasco Ampolla | -","fim vigência":"2025-08-23T10:24:00Z","tipo de acordo":"Por período","data solicitação":"11/04/2025","início vigência":"2025-04-11T10:24:00Z"},
{"status do contrato":"Cancelados","categoria produto":"Medicamentos","id contrato":1778214,"razão social do cliente":"Unimed Grande Florianópolis","valor unitário":1072.3553000000,"quantidade acordada":"Não Estipulado","dias para encerramento do acordo":"Cancelados","cnpj cliente":"77.858.611/0014-14","título":"ACORDO PONTUAL ASTRAZENECA (MERCOSUL)","produto":"TAGRISSO (osimertinibe) 80 MG CX C/ 30 CP","fim vigência":"2025-08-23T09:39:00Z","tipo de acordo":"Por período","data solicitação":"19/12/2024","início vigência":"2024-12-19T09:39:00Z"},
{"status do contrato":"Cancelados","categoria produto":"Medicamentos","id contrato":1778214,"razão social do cliente":"Unimed Grande Florianópolis","valor unitário":1227.1500000000,"quantidade acordada":"Não Estipulado","dias para encerramento do acordo":"Cancelados","cnpj cliente":"77.858.611/0014-14","título":"ACORDO PONTUAL ASTRAZENECA (MERCOSUL)","produto":"ZOLADEX LA DEPOT (goserelina) 10,8 MG SER PREECNH","fim vigência":"2025-08-23T09:39:00Z","tipo de acordo":"Por período","data solicitação":"19/12/2024","início vigência":"2024-12-19T09:39:00Z"},
{"status do contrato":"Cancelados","categoria produto":"Medicamentos","id contrato":1778214,"razão social do cliente":"Unimed Grande Florianópolis","valor unitário":479.2800000000,"quantidade acordada":"Não Estipulado","dias para encerramento do acordo":"Cancelados","cnpj cliente":"77.858.611/0014-14","título":"ACORDO PONTUAL ASTRAZENECA (MERCOSUL)","produto":"ZOLADEX DEPOT (goserelina) 3,6 MG SERINGA | Caixa | -","fim vigência":"2025-08-23T09:39:00Z","tipo de acordo":"Por período","data solicitação":"19/12/2024","início vigência":"2024-12-19T09:39:00Z"},
{"status do contrato":"Cancelados","categoria produto":"Medicamentos","id contrato":1778214,"razão social do cliente":"Unimed Grande Florianópolis","valor unitário":1069.0728000000,"quantidade acordada":"Não Estipulado","dias para encerramento do acordo":"Cancelados","cnpj cliente":"77.858.611/0014-14","título":"ACORDO PONTUAL ASTRAZENECA (MERCOSUL)","produto":"TAGRISSO (osimertinibe) 40 MG CX C/ 30 CP | Comprimido | -","fim vigência":"2025-08-23T09:39:00Z","tipo de acordo":"Por período","data solicitação":"19/12/2024","início vigência":"2024-12-19T09:39:00Z"},
{"status do contrato":"Cancelados","categoria produto":"Medicamentos","id contrato":1778214,"razão social do cliente":"Unimed Grande Florianópolis","valor unitário":476.7893000000,"quantidade acordada":"Não Estipulado","dias para encerramento do acordo":"Cancelados","cnpj cliente":"77.858.611/0014-14","título":"ACORDO PONTUAL ASTRAZENECA (MERCOSUL)","produto":"CALQUENCE (acalabrutinibe) 100MG CX C/ 60 CP | Capsula | -","fim vigência":"2025-08-23T09:39:00Z","tipo de acordo":"Por período","data solicitação":"19/12/2024","início vigência":"2024-12-19T09:39:00Z"},
{"status do contrato":"Cancelados","categoria produto":"Medicamentos","id contrato":1778214,"razão social do cliente":"Unimed Grande Florianópolis","valor unitário":7886.7600000000,"quantidade acordada":"Não Estipulado","dias para encerramento do acordo":"Cancelados","cnpj cliente":"77.858.611/0014-14","título":"ACORDO PONTUAL ASTRAZENECA (MERCOSUL)","produto":"TEZSPIRE (tezepelumabe) 210MG/1,91ML SER PREENCH | Seringa | -","fim vigência":"2025-08-23T09:39:00Z","tipo de acordo":"Por período","data solicitação":"19/12/2024","início vigência":"2024-12-19T09:39:00Z"},
{"status do contrato":"Cancelados","categoria produto":"Medicamentos","id contrato":1778214,"razão social do cliente":"Unimed Grande Florianópolis","valor unitário":232.2464000000,"quantidade acordada":"Não Estipulado","dias para encerramento do acordo":"Cancelados","cnpj cliente":"77.858.611/0014-14","título":"ACORDO PONTUAL ASTRAZENECA (MERCOSUL)","produto":"LYNPARZA (olaparibe) 100 MG CX C/56 CP. | Comprimido | -","fim vigência":"2025-08-23T09:39:00Z","tipo de acordo":"Por período","data solicitação":"19/12/2024","início vigência":"2024-12-19T09:39:00Z"},
{"status do contrato":"Cancelados","categoria produto":"Medicamentos","id contrato":1778214,"razão social do cliente":"Unimed Grande Florianópolis","valor unitário":152.0600000000,"quantidade acordada":"Não Estipulado","dias para encerramento do acordo":"Cancelados","cnpj cliente":"77.858.611/0014-14","título":"ACORDO PONTUAL ASTRAZENECA (MERCOSUL)","produto":"NOLVADEX D (tamoxifeno) 20 MG CX C/ 30 CP | Comprimido | -","fim vigência":"2025-08-23T09:39:00Z","tipo de acordo":"Por período","data solicitação":"19/12/2024","início vigência":"2024-12-19T09:39:00Z"},
{"status do contrato":"Cancelados","categoria produto":"Medicamentos","id contrato":1778214,"razão social do cliente":"Unimed Grande Florianópolis","valor unitário":11356.6800000000,"quantidade acordada":"Não Estipulado","dias para encerramento do acordo":"Cancelados","cnpj cliente":"77.858.611/0014-14","título":"ACORDO PONTUAL ASTRAZENECA (MERCOSUL)","produto":"FASENRA PFS (benralizumabe) 30MG/ML 1ML SER PREENCH | Seringa | -","fim vigência":"2025-08-23T09:39:00Z","tipo de acordo":"Por período","data solicitação":"19/12/2024","início vigência":"2024-12-19T09:39:00Z"},
{"status do contrato":"Cancelados","categoria produto":"Medicamentos","id contrato":1778214,"razão social do cliente":"Unimed Grande Florianópolis","valor unitário":231.0610000000,"quantidade acordada":"Não Estipulado","dias para encerramento do acordo":"Cancelados","cnpj cliente":"77.858.611/0014-14","título":"ACORDO PONTUAL ASTRAZENECA (MERCOSUL)","produto":"LYNPARZA (olaparibe) 150 MG CX C/ 56 CP | Comprimido | -","fim vigência":"2025-08-23T09:39:00Z","tipo de acordo":"Por período","data solicitação":"19/12/2024","início vigência":"2024-12-19T09:39:00Z"},
{"status do contrato":"Cancelados","categoria produto":"Medicamentos","id contrato":1778214,"razão social do cliente":"Unimed Grande Florianópolis","valor unitário":18.3000000000,"quantidade acordada":"Não Estipulado","dias para encerramento do acordo":"Cancelados","cnpj cliente":"77.858.611/0014-14","título":"ACORDO PONTUAL ASTRAZENECA (MERCOSUL)","produto":"ARIMIDEX (anastrozol) 1 MG CX C/ 28 CP","fim vigência":"2025-08-23T09:39:00Z","tipo de acordo":"Por período","data solicitação":"19/12/2024","início vigência":"2024-12-19T09:39:00Z"},
{"status do contrato":"Cancelados","categoria produto":"Medicamentos","id contrato":1658288,"razão social do cliente":"Unimed Vitória Cooperativa de Trabalho Médico","valor unitário":35.0000000000,"quantidade acordada":"Não Estipulado","dias para encerramento do acordo":"Cancelados","cnpj cliente":"27.578.434/0015-25","título":" ACORDO SHS X PONTUAL (MEDICAMENTO) - AX REF. 0001-00305","produto":"TEICOPLANINA 400 MG IV / IM - FRASCO/AMPOLA - INJETAVEL","fim vigência":"2025-03-31T23:59:00Z","tipo de acordo":"Por período","data solicitação":"20/06/2024","início vigência":"2024-06-20T00:00:00Z"},
{"status do contrato":"Cancelados","categoria produto":"Medicamentos","id contrato":1668882,"razão social do cliente":"Unimed Vitória Cooperativa de Trabalho Médico","valor unitário":880.0000000000,"quantidade acordada":"Não Estipulado","dias para encerramento do acordo":"Cancelados","cnpj cliente":"27.578.434/0015-25","título":"ACORDO REF. MEDICAMENTOS - AX REF 0001-00339 (MIRENA/KYLEENA)","produto":"LEVONORGESTREL 52MG - 20MCG/24H  (MIRENA)","fim vigência":"2025-03-31T23:59:00Z","tipo de acordo":"Por período","data solicitação":"05/08/2024","início vigência":"2024-08-05T00:00:00Z"},
{"status do contrato":"Cancelados","categoria produto":"Medicamentos","id contrato":1658288,"razão social do cliente":"Unimed Vitória Cooperativa de Trabalho Médico","valor unitário":7.1000000000,"quantidade acordada":"Não Estipulado","dias para encerramento do acordo":"Cancelados","cnpj cliente":"27.578.434/0015-25","título":" ACORDO SHS X PONTUAL (MEDICAMENTO) - AX REF. 0001-00305","produto":"DEXMEDETOMIDINA 100 MCG/ML 2 ML - INJETAVEL","fim vigência":"2025-03-31T23:59:00Z","tipo de acordo":"Por período","data solicitação":"20/06/2024","início vigência":"2024-06-20T00:00:00Z"},
{"status do contrato":"Cancelados","categoria produto":"Medicamentos","id contrato":1668882,"razão social do cliente":"Unimed Vitória Cooperativa de Trabalho Médico","valor unitário":900.0000000000,"quantidade acordada":"Não Estipulado","dias para encerramento do acordo":"Cancelados","cnpj cliente":"27.578.434/0015-25","título":"ACORDO REF. MEDICAMENTOS - AX REF 0001-00339 (MIRENA/KYLEENA)","produto":"LEVONORGESTREL 19,5MG","fim vigência":"2025-03-31T23:59:00Z","tipo de acordo":"Por período","data solicitação":"05/08/2024","início vigência":"2024-08-05T00:00:00Z"},
{"status do contrato":"Cancelados","categoria produto":"Medicamentos","id contrato":1637487,"razão social do cliente":"Cruz Azul de Sao Paulo","valor unitário":535.3000000000,"quantidade acordada":"Não Estipulado","dias para encerramento do acordo":"Cancelados","cnpj cliente":"62.106.505/0001-92","título":"ACORDO COMERCIAL HOSPITALAR - PONTUAL CMED 2025","produto":"ACALABRUTINIBE 100MG CAPSULA (N.P.) | Capsula","fim vigência":"2025-03-31T00:00:00Z","tipo de acordo":"Por período","data solicitação":"15/04/2024","início vigência":"2024-04-01T00:00:00Z"},
{"status do contrato":"Cancelados","categoria produto":"Medicamentos","id contrato":1637487,"razão social do cliente":"Cruz Azul de Sao Paulo","valor unitário":2886.0800000000,"quantidade acordada":"Não Estipulado","dias para encerramento do acordo":"Cancelados","cnpj cliente":"62.106.505/0001-92","título":"ACORDO COMERCIAL HOSPITALAR - PONTUAL CMED 2025","produto":"BELIMUMABE 400MG FR/AMP (N.P.) | Frasco/Ampola | -","fim vigência":"2025-03-31T00:00:00Z","tipo de acordo":"Por período","data solicitação":"15/04/2024","início vigência":"2024-04-01T00:00:00Z"},
{"status do contrato":"Cancelados","categoria produto":"Medicamentos","id contrato":1637487,"razão social do cliente":"Cruz Azul de Sao Paulo","valor unitário":3510.0000000000,"quantidade acordada":"Não Estipulado","dias para encerramento do acordo":"Cancelados","cnpj cliente":"62.106.505/0001-92","título":"ACORDO COMERCIAL HOSPITALAR - PONTUAL CMED 2025","produto":"PALIVIZUMAB 50MG/0,5ML FR/AMP (N.P.) | Frasco/Ampola | -","fim vigência":"2025-03-31T00:00:00Z","tipo de acordo":"Por período","data solicitação":"15/04/2024","início vigência":"2024-04-01T00:00:00Z"},
{"status do contrato":"Cancelados","categoria produto":"Medicamentos","id contrato":1637487,"razão social do cliente":"Cruz Azul de Sao Paulo","valor unitário":14450.0000000000,"quantidade acordada":"Não Estipulado","dias para encerramento do acordo":"Cancelados","cnpj cliente":"62.106.505/0001-92","título":"ACORDO COMERCIAL HOSPITALAR - PONTUAL CMED 2025","produto":"BENRALIZUMAB 30MG/ML SER.PREENCHIDA 1ML (N.P.) | Seringa | ASTRAZENECA","fim vigência":"2025-03-31T00:00:00Z","tipo de acordo":"Por período","data solicitação":"15/04/2024","início vigência":"2024-04-01T00:00:00Z"},
{"status do contrato":"Cancelados","categoria produto":"Medicamentos","id contrato":1617020,"razão social do cliente":"Sociedade Hospitalar Santa Thereza Ltda","valor unitário":7.6900000000,"quantidade acordada":"Não Estipulado","dias para encerramento do acordo":"Cancelados","cnpj cliente":"25.016.319/0001-36","título":"ACORDO COMERCIAL SHS- PONTUAL-KORA SAUDE","produto":"DRAMIN B6 DL 10ML I.V. - AMPOLA","fim vigência":"2024-07-01T23:59:00Z","tipo de acordo":"Por período","data solicitação":"07/03/2024","início vigência":"2024-03-07T00:00:00Z"},
{"status do contrato":"Cancelados","categoria produto":"Materiais Médicos","id contrato":1251536,"razão social do cliente":"Consolidador - Rede Meridional S.A.","valor unitário":310.0000000000,"quantidade acordada":"Não Estipulado","dias para encerramento do acordo":"Cancelados","cnpj cliente":"00.625.711/0001-51","título":"ACORDO GSK - NR 2006 (PONTUAL)","produto":"OLEO DE SILICONE 5000CPS-SERC/8ML-OPHTH.","fim vigência":"2024-03-31T23:59:00Z","tipo de acordo":"Por período","data solicitação":"11/08/2023","início vigência":"2023-09-19T00:00:00Z"},
{"status do contrato":"Cancelados","categoria produto":"Materiais Médicos","id contrato":1251536,"razão social do cliente":"Consolidador - Rede Meridional S.A.","valor unitário":93.5200000000,"quantidade acordada":"Não Estipulado","dias para encerramento do acordo":"Cancelados","cnpj cliente":"00.625.711/0001-51","título":"ACORDO GSK - NR 2006 (PONTUAL)","produto":"OPHT-BLUE 0.05%-1ML FA(AZUL BRIL.)-OPHTH","fim vigência":"2024-03-31T23:59:00Z","tipo de acordo":"Por período","data solicitação":"11/08/2023","início vigência":"2023-09-19T00:00:00Z"},
{"status do contrato":"Cancelados","categoria produto":"Materiais Médicos","id contrato":1251536,"razão social do cliente":"Consolidador - Rede Meridional S.A.","valor unitário":450.4900000000,"quantidade acordada":"Não Estipulado","dias para encerramento do acordo":"Cancelados","cnpj cliente":"00.625.711/0001-51","título":"ACORDO GSK - NR 2006 (PONTUAL)","produto":"INDOCIANINA VERDE 25MG - 10 ML FA","fim vigência":"2024-03-31T23:59:00Z","tipo de acordo":"Por período","data solicitação":"11/08/2023","início vigência":"2023-09-19T00:00:00Z"},
{"status do contrato":"Cancelados","categoria produto":"Medicamentos","id contrato":1251536,"razão social do cliente":"Consolidador - Rede Meridional S.A.","valor unitário":800.0000000000,"quantidade acordada":"Não Estipulado","dias para encerramento do acordo":"Cancelados","cnpj cliente":"00.625.711/0001-51","título":"ACORDO GSK - NR 2006 (PONTUAL)","produto":"BENLYSTA 120MG FA(BELIMUM.)QT/MPP DOACAO","fim vigência":"2024-03-31T23:59:00Z","tipo de acordo":"Por período","data solicitação":"11/08/2023","início vigência":"2023-09-19T00:00:00Z"},
{"status do contrato":"Cancelados","categoria produto":"Medicamentos","id contrato":1251536,"razão social do cliente":"Consolidador - Rede Meridional S.A.","valor unitário":2740.0000000000,"quantidade acordada":"Não Estipulado","dias para encerramento do acordo":"Cancelados","cnpj cliente":"00.625.711/0001-51","título":"ACORDO GSK - NR 2006 (PONTUAL)","produto":"BENLYSTA 400MG FA(BELIMUM.)QT/MPP DOACAO","fim vigência":"2024-03-31T23:59:00Z","tipo de acordo":"Por período","data solicitação":"11/08/2023","início vigência":"2023-09-19T00:00:00Z"},
{"status do contrato":"Cancelados","categoria produto":"Medicamentos","id contrato":1251536,"razão social do cliente":"Consolidador - Rede Meridional S.A.","valor unitário":800.0000000000,"quantidade acordada":"Não Estipulado","dias para encerramento do acordo":"Cancelados","cnpj cliente":"00.625.711/0001-51","título":"ACORDO GSK - NR 2006 (PONTUAL)","produto":"BENLYSTA 120MG FA (BELIMUMAB) QT/MPP","fim vigência":"2024-03-31T23:59:00Z","tipo de acordo":"Por período","data solicitação":"11/08/2023","início vigência":"2023-09-19T00:00:00Z"},
{"status do contrato":"Cancelados","categoria produto":"Materiais Médicos","id contrato":1251536,"razão social do cliente":"Consolidador - Rede Meridional S.A.","valor unitário":1077.0000000000,"quantidade acordada":"Não Estipulado","dias para encerramento do acordo":"Cancelados","cnpj cliente":"00.625.711/0001-51","título":"ACORDO GSK - NR 2006 (PONTUAL)","produto":"ICV INDOCIANINA VERDE 50MG - 10 ML FA","fim vigência":"2024-03-31T23:59:00Z","tipo de acordo":"Por período","data solicitação":"11/08/2023","início vigência":"2023-09-19T00:00:00Z"},
{"status do contrato":"Cancelados","categoria produto":"Medicamentos","id contrato":1251536,"razão social do cliente":"Consolidador - Rede Meridional S.A.","valor unitário":2740.0000000000,"quantidade acordada":"Não Estipulado","dias para encerramento do acordo":"Cancelados","cnpj cliente":"00.625.711/0001-51","título":"ACORDO GSK - NR 2006 (PONTUAL)","produto":"BENLYSTA 400MG FA (BELIMUMAB) QT/MPP","fim vigência":"2024-03-31T23:59:00Z","tipo de acordo":"Por período","data solicitação":"11/08/2023","início vigência":"2023-09-19T00:00:00Z"},
{"status do contrato":"Cancelados","categoria produto":"Materiais Médicos","id contrato":1251536,"razão social do cliente":"Consolidador - Rede Meridional S.A.","valor unitário":300.0000000000,"quantidade acordada":"Não Estipulado","dias para encerramento do acordo":"Cancelados","cnpj cliente":"00.625.711/0001-51","título":"ACORDO GSK - NR 2006 (PONTUAL)","produto":"OLEO DE SILICONE 1000CPS-SERC/8ML-OPHTH.","fim vigência":"2024-03-31T23:59:00Z","tipo de acordo":"Por período","data solicitação":"11/08/2023","início vigência":"2023-09-19T00:00:00Z"},
{"status do contrato":"Cancelados","categoria produto":"Medicamentos","id contrato":1251536,"razão social do cliente":"Consolidador - Rede Meridional S.A.","valor unitário":354.1500000000,"quantidade acordada":"Não Estipulado","dias para encerramento do acordo":"Cancelados","cnpj cliente":"00.625.711/0001-51","título":"ACORDO GSK - NR 2006 (PONTUAL)","produto":"ZEJULA 100MG CAPS (NIRAPARIBE)","fim vigência":"2024-03-31T23:59:00Z","tipo de acordo":"Por período","data solicitação":"11/08/2023","início vigência":"2023-09-19T00:00:00Z"},
{"status do contrato":"Cancelados","categoria produto":"Medicamentos","id contrato":1586524,"razão social do cliente":"Unimed de Presidente Prudente Cooperativa De Trabalho Médico","valor unitário":2425.0000000000,"quantidade acordada":"Não Estipulado","dias para encerramento do acordo":"Cancelados","cnpj cliente":"44.863.959/0001-26","título":"ACORDO NR2006 - SET A DEZ 23","produto":"XOLAIR 150 MG SOL INJ CT 1 SER PREENC VD TRANS X 1 ML | Seringa | -","fim vigência":"2023-12-31T23:59:00Z","tipo de acordo":"Por período","data solicitação":"16/09/2023","início vigência":"2023-09-18T00:00:00Z"},
{"status do contrato":"Cancelados","categoria produto":"Medicamentos","id contrato":1591643,"razão social do cliente":"Unimed de Presidente Prudente Cooperativa De Trabalho Médico","valor unitário":2425.0000000000,"quantidade acordada":"Não Estipulado","dias para encerramento do acordo":"Cancelados","cnpj cliente":"44.863.959/0001-26","título":"ACORDO NR2006 - SET A DEZ 23","produto":"XOLAIR 150 MG SOL INJ CT 1 SER PREENC VD TRANS X 1 ML | Seringa | -","fim vigência":"2023-12-31T23:59:00Z","tipo de acordo":"Por período","data solicitação":"19/10/2023","início vigência":"2023-10-19T00:00:00Z"},
{"status do contrato":"Cancelados","categoria produto":"Medicamentos","id contrato":1591643,"razão social do cliente":"Unimed de Presidente Prudente Cooperativa De Trabalho Médico","valor unitário":3880.0000000000,"quantidade acordada":"Não Estipulado","dias para encerramento do acordo":"Cancelados","cnpj cliente":"44.863.959/0001-26","título":"ACORDO NR2006 - SET A DEZ 23","produto":"COSENTYX 150 MG/ML SOL INJ CT 1 SER PREENCH VD TRANS X 1 ML + 2 CAN APLIC | SERINGA | -","fim vigência":"2023-12-31T23:59:00Z","tipo de acordo":"Por período","data solicitação":"19/10/2023","início vigência":"2023-10-19T00:00:00Z"},
{"status do contrato":"Cancelados","categoria produto":"Medicamentos","id contrato":1586524,"razão social do cliente":"Unimed de Presidente Prudente Cooperativa De Trabalho Médico","valor unitário":3894.0000000000,"quantidade acordada":"Não Estipulado","dias para encerramento do acordo":"Cancelados","cnpj cliente":"44.863.959/0001-26","título":"ACORDO NR2006 - SET A DEZ 23","produto":"COSENTYX 150 MG/ML SOL INJ CT 1 SER PREENCH VD TRANS X 1 ML + 2 CAN APLIC | SERINGA | -","fim vigência":"2023-12-31T23:59:00Z","tipo de acordo":"Por período","data solicitação":"16/09/2023","início vigência":"2023-09-18T00:00:00Z"},
{"status do contrato":"Cancelados","categoria produto":"Medicamentos","id contrato":1131696,"razão social do cliente":"ATHENA Saúde - Hospital São Pedro","valor unitário":6156.0700000000,"quantidade acordada":"Não Estipulado","dias para encerramento do acordo":"Cancelados","cnpj cliente":"13.688.895/0001-40","título":"CONTRATO FARMA PONTUAL","produto":"AVASTIN 400 MG SOL INJ","fim vigência":"2023-04-17T23:59:00Z","tipo de acordo":"Por período","data solicitação":"17/11/2022","início vigência":"2022-11-17T00:00:00Z"},
{"status do contrato":"Cancelados","categoria produto":"Medicamentos","id contrato":1131696,"razão social do cliente":"ATHENA Saúde - Hospital São Pedro","valor unitário":61.0000000000,"quantidade acordada":"Não Estipulado","dias para encerramento do acordo":"Cancelados","cnpj cliente":"13.688.895/0001-40","título":"CONTRATO FARMA PONTUAL","produto":"TYKERB 250 MG CP","fim vigência":"2023-04-17T23:59:00Z","tipo de acordo":"Por período","data solicitação":"17/11/2022","início vigência":"2022-11-17T00:00:00Z"},
{"status do contrato":"Cancelados","categoria produto":"Medicamentos","id contrato":1131665,"razão social do cliente":"ATHENA Saúde - Hospital Bom Samaritano de Maringá S/A","valor unitário":120.5600000000,"quantidade acordada":"Não Estipulado","dias para encerramento do acordo":"Cancelados","cnpj cliente":"23.876.304/0001-12","título":"CONTRATO FARMA PONTUAL","produto":"TASIGNA 200 MG  - CAPSULA","fim vigência":"2023-04-17T23:59:00Z","tipo de acordo":"Por período","data solicitação":"17/11/2022","início vigência":"2022-11-17T00:00:00Z"},
{"status do contrato":"Cancelados","categoria produto":"Medicamentos","id contrato":1131702,"razão social do cliente":"ATHENA Saúde - Med Imagem S/C","valor unitário":637.5200000000,"quantidade acordada":"Não Estipulado","dias para encerramento do acordo":"Cancelados","cnpj cliente":"63.326.243/0001-34","título":"CONTRATO FARMA PONTUAL","produto":"MEKINIST 2MG COMP","fim vigência":"2023-04-17T23:59:00Z","tipo de acordo":"Por período","data solicitação":"17/11/2022","início vigência":"2022-11-17T00:00:00Z"},
{"status do contrato":"Cancelados","categoria produto":"Medicamentos","id contrato":1131701,"razão social do cliente":"Hospital Marechal Candido Rondon S/a","valor unitário":259.9300000000,"quantidade acordada":"Não Estipulado","dias para encerramento do acordo":"Cancelados","cnpj cliente":"95.642.179/0028-07","título":"CONTRATO FARMA PONTUAL","produto":"KISQALI 200MG COMP","fim vigência":"2023-04-17T23:59:00Z","tipo de acordo":"Por período","data solicitação":"17/11/2022","início vigência":"2022-11-17T00:00:00Z"},
{"status do contrato":"Cancelados","categoria produto":"Medicamentos","id contrato":1131701,"razão social do cliente":"Hospital Marechal Candido Rondon S/a","valor unitário":7580.0000000000,"quantidade acordada":"Não Estipulado","dias para encerramento do acordo":"Cancelados","cnpj cliente":"95.642.179/0028-07","título":"CONTRATO FARMA PONTUAL","produto":"KADCYLA 100 MG PO LIOF INJ","fim vigência":"2023-04-17T23:59:00Z","tipo de acordo":"Por período","data solicitação":"17/11/2022","início vigência":"2022-11-17T00:00:00Z"},
{"status do contrato":"Cancelados","categoria produto":"Medicamentos","id contrato":1131665,"razão social do cliente":"ATHENA Saúde - Hospital Bom Samaritano de Maringá S/A","valor unitário":19537.3100000000,"quantidade acordada":"Não Estipulado","dias para encerramento do acordo":"Cancelados","cnpj cliente":"23.876.304/0001-12","título":"CONTRATO FARMA PONTUAL","produto":"TECENTRIQ 840 MG/14 ML SOL INJ","fim vigência":"2023-04-17T23:59:00Z","tipo de acordo":"Por período","data solicitação":"17/11/2022","início vigência":"2022-11-17T00:00:00Z"},
{"status do contrato":"Cancelados","categoria produto":"Medicamentos","id contrato":1131702,"razão social do cliente":"ATHENA Saúde - Med Imagem S/C","valor unitário":27910.4400000000,"quantidade acordada":"Não Estipulado","dias para encerramento do acordo":"Cancelados","cnpj cliente":"63.326.243/0001-34","título":"CONTRATO FARMA PONTUAL","produto":"TECENTRIQ 1200 MG/20 ML SOL INJ","fim vigência":"2023-04-17T23:59:00Z","tipo de acordo":"Por período","data solicitação":"17/11/2022","início vigência":"2022-11-17T00:00:00Z"},
{"status do contrato":"Cancelados","categoria produto":"Medicamentos","id contrato":1131702,"razão social do cliente":"ATHENA Saúde - Med Imagem S/C","valor unitário":61.0000000000,"quantidade acordada":"Não Estipulado","dias para encerramento do acordo":"Cancelados","cnpj cliente":"63.326.243/0001-34","título":"CONTRATO FARMA PONTUAL","produto":"TYKERB 250 MG CP","fim vigência":"2023-04-17T23:59:00Z","tipo de acordo":"Por período","data solicitação":"17/11/2022","início vigência":"2022-11-17T00:00:00Z"},
{"status do contrato":"Cancelados","categoria produto":"Medicamentos","id contrato":1131702,"razão social do cliente":"ATHENA Saúde - Med Imagem S/C","valor unitário":19537.3100000000,"quantidade acordada":"Não Estipulado","dias para encerramento do acordo":"Cancelados","cnpj cliente":"63.326.243/0001-34","título":"CONTRATO FARMA PONTUAL","produto":"TECENTRIQ 840 MG/14 ML SOL INJ","fim vigência":"2023-04-17T23:59:00Z","tipo de acordo":"Por período","data solicitação":"17/11/2022","início vigência":"2022-11-17T00:00:00Z"},
{"status do contrato":"Cancelados","categoria produto":"Medicamentos","id contrato":1131696,"razão social do cliente":"ATHENA Saúde - Hospital São Pedro","valor unitário":637.5200000000,"quantidade acordada":"Não Estipulado","dias para encerramento do acordo":"Cancelados","cnpj cliente":"13.688.895/0001-40","título":"CONTRATO FARMA PONTUAL","produto":"MEKINIST 2MG COMP","fim vigência":"2023-04-17T23:59:00Z","tipo de acordo":"Por período","data solicitação":"17/11/2022","início vigência":"2022-11-17T00:00:00Z"},
{"status do contrato":"Cancelados","categoria produto":"Medicamentos","id contrato":1131701,"razão social do cliente":"Hospital Marechal Candido Rondon S/a","valor unitário":102.4700000000,"quantidade acordada":"Não Estipulado","dias para encerramento do acordo":"Cancelados","cnpj cliente":"95.642.179/0028-07","título":"CONTRATO FARMA PONTUAL","produto":"TASIGNA 150MG CAP","fim vigência":"2023-04-17T23:59:00Z","tipo de acordo":"Por período","data solicitação":"17/11/2022","início vigência":"2022-11-17T00:00:00Z"},
{"status do contrato":"Cancelados","categoria produto":"Medicamentos","id contrato":1131665,"razão social do cliente":"ATHENA Saúde - Hospital Bom Samaritano de Maringá S/A","valor unitário":102.4700000000,"quantidade acordada":"Não Estipulado","dias para encerramento do acordo":"Cancelados","cnpj cliente":"23.876.304/0001-12","título":"CONTRATO FARMA PONTUAL","produto":"TASIGNA 150MG CAP","fim vigência":"2023-04-17T23:59:00Z","tipo de acordo":"Por período","data solicitação":"17/11/2022","início vigência":"2022-11-17T00:00:00Z"},
{"status do contrato":"Cancelados","categoria produto":"Medicamentos","id contrato":1131696,"razão social do cliente":"ATHENA Saúde - Hospital São Pedro","valor unitário":315.2600000000,"quantidade acordada":"Não Estipulado","dias para encerramento do acordo":"Cancelados","cnpj cliente":"13.688.895/0001-40","título":"CONTRATO FARMA PONTUAL","produto":"COTELLIC 20MG CP","fim vigência":"2023-04-17T23:59:00Z","tipo de acordo":"Por período","data solicitação":"17/11/2022","início vigência":"2022-11-17T00:00:00Z"},
{"status do contrato":"Cancelados","categoria produto":"Medicamentos","id contrato":1131701,"razão social do cliente":"Hospital Marechal Candido Rondon S/a","valor unitário":315.2600000000,"quantidade acordada":"Não Estipulado","dias para encerramento do acordo":"Cancelados","cnpj cliente":"95.642.179/0028-07","título":"CONTRATO FARMA PONTUAL","produto":"COTELLIC 20MG CP","fim vigência":"2023-04-17T23:59:00Z","tipo de acordo":"Por período","data solicitação":"17/11/2022","início vigência":"2022-11-17T00:00:00Z"},
{"status do contrato":"Cancelados","categoria produto":"Medicamentos","id contrato":1131665,"razão social do cliente":"ATHENA Saúde - Hospital Bom Samaritano de Maringá S/A","valor unitário":637.5200000000,"quantidade acordada":"Não Estipulado","dias para encerramento do acordo":"Cancelados","cnpj cliente":"23.876.304/0001-12","título":"CONTRATO FARMA PONTUAL","produto":"MEKINIST 2MG COMP - COMPRIMIDO","fim vigência":"2023-04-17T23:59:00Z","tipo de acordo":"Por período","data solicitação":"17/11/2022","início vigência":"2022-11-17T00:00:00Z"},
{"status do contrato":"Cancelados","categoria produto":"Medicamentos","id contrato":1131701,"razão social do cliente":"Hospital Marechal Candido Rondon S/a","valor unitário":6156.0700000000,"quantidade acordada":"Não Estipulado","dias para encerramento do acordo":"Cancelados","cnpj cliente":"95.642.179/0028-07","título":"CONTRATO FARMA PONTUAL","produto":"AVASTIN 400 MG SOL INJ","fim vigência":"2023-04-17T23:59:00Z","tipo de acordo":"Por período","data solicitação":"17/11/2022","início vigência":"2022-11-17T00:00:00Z"},
{"status do contrato":"Cancelados","categoria produto":"Medicamentos","id contrato":1131696,"razão social do cliente":"ATHENA Saúde - Hospital São Pedro","valor unitário":120.5600000000,"quantidade acordada":"Não Estipulado","dias para encerramento do acordo":"Cancelados","cnpj cliente":"13.688.895/0001-40","título":"CONTRATO FARMA PONTUAL","produto":"TASIGNA 200 MG CAP","fim vigência":"2023-04-17T23:59:00Z","tipo de acordo":"Por período","data solicitação":"17/11/2022","início vigência":"2022-11-17T00:00:00Z"},
{"status do contrato":"Cancelados","categoria produto":"Medicamentos","id contrato":1131696,"razão social do cliente":"ATHENA Saúde - Hospital São Pedro","valor unitário":7580.0000000000,"quantidade acordada":"Não Estipulado","dias para encerramento do acordo":"Cancelados","cnpj cliente":"13.688.895/0001-40","título":"CONTRATO FARMA PONTUAL","produto":"KADCYLA 100 MG PO LIOF INJ","fim vigência":"2023-04-17T23:59:00Z","tipo de acordo":"Por período","data solicitação":"17/11/2022","início vigência":"2022-11-17T00:00:00Z"},
{"status do contrato":"Cancelados","categoria produto":"Medicamentos","id contrato":1131701,"razão social do cliente":"Hospital Marechal Candido Rondon S/a","valor unitário":61.0000000000,"quantidade acordada":"Não Estipulado","dias para encerramento do acordo":"Cancelados","cnpj cliente":"95.642.179/0028-07","título":"CONTRATO FARMA PONTUAL","produto":"TYKERB 250 MG CP","fim vigência":"2023-04-17T23:59:00Z","tipo de acordo":"Por período","data solicitação":"17/11/2022","início vigência":"2022-11-17T00:00:00Z"},
{"status do contrato":"Cancelados","categoria produto":"Medicamentos","id contrato":1131702,"razão social do cliente":"ATHENA Saúde - Med Imagem S/C","valor unitário":259.9300000000,"quantidade acordada":"Não Estipulado","dias para encerramento do acordo":"Cancelados","cnpj cliente":"63.326.243/0001-34","título":"CONTRATO FARMA PONTUAL","produto":"KISQALI 200MG COMP","fim vigência":"2023-04-17T23:59:00Z","tipo de acordo":"Por período","data solicitação":"17/11/2022","início vigência":"2022-11-17T00:00:00Z"},
{"status do contrato":"Cancelados","categoria produto":"Medicamentos","id contrato":1131701,"razão social do cliente":"Hospital Marechal Candido Rondon S/a","valor unitário":120.5600000000,"quantidade acordada":"Não Estipulado","dias para encerramento do acordo":"Cancelados","cnpj cliente":"95.642.179/0028-07","título":"CONTRATO FARMA PONTUAL","produto":"TASIGNA 200 MG CAP","fim vigência":"2023-04-17T23:59:00Z","tipo de acordo":"Por período","data solicitação":"17/11/2022","início vigência":"2022-11-17T00:00:00Z"},
{"status do contrato":"Cancelados","categoria produto":"Medicamentos","id contrato":1131701,"razão social do cliente":"Hospital Marechal Candido Rondon S/a","valor unitário":19537.3100000000,"quantidade acordada":"Não Estipulado","dias para encerramento do acordo":"Cancelados","cnpj cliente":"95.642.179/0028-07","título":"CONTRATO FARMA PONTUAL","produto":"TECENTRIQ 840 MG/14 ML SOL INJ","fim vigência":"2023-04-17T23:59:00Z","tipo de acordo":"Por período","data solicitação":"17/11/2022","início vigência":"2022-11-17T00:00:00Z"},
{"status do contrato":"Cancelados","categoria produto":"Medicamentos","id contrato":1131696,"razão social do cliente":"ATHENA Saúde - Hospital São Pedro","valor unitário":27910.4400000000,"quantidade acordada":"Não Estipulado","dias para encerramento do acordo":"Cancelados","cnpj cliente":"13.688.895/0001-40","título":"CONTRATO FARMA PONTUAL","produto":"TECENTRIQ 1200 MG/20 ML SOL INJ","fim vigência":"2023-04-17T23:59:00Z","tipo de acordo":"Por período","data solicitação":"17/11/2022","início vigência":"2022-11-17T00:00:00Z"},
{"status do contrato":"Cancelados","categoria produto":"Medicamentos","id contrato":1131696,"razão social do cliente":"ATHENA Saúde - Hospital São Pedro","valor unitário":259.9300000000,"quantidade acordada":"Não Estipulado","dias para encerramento do acordo":"Cancelados","cnpj cliente":"13.688.895/0001-40","título":"CONTRATO FARMA PONTUAL","produto":"KISQALI 200MG COMP","fim vigência":"2023-04-17T23:59:00Z","tipo de acordo":"Por período","data solicitação":"17/11/2022","início vigência":"2022-11-17T00:00:00Z"},
{"status do contrato":"Cancelados","categoria produto":"Medicamentos","id contrato":1131701,"razão social do cliente":"Hospital Marechal Candido Rondon S/a","valor unitário":27910.4400000000,"quantidade acordada":"Não Estipulado","dias para encerramento do acordo":"Cancelados","cnpj cliente":"95.642.179/0028-07","título":"CONTRATO FARMA PONTUAL","produto":"TECENTRIQ 1200 MG/20 ML SOL INJ","fim vigência":"2023-04-17T23:59:00Z","tipo de acordo":"Por período","data solicitação":"17/11/2022","início vigência":"2022-11-17T00:00:00Z"},
{"status do contrato":"Cancelados","categoria produto":"Medicamentos","id contrato":1131665,"razão social do cliente":"ATHENA Saúde - Hospital Bom Samaritano de Maringá S/A","valor unitário":61.0000000000,"quantidade acordada":"Não Estipulado","dias para encerramento do acordo":"Cancelados","cnpj cliente":"23.876.304/0001-12","título":"CONTRATO FARMA PONTUAL","produto":"TYKERB 250 MG  - COMPRIMIDO","fim vigência":"2023-04-17T23:59:00Z","tipo de acordo":"Por período","data solicitação":"17/11/2022","início vigência":"2022-11-17T00:00:00Z"},
{"status do contrato":"Cancelados","categoria produto":"Medicamentos","id contrato":1131665,"razão social do cliente":"ATHENA Saúde - Hospital Bom Samaritano de Maringá S/A","valor unitário":315.2600000000,"quantidade acordada":"Não Estipulado","dias para encerramento do acordo":"Cancelados","cnpj cliente":"23.876.304/0001-12","título":"CONTRATO FARMA PONTUAL","produto":"COTELLIC 20MG CP","fim vigência":"2023-04-17T23:59:00Z","tipo de acordo":"Por período","data solicitação":"17/11/2022","início vigência":"2022-11-17T00:00:00Z"},
{"status do contrato":"Cancelados","categoria produto":"Medicamentos","id contrato":1131696,"razão social do cliente":"ATHENA Saúde - Hospital São Pedro","valor unitário":102.4700000000,"quantidade acordada":"Não Estipulado","dias para encerramento do acordo":"Cancelados","cnpj cliente":"13.688.895/0001-40","título":"CONTRATO FARMA PONTUAL","produto":"TASIGNA 150MG CAP","fim vigência":"2023-04-17T23:59:00Z","tipo de acordo":"Por período","data solicitação":"17/11/2022","início vigência":"2022-11-17T00:00:00Z"},
{"status do contrato":"Cancelados","categoria produto":"Medicamentos","id contrato":1131702,"razão social do cliente":"ATHENA Saúde - Med Imagem S/C","valor unitário":7580.0000000000,"quantidade acordada":"Não Estipulado","dias para encerramento do acordo":"Cancelados","cnpj cliente":"63.326.243/0001-34","título":"CONTRATO FARMA PONTUAL","produto":"KADCYLA 100 MG PO LIOF INJ","fim vigência":"2023-04-17T23:59:00Z","tipo de acordo":"Por período","data solicitação":"17/11/2022","início vigência":"2022-11-17T00:00:00Z"},
{"status do contrato":"Cancelados","categoria produto":"Medicamentos","id contrato":1131702,"razão social do cliente":"ATHENA Saúde - Med Imagem S/C","valor unitário":315.2600000000,"quantidade acordada":"Não Estipulado","dias para encerramento do acordo":"Cancelados","cnpj cliente":"63.326.243/0001-34","título":"CONTRATO FARMA PONTUAL","produto":"COTELLIC 20MG CP","fim vigência":"2023-04-17T23:59:00Z","tipo de acordo":"Por período","data solicitação":"17/11/2022","início vigência":"2022-11-17T00:00:00Z"},
{"status do contrato":"Cancelados","categoria produto":"Medicamentos","id contrato":1131701,"razão social do cliente":"Hospital Marechal Candido Rondon S/a","valor unitário":1589.9300000000,"quantidade acordada":"Não Estipulado","dias para encerramento do acordo":"Cancelados","cnpj cliente":"95.642.179/0028-07","título":"CONTRATO FARMA PONTUAL","produto":"AVASTIN 100 MG SOL INJ","fim vigência":"2023-04-17T23:59:00Z","tipo de acordo":"Por período","data solicitação":"17/11/2022","início vigência":"2022-11-17T00:00:00Z"},
{"status do contrato":"Cancelados","categoria produto":"Medicamentos","id contrato":1131702,"razão social do cliente":"ATHENA Saúde - Med Imagem S/C","valor unitário":6156.0700000000,"quantidade acordada":"Não Estipulado","dias para encerramento do acordo":"Cancelados","cnpj cliente":"63.326.243/0001-34","título":"CONTRATO FARMA PONTUAL","produto":"AVASTIN 400 MG SOL INJ","fim vigência":"2023-04-17T23:59:00Z","tipo de acordo":"Por período","data solicitação":"17/11/2022","início vigência":"2022-11-17T00:00:00Z"},
{"status do contrato":"Cancelados","categoria produto":"Medicamentos","id contrato":1131696,"razão social do cliente":"ATHENA Saúde - Hospital São Pedro","valor unitário":1589.9300000000,"quantidade acordada":"Não Estipulado","dias para encerramento do acordo":"Cancelados","cnpj cliente":"13.688.895/0001-40","título":"CONTRATO FARMA PONTUAL","produto":"AVASTIN 100 MG SOL INJ","fim vigência":"2023-04-17T23:59:00Z","tipo de acordo":"Por período","data solicitação":"17/11/2022","início vigência":"2022-11-17T00:00:00Z"},
{"status do contrato":"Cancelados","categoria produto":"Medicamentos","id contrato":1131702,"razão social do cliente":"ATHENA Saúde - Med Imagem S/C","valor unitário":1589.9300000000,"quantidade acordada":"Não Estipulado","dias para encerramento do acordo":"Cancelados","cnpj cliente":"63.326.243/0001-34","título":"CONTRATO FARMA PONTUAL","produto":"AVASTIN 100 MG SOL INJ","fim vigência":"2023-04-17T23:59:00Z","tipo de acordo":"Por período","data solicitação":"17/11/2022","início vigência":"2022-11-17T00:00:00Z"},
{"status do contrato":"Cancelados","categoria produto":"Medicamentos","id contrato":1131702,"razão social do cliente":"ATHENA Saúde - Med Imagem S/C","valor unitário":120.5600000000,"quantidade acordada":"Não Estipulado","dias para encerramento do acordo":"Cancelados","cnpj cliente":"63.326.243/0001-34","título":"CONTRATO FARMA PONTUAL","produto":"TASIGNA 200 MG CAP","fim vigência":"2023-04-17T23:59:00Z","tipo de acordo":"Por período","data solicitação":"17/11/2022","início vigência":"2022-11-17T00:00:00Z"},
{"status do contrato":"Cancelados","categoria produto":"Medicamentos","id contrato":1131665,"razão social do cliente":"ATHENA Saúde - Hospital Bom Samaritano de Maringá S/A","valor unitário":27910.4400000000,"quantidade acordada":"Não Estipulado","dias para encerramento do acordo":"Cancelados","cnpj cliente":"23.876.304/0001-12","título":"CONTRATO FARMA PONTUAL","produto":"TECENTRIQ 1200 MG/20 ML SOL INJ","fim vigência":"2023-04-17T23:59:00Z","tipo de acordo":"Por período","data solicitação":"17/11/2022","início vigência":"2022-11-17T00:00:00Z"},
{"status do contrato":"Cancelados","categoria produto":"Medicamentos","id contrato":1131665,"razão social do cliente":"ATHENA Saúde - Hospital Bom Samaritano de Maringá S/A","valor unitário":6156.0700000000,"quantidade acordada":"Não Estipulado","dias para encerramento do acordo":"Cancelados","cnpj cliente":"23.876.304/0001-12","título":"CONTRATO FARMA PONTUAL","produto":"AVASTIN 400MG SOL DIL 16ML","fim vigência":"2023-04-17T23:59:00Z","tipo de acordo":"Por período","data solicitação":"17/11/2022","início vigência":"2022-11-17T00:00:00Z"},
{"status do contrato":"Cancelados","categoria produto":"Medicamentos","id contrato":1131696,"razão social do cliente":"ATHENA Saúde - Hospital São Pedro","valor unitário":19537.3100000000,"quantidade acordada":"Não Estipulado","dias para encerramento do acordo":"Cancelados","cnpj cliente":"13.688.895/0001-40","título":"CONTRATO FARMA PONTUAL","produto":"TECENTRIQ 840 MG/14 ML SOL INJ","fim vigência":"2023-04-17T23:59:00Z","tipo de acordo":"Por período","data solicitação":"17/11/2022","início vigência":"2022-11-17T00:00:00Z"},
{"status do contrato":"Cancelados","categoria produto":"Medicamentos","id contrato":1131665,"razão social do cliente":"ATHENA Saúde - Hospital Bom Samaritano de Maringá S/A","valor unitário":259.9300000000,"quantidade acordada":"Não Estipulado","dias para encerramento do acordo":"Cancelados","cnpj cliente":"23.876.304/0001-12","título":"CONTRATO FARMA PONTUAL","produto":"KISQALI 200MG COMP","fim vigência":"2023-04-17T23:59:00Z","tipo de acordo":"Por período","data solicitação":"17/11/2022","início vigência":"2022-11-17T00:00:00Z"},
{"status do contrato":"Cancelados","categoria produto":"Medicamentos","id contrato":1131665,"razão social do cliente":"ATHENA Saúde - Hospital Bom Samaritano de Maringá S/A","valor unitário":1589.9300000000,"quantidade acordada":"Não Estipulado","dias para encerramento do acordo":"Cancelados","cnpj cliente":"23.876.304/0001-12","título":"CONTRATO FARMA PONTUAL","produto":"AVASTIN 100 MG SOL INJ","fim vigência":"2023-04-17T23:59:00Z","tipo de acordo":"Por período","data solicitação":"17/11/2022","início vigência":"2022-11-17T00:00:00Z"},
{"status do contrato":"Cancelados","categoria produto":"Medicamentos","id contrato":1131701,"razão social do cliente":"Hospital Marechal Candido Rondon S/a","valor unitário":637.5200000000,"quantidade acordada":"Não Estipulado","dias para encerramento do acordo":"Cancelados","cnpj cliente":"95.642.179/0028-07","título":"CONTRATO FARMA PONTUAL","produto":"MEKINIST 2MG COMP","fim vigência":"2023-04-17T23:59:00Z","tipo de acordo":"Por período","data solicitação":"17/11/2022","início vigência":"2022-11-17T00:00:00Z"},
{"status do contrato":"Cancelados","categoria produto":"Medicamentos","id contrato":1131702,"razão social do cliente":"ATHENA Saúde - Med Imagem S/C","valor unitário":102.4700000000,"quantidade acordada":"Não Estipulado","dias para encerramento do acordo":"Cancelados","cnpj cliente":"63.326.243/0001-34","título":"CONTRATO FARMA PONTUAL","produto":"TASIGNA 150MG CAP","fim vigência":"2023-04-17T23:59:00Z","tipo de acordo":"Por período","data solicitação":"17/11/2022","início vigência":"2022-11-17T00:00:00Z"},
{"status do contrato":"Cancelados","categoria produto":"Medicamentos","id contrato":1131665,"razão social do cliente":"ATHENA Saúde - Hospital Bom Samaritano de Maringá S/A","valor unitário":7580.0000000000,"quantidade acordada":"Não Estipulado","dias para encerramento do acordo":"Cancelados","cnpj cliente":"23.876.304/0001-12","título":"CONTRATO FARMA PONTUAL","produto":"KADCYLA 100MG PO LIOF","fim vigência":"2023-04-17T23:59:00Z","tipo de acordo":"Por período","data solicitação":"17/11/2022","início vigência":"2022-11-17T00:00:00Z"},
{"status do contrato":"Cancelados","categoria produto":"Medicamentos","id contrato":1136392,"razão social do cliente":"Consolidador - Grupo Athena","valor unitário":259.9300000000,"quantidade acordada":"Não Estipulado","dias para encerramento do acordo":"Cancelados","cnpj cliente":"26.753.292/0001-27","título":"ACORDO FARMA PONTUAL - SUDESTE","produto":"KISQALI 200MG COMP","fim vigência":"2023-04-15T23:59:00Z","tipo de acordo":"Por período","data solicitação":"28/12/2022","início vigência":"2022-12-28T00:00:00Z"},
{"status do contrato":"Cancelados","categoria produto":"Medicamentos","id contrato":1136392,"razão social do cliente":"Consolidador - Grupo Athena","valor unitário":637.5200000000,"quantidade acordada":"Não Estipulado","dias para encerramento do acordo":"Cancelados","cnpj cliente":"26.753.292/0001-27","título":"ACORDO FARMA PONTUAL - SUDESTE","produto":"MEKINIST 2MG COMP - COMPRIMIDO","fim vigência":"2023-04-15T23:59:00Z","tipo de acordo":"Por período","data solicitação":"28/12/2022","início vigência":"2022-12-28T00:00:00Z"},
{"status do contrato":"Cancelados","categoria produto":"Medicamentos","id contrato":1132246,"razão social do cliente":"ATHENA Saúde - Vitória Apart Hospital S/A","valor unitário":19537.3100000000,"quantidade acordada":"Não Estipulado","dias para encerramento do acordo":"Cancelados","cnpj cliente":"02.209.094/0001-39","título":"ACORDO FARMA PONTUAL","produto":"TECENTRIQ 840 MG/14 ML SOL INJ","fim vigência":"2023-04-15T23:59:00Z","tipo de acordo":"Por período","data solicitação":"07/12/2022","início vigência":"2022-12-07T00:00:00Z"},
{"status do contrato":"Cancelados","categoria produto":"Medicamentos","id contrato":1131792,"razão social do cliente":"ATHENA Saúde - Med Imagem S/C - Oncomédica","valor unitário":61.0000000000,"quantidade acordada":"Não Estipulado","dias para encerramento do acordo":"Cancelados","cnpj cliente":"63.326.243/0004-87","título":"CONTRATO FARMA PONTUAL","produto":"TYKERB 250 MG CP","fim vigência":"2023-04-15T23:59:00Z","tipo de acordo":"Por período","data solicitação":"21/11/2022","início vigência":"2022-11-21T00:00:00Z"},
{"status do contrato":"Cancelados","categoria produto":"Medicamentos","id contrato":1136392,"razão social do cliente":"Consolidador - Grupo Athena","valor unitário":27910.4400000000,"quantidade acordada":"Não Estipulado","dias para encerramento do acordo":"Cancelados","cnpj cliente":"26.753.292/0001-27","título":"ACORDO FARMA PONTUAL - SUDESTE","produto":"TECENTRIQ 1200 MG/20 ML SOLUCAO INJ - FRASCO/AMPOLA","fim vigência":"2023-04-15T23:59:00Z","tipo de acordo":"Por período","data solicitação":"28/12/2022","início vigência":"2022-12-28T00:00:00Z"},
{"status do contrato":"Cancelados","categoria produto":"Medicamentos","id contrato":1136391,"razão social do cliente":"Consolidador - Grupo Athena","valor unitário":61.0000000000,"quantidade acordada":"Não Estipulado","dias para encerramento do acordo":"Cancelados","cnpj cliente":"26.753.292/0001-27","título":"ACORDO FARMA PONTUAL","produto":"TYKERB 250 MG  - COMPRIMIDO","fim vigência":"2023-04-15T23:59:00Z","tipo de acordo":"Por período","data solicitação":"28/12/2022","início vigência":"2022-12-28T00:00:00Z"},
{"status do contrato":"Cancelados","categoria produto":"Medicamentos","id contrato":1136391,"razão social do cliente":"Consolidador - Grupo Athena","valor unitário":6156.0700000000,"quantidade acordada":"Não Estipulado","dias para encerramento do acordo":"Cancelados","cnpj cliente":"26.753.292/0001-27","título":"ACORDO FARMA PONTUAL","produto":"AVASTIN 400 MG SOL INJ","fim vigência":"2023-04-15T23:59:00Z","tipo de acordo":"Por período","data solicitação":"28/12/2022","início vigência":"2022-12-28T00:00:00Z"},
{"status do contrato":"Cancelados","categoria produto":"Medicamentos","id contrato":1136392,"razão social do cliente":"Consolidador - Grupo Athena","valor unitário":19537.3100000000,"quantidade acordada":"Não Estipulado","dias para encerramento do acordo":"Cancelados","cnpj cliente":"26.753.292/0001-27","título":"ACORDO FARMA PONTUAL - SUDESTE","produto":"TECENTRIQ 840 MG/14 ML SOL INJ","fim vigência":"2023-04-15T23:59:00Z","tipo de acordo":"Por período","data solicitação":"28/12/2022","início vigência":"2022-12-28T00:00:00Z"},
{"status do contrato":"Cancelados","categoria produto":"Medicamentos","id contrato":1136392,"razão social do cliente":"Consolidador - Grupo Athena","valor unitário":7580.0000000000,"quantidade acordada":"Não Estipulado","dias para encerramento do acordo":"Cancelados","cnpj cliente":"26.753.292/0001-27","título":"ACORDO FARMA PONTUAL - SUDESTE","produto":"KADCYLA 100 MG PO LIOF INJ","fim vigência":"2023-04-15T23:59:00Z","tipo de acordo":"Por período","data solicitação":"28/12/2022","início vigência":"2022-12-28T00:00:00Z"},
{"status do contrato":"Cancelados","categoria produto":"Medicamentos","id contrato":1131792,"razão social do cliente":"ATHENA Saúde - Med Imagem S/C - Oncomédica","valor unitário":19537.3100000000,"quantidade acordada":"Não Estipulado","dias para encerramento do acordo":"Cancelados","cnpj cliente":"63.326.243/0004-87","título":"CONTRATO FARMA PONTUAL","produto":"TECENTRIQ 840 MG/14 ML SOL INJ","fim vigência":"2023-04-15T23:59:00Z","tipo de acordo":"Por período","data solicitação":"21/11/2022","início vigência":"2022-11-21T00:00:00Z"},
{"status do contrato":"Cancelados","categoria produto":"Medicamentos","id contrato":1132246,"razão social do cliente":"ATHENA Saúde - Vitória Apart Hospital S/A","valor unitário":259.9300000000,"quantidade acordada":"Não Estipulado","dias para encerramento do acordo":"Cancelados","cnpj cliente":"02.209.094/0001-39","título":"ACORDO FARMA PONTUAL","produto":"KISQALI 200MG COMP","fim vigência":"2023-04-15T23:59:00Z","tipo de acordo":"Por período","data solicitação":"07/12/2022","início vigência":"2022-12-07T00:00:00Z"},
{"status do contrato":"Cancelados","categoria produto":"Medicamentos","id contrato":1132246,"razão social do cliente":"ATHENA Saúde - Vitória Apart Hospital S/A","valor unitário":120.5600000000,"quantidade acordada":"Não Estipulado","dias para encerramento do acordo":"Cancelados","cnpj cliente":"02.209.094/0001-39","título":"ACORDO FARMA PONTUAL","produto":"TASIGNA 200 MG CAP","fim vigência":"2023-04-15T23:59:00Z","tipo de acordo":"Por período","data solicitação":"07/12/2022","início vigência":"2022-12-07T00:00:00Z"},
{"status do contrato":"Cancelados","categoria produto":"Medicamentos","id contrato":1136391,"razão social do cliente":"Consolidador - Grupo Athena","valor unitário":259.9300000000,"quantidade acordada":"Não Estipulado","dias para encerramento do acordo":"Cancelados","cnpj cliente":"26.753.292/0001-27","título":"ACORDO FARMA PONTUAL","produto":"KISQALI 200MG COMP","fim vigência":"2023-04-15T23:59:00Z","tipo de acordo":"Por período","data solicitação":"28/12/2022","início vigência":"2022-12-28T00:00:00Z"},
{"status do contrato":"Cancelados","categoria produto":"Medicamentos","id contrato":1136392,"razão social do cliente":"Consolidador - Grupo Athena","valor unitário":120.5600000000,"quantidade acordada":"Não Estipulado","dias para encerramento do acordo":"Cancelados","cnpj cliente":"26.753.292/0001-27","título":"ACORDO FARMA PONTUAL - SUDESTE","produto":"TASIGNA 200 MG  - CAPSULA","fim vigência":"2023-04-15T23:59:00Z","tipo de acordo":"Por período","data solicitação":"28/12/2022","início vigência":"2022-12-28T00:00:00Z"},
{"status do contrato":"Cancelados","categoria produto":"Medicamentos","id contrato":1131792,"razão social do cliente":"ATHENA Saúde - Med Imagem S/C - Oncomédica","valor unitário":102.4700000000,"quantidade acordada":"Não Estipulado","dias para encerramento do acordo":"Cancelados","cnpj cliente":"63.326.243/0004-87","título":"CONTRATO FARMA PONTUAL","produto":"TASIGNA 150MG CAP | Capsula | -","fim vigência":"2023-04-15T23:59:00Z","tipo de acordo":"Por período","data solicitação":"21/11/2022","início vigência":"2022-11-21T00:00:00Z"},
{"status do contrato":"Cancelados","categoria produto":"Medicamentos","id contrato":1132246,"razão social do cliente":"ATHENA Saúde - Vitória Apart Hospital S/A","valor unitário":27910.4400000000,"quantidade acordada":"Não Estipulado","dias para encerramento do acordo":"Cancelados","cnpj cliente":"02.209.094/0001-39","título":"ACORDO FARMA PONTUAL","produto":"TECENTRIQ 1200 MG/20 ML SOL INJ","fim vigência":"2023-04-15T23:59:00Z","tipo de acordo":"Por período","data solicitação":"07/12/2022","início vigência":"2022-12-07T00:00:00Z"},
{"status do contrato":"Cancelados","categoria produto":"Medicamentos","id contrato":1132246,"razão social do cliente":"ATHENA Saúde - Vitória Apart Hospital S/A","valor unitário":102.4700000000,"quantidade acordada":"Não Estipulado","dias para encerramento do acordo":"Cancelados","cnpj cliente":"02.209.094/0001-39","título":"ACORDO FARMA PONTUAL","produto":"TASIGNA 150MG CAP","fim vigência":"2023-04-15T23:59:00Z","tipo de acordo":"Por período","data solicitação":"07/12/2022","início vigência":"2022-12-07T00:00:00Z"},
{"status do contrato":"Cancelados","categoria produto":"Medicamentos","id contrato":1131792,"razão social do cliente":"ATHENA Saúde - Med Imagem S/C - Oncomédica","valor unitário":1589.9300000000,"quantidade acordada":"Não Estipulado","dias para encerramento do acordo":"Cancelados","cnpj cliente":"63.326.243/0004-87","título":"CONTRATO FARMA PONTUAL","produto":"AVASTIN 100 MG SOL INJ","fim vigência":"2023-04-15T23:59:00Z","tipo de acordo":"Por período","data solicitação":"21/11/2022","início vigência":"2022-11-21T00:00:00Z"},
{"status do contrato":"Cancelados","categoria produto":"Medicamentos","id contrato":1136391,"razão social do cliente":"Consolidador - Grupo Athena","valor unitário":27910.4400000000,"quantidade acordada":"Não Estipulado","dias para encerramento do acordo":"Cancelados","cnpj cliente":"26.753.292/0001-27","título":"ACORDO FARMA PONTUAL","produto":"TECENTRIQ 1200 MG/20 ML SOLUCAO INJ - FRASCO/AMPOLA","fim vigência":"2023-04-15T23:59:00Z","tipo de acordo":"Por período","data solicitação":"28/12/2022","início vigência":"2022-12-28T00:00:00Z"},
{"status do contrato":"Cancelados","categoria produto":"Medicamentos","id contrato":1136392,"razão social do cliente":"Consolidador - Grupo Athena","valor unitário":61.0000000000,"quantidade acordada":"Não Estipulado","dias para encerramento do acordo":"Cancelados","cnpj cliente":"26.753.292/0001-27","título":"ACORDO FARMA PONTUAL - SUDESTE","produto":"TYKERB 250 MG  - COMPRIMIDO","fim vigência":"2023-04-15T23:59:00Z","tipo de acordo":"Por período","data solicitação":"28/12/2022","início vigência":"2022-12-28T00:00:00Z"},
{"status do contrato":"Cancelados","categoria produto":"Medicamentos","id contrato":1131792,"razão social do cliente":"ATHENA Saúde - Med Imagem S/C - Oncomédica","valor unitário":27910.4400000000,"quantidade acordada":"Não Estipulado","dias para encerramento do acordo":"Cancelados","cnpj cliente":"63.326.243/0004-87","título":"CONTRATO FARMA PONTUAL","produto":"TECENTRIQ 60MG/ML SOL DIL 20ML","fim vigência":"2023-04-15T23:59:00Z","tipo de acordo":"Por período","data solicitação":"21/11/2022","início vigência":"2022-11-21T00:00:00Z"},
{"status do contrato":"Cancelados","categoria produto":"Medicamentos","id contrato":1132246,"razão social do cliente":"ATHENA Saúde - Vitória Apart Hospital S/A","valor unitário":637.5200000000,"quantidade acordada":"Não Estipulado","dias para encerramento do acordo":"Cancelados","cnpj cliente":"02.209.094/0001-39","título":"ACORDO FARMA PONTUAL","produto":"MEKINIST 2MG COMP","fim vigência":"2023-04-15T23:59:00Z","tipo de acordo":"Por período","data solicitação":"07/12/2022","início vigência":"2022-12-07T00:00:00Z"},
{"status do contrato":"Cancelados","categoria produto":"Medicamentos","id contrato":1136391,"razão social do cliente":"Consolidador - Grupo Athena","valor unitário":102.4700000000,"quantidade acordada":"Não Estipulado","dias para encerramento do acordo":"Cancelados","cnpj cliente":"26.753.292/0001-27","título":"ACORDO FARMA PONTUAL","produto":"TASIGNA 150MG CAP","fim vigência":"2023-04-15T23:59:00Z","tipo de acordo":"Por período","data solicitação":"28/12/2022","início vigência":"2022-12-28T00:00:00Z"},
{"status do contrato":"Cancelados","categoria produto":"Medicamentos","id contrato":1136391,"razão social do cliente":"Consolidador - Grupo Athena","valor unitário":315.2600000000,"quantidade acordada":"Não Estipulado","dias para encerramento do acordo":"Cancelados","cnpj cliente":"26.753.292/0001-27","título":"ACORDO FARMA PONTUAL","produto":"COTELLIC 20MG CP","fim vigência":"2023-04-15T23:59:00Z","tipo de acordo":"Por período","data solicitação":"28/12/2022","início vigência":"2022-12-28T00:00:00Z"},
{"status do contrato":"Cancelados","categoria produto":"Medicamentos","id contrato":1132246,"razão social do cliente":"ATHENA Saúde - Vitória Apart Hospital S/A","valor unitário":61.0000000000,"quantidade acordada":"Não Estipulado","dias para encerramento do acordo":"Cancelados","cnpj cliente":"02.209.094/0001-39","título":"ACORDO FARMA PONTUAL","produto":"TYKERB 250 MG CP","fim vigência":"2023-04-15T23:59:00Z","tipo de acordo":"Por período","data solicitação":"07/12/2022","início vigência":"2022-12-07T00:00:00Z"},
{"status do contrato":"Cancelados","categoria produto":"Medicamentos","id contrato":1136392,"razão social do cliente":"Consolidador - Grupo Athena","valor unitário":102.4700000000,"quantidade acordada":"Não Estipulado","dias para encerramento do acordo":"Cancelados","cnpj cliente":"26.753.292/0001-27","título":"ACORDO FARMA PONTUAL - SUDESTE","produto":"TASIGNA 150MG CAP","fim vigência":"2023-04-15T23:59:00Z","tipo de acordo":"Por período","data solicitação":"28/12/2022","início vigência":"2022-12-28T00:00:00Z"},
{"status do contrato":"Cancelados","categoria produto":"Medicamentos","id contrato":1136391,"razão social do cliente":"Consolidador - Grupo Athena","valor unitário":7580.0000000000,"quantidade acordada":"Não Estipulado","dias para encerramento do acordo":"Cancelados","cnpj cliente":"26.753.292/0001-27","título":"ACORDO FARMA PONTUAL","produto":"KADCYLA 100 MG PO LIOF INJ","fim vigência":"2023-04-15T23:59:00Z","tipo de acordo":"Por período","data solicitação":"28/12/2022","início vigência":"2022-12-28T00:00:00Z"},
{"status do contrato":"Cancelados","categoria produto":"Medicamentos","id contrato":1136391,"razão social do cliente":"Consolidador - Grupo Athena","valor unitário":120.5600000000,"quantidade acordada":"Não Estipulado","dias para encerramento do acordo":"Cancelados","cnpj cliente":"26.753.292/0001-27","título":"ACORDO FARMA PONTUAL","produto":"TASIGNA 200 MG  - CAPSULA","fim vigência":"2023-04-15T23:59:00Z","tipo de acordo":"Por período","data solicitação":"28/12/2022","início vigência":"2022-12-28T00:00:00Z"},
{"status do contrato":"Cancelados","categoria produto":"Medicamentos","id contrato":1131792,"razão social do cliente":"ATHENA Saúde - Med Imagem S/C - Oncomédica","valor unitário":6156.0700000000,"quantidade acordada":"Não Estipulado","dias para encerramento do acordo":"Cancelados","cnpj cliente":"63.326.243/0004-87","título":"CONTRATO FARMA PONTUAL","produto":"AVASTIN 400 MG SOL INJ","fim vigência":"2023-04-15T23:59:00Z","tipo de acordo":"Por período","data solicitação":"21/11/2022","início vigência":"2022-11-21T00:00:00Z"},
{"status do contrato":"Cancelados","categoria produto":"Medicamentos","id contrato":1131792,"razão social do cliente":"ATHENA Saúde - Med Imagem S/C - Oncomédica","valor unitário":120.5600000000,"quantidade acordada":"Não Estipulado","dias para encerramento do acordo":"Cancelados","cnpj cliente":"63.326.243/0004-87","título":"CONTRATO FARMA PONTUAL","produto":"TASIGNA 200MG CAP","fim vigência":"2023-04-15T23:59:00Z","tipo de acordo":"Por período","data solicitação":"21/11/2022","início vigência":"2022-11-21T00:00:00Z"},
{"status do contrato":"Cancelados","categoria produto":"Medicamentos","id contrato":1131792,"razão social do cliente":"ATHENA Saúde - Med Imagem S/C - Oncomédica","valor unitário":7580.0000000000,"quantidade acordada":"Não Estipulado","dias para encerramento do acordo":"Cancelados","cnpj cliente":"63.326.243/0004-87","título":"CONTRATO FARMA PONTUAL","produto":"KADCYLA 100MG PO LIOF | Frasco/Ampola | -","fim vigência":"2023-04-15T23:59:00Z","tipo de acordo":"Por período","data solicitação":"21/11/2022","início vigência":"2022-11-21T00:00:00Z"},
{"status do contrato":"Cancelados","categoria produto":"Medicamentos","id contrato":1136392,"razão social do cliente":"Consolidador - Grupo Athena","valor unitário":6156.0700000000,"quantidade acordada":"Não Estipulado","dias para encerramento do acordo":"Cancelados","cnpj cliente":"26.753.292/0001-27","título":"ACORDO FARMA PONTUAL - SUDESTE","produto":"AVASTIN 400 MG SOL INJ","fim vigência":"2023-04-15T23:59:00Z","tipo de acordo":"Por período","data solicitação":"28/12/2022","início vigência":"2022-12-28T00:00:00Z"},
{"status do contrato":"Cancelados","categoria produto":"Medicamentos","id contrato":1132246,"razão social do cliente":"ATHENA Saúde - Vitória Apart Hospital S/A","valor unitário":6156.0700000000,"quantidade acordada":"Não Estipulado","dias para encerramento do acordo":"Cancelados","cnpj cliente":"02.209.094/0001-39","título":"ACORDO FARMA PONTUAL","produto":"AVASTIN 400 MG SOL INJ","fim vigência":"2023-04-15T23:59:00Z","tipo de acordo":"Por período","data solicitação":"07/12/2022","início vigência":"2022-12-07T00:00:00Z"},
{"status do contrato":"Cancelados","categoria produto":"Medicamentos","id contrato":1132246,"razão social do cliente":"ATHENA Saúde - Vitória Apart Hospital S/A","valor unitário":7580.0000000000,"quantidade acordada":"Não Estipulado","dias para encerramento do acordo":"Cancelados","cnpj cliente":"02.209.094/0001-39","título":"ACORDO FARMA PONTUAL","produto":"KADCYLA 100 MG PO LIOF INJ","fim vigência":"2023-04-15T23:59:00Z","tipo de acordo":"Por período","data solicitação":"07/12/2022","início vigência":"2022-12-07T00:00:00Z"},
{"status do contrato":"Cancelados","categoria produto":"Medicamentos","id contrato":1136391,"razão social do cliente":"Consolidador - Grupo Athena","valor unitário":637.5200000000,"quantidade acordada":"Não Estipulado","dias para encerramento do acordo":"Cancelados","cnpj cliente":"26.753.292/0001-27","título":"ACORDO FARMA PONTUAL","produto":"MEKINIST 2MG COMP - COMPRIMIDO","fim vigência":"2023-04-15T23:59:00Z","tipo de acordo":"Por período","data solicitação":"28/12/2022","início vigência":"2022-12-28T00:00:00Z"},
{"status do contrato":"Cancelados","categoria produto":"Medicamentos","id contrato":1132246,"razão social do cliente":"ATHENA Saúde - Vitória Apart Hospital S/A","valor unitário":315.2600000000,"quantidade acordada":"Não Estipulado","dias para encerramento do acordo":"Cancelados","cnpj cliente":"02.209.094/0001-39","título":"ACORDO FARMA PONTUAL","produto":"COTELLIC 20MG CP","fim vigência":"2023-04-15T23:59:00Z","tipo de acordo":"Por período","data solicitação":"07/12/2022","início vigência":"2022-12-07T00:00:00Z"},
{"status do contrato":"Cancelados","categoria produto":"Medicamentos","id contrato":1131792,"razão social do cliente":"ATHENA Saúde - Med Imagem S/C - Oncomédica","valor unitário":315.2600000000,"quantidade acordada":"Não Estipulado","dias para encerramento do acordo":"Cancelados","cnpj cliente":"63.326.243/0004-87","título":"CONTRATO FARMA PONTUAL","produto":"COTELLIC 20MG CP","fim vigência":"2023-04-15T23:59:00Z","tipo de acordo":"Por período","data solicitação":"21/11/2022","início vigência":"2022-11-21T00:00:00Z"},
{"status do contrato":"Cancelados","categoria produto":"Medicamentos","id contrato":1136391,"razão social do cliente":"Consolidador - Grupo Athena","valor unitário":19537.3100000000,"quantidade acordada":"Não Estipulado","dias para encerramento do acordo":"Cancelados","cnpj cliente":"26.753.292/0001-27","título":"ACORDO FARMA PONTUAL","produto":"TECENTRIQ 840 MG/14 ML SOL INJ","fim vigência":"2023-04-15T23:59:00Z","tipo de acordo":"Por período","data solicitação":"28/12/2022","início vigência":"2022-12-28T00:00:00Z"},
{"status do contrato":"Cancelados","categoria produto":"Medicamentos","id contrato":1136392,"razão social do cliente":"Consolidador - Grupo Athena","valor unitário":1589.9300000000,"quantidade acordada":"Não Estipulado","dias para encerramento do acordo":"Cancelados","cnpj cliente":"26.753.292/0001-27","título":"ACORDO FARMA PONTUAL - SUDESTE","produto":"AVASTIN 100 MG SOL INJ","fim vigência":"2023-04-15T23:59:00Z","tipo de acordo":"Por período","data solicitação":"28/12/2022","início vigência":"2022-12-28T00:00:00Z"},
{"status do contrato":"Cancelados","categoria produto":"Medicamentos","id contrato":1132246,"razão social do cliente":"ATHENA Saúde - Vitória Apart Hospital S/A","valor unitário":1589.9300000000,"quantidade acordada":"Não Estipulado","dias para encerramento do acordo":"Cancelados","cnpj cliente":"02.209.094/0001-39","título":"ACORDO FARMA PONTUAL","produto":"AVASTIN 100 MG SOL INJ","fim vigência":"2023-04-15T23:59:00Z","tipo de acordo":"Por período","data solicitação":"07/12/2022","início vigência":"2022-12-07T00:00:00Z"},
{"status do contrato":"Cancelados","categoria produto":"Medicamentos","id contrato":1131792,"razão social do cliente":"ATHENA Saúde - Med Imagem S/C - Oncomédica","valor unitário":637.5200000000,"quantidade acordada":"Não Estipulado","dias para encerramento do acordo":"Cancelados","cnpj cliente":"63.326.243/0004-87","título":"CONTRATO FARMA PONTUAL","produto":"MEKINIST 2MG COMP","fim vigência":"2023-04-15T23:59:00Z","tipo de acordo":"Por período","data solicitação":"21/11/2022","início vigência":"2022-11-21T00:00:00Z"},
{"status do contrato":"Cancelados","categoria produto":"Medicamentos","id contrato":1136391,"razão social do cliente":"Consolidador - Grupo Athena","valor unitário":1589.9300000000,"quantidade acordada":"Não Estipulado","dias para encerramento do acordo":"Cancelados","cnpj cliente":"26.753.292/0001-27","título":"ACORDO FARMA PONTUAL","produto":"AVASTIN 100 MG SOL INJ","fim vigência":"2023-04-15T23:59:00Z","tipo de acordo":"Por período","data solicitação":"28/12/2022","início vigência":"2022-12-28T00:00:00Z"},
{"status do contrato":"Cancelados","categoria produto":"Medicamentos","id contrato":1131792,"razão social do cliente":"ATHENA Saúde - Med Imagem S/C - Oncomédica","valor unitário":259.9300000000,"quantidade acordada":"Não Estipulado","dias para encerramento do acordo":"Cancelados","cnpj cliente":"63.326.243/0004-87","título":"CONTRATO FARMA PONTUAL","produto":"KISQALI 200MG COMP","fim vigência":"2023-04-15T23:59:00Z","tipo de acordo":"Por período","data solicitação":"21/11/2022","início vigência":"2022-11-21T00:00:00Z"},
{"status do contrato":"Cancelados","categoria produto":"Medicamentos","id contrato":1136392,"razão social do cliente":"Consolidador - Grupo Athena","valor unitário":315.2600000000,"quantidade acordada":"Não Estipulado","dias para encerramento do acordo":"Cancelados","cnpj cliente":"26.753.292/0001-27","título":"ACORDO FARMA PONTUAL - SUDESTE","produto":"COTELLIC 20MG CP","fim vigência":"2023-04-15T23:59:00Z","tipo de acordo":"Por período","data solicitação":"28/12/2022","início vigência":"2022-12-28T00:00:00Z"},
{"status do contrato":"Cancelados","categoria produto":"Medicamentos","id contrato":1141430,"razão social do cliente":"Unimed de Presidente Prudente Cooperativa De Trabalho Médico","valor unitário":248.7000000000,"quantidade acordada":"Não Estipulado","dias para encerramento do acordo":"Cancelados","cnpj cliente":"44.863.959/0001-26","título":"ACORDO PONTUAL NR2006 - JAN A MARÇO ","produto":"REVOLADE 50 MG COM REV CT BL AL/AL X 14 | Comprimido | -","fim vigência":"2023-03-31T23:59:00Z","tipo de acordo":"Por período","data solicitação":"11/01/2023","início vigência":"2023-01-11T00:00:00Z"},
{"status do contrato":"Cancelados","categoria produto":"Medicamentos","id contrato":361309,"razão social do cliente":"Unimed de Presidente Prudente Cooperativa De Trabalho Médico","valor unitário":259.3100000000,"quantidade acordada":"Não Estipulado","dias para encerramento do acordo":"Cancelados","cnpj cliente":"44.863.959/0001-26","título":"ACORDO NR2006 (PONTUAL FARMACEUTICA)","produto":"KISQALI 200 MG/DOSE COM REV CT BL AL PLAS TRANS X 63 | Comprimido | -","fim vigência":"2022-07-31T23:59:00Z","tipo de acordo":"Por período","data solicitação":"10/05/2022","início vigência":"2022-05-10T00:00:00Z"},
{"status do contrato":"Cancelados","categoria produto":"Medicamentos","id contrato":205741,"razão social do cliente":"Cruz Azul de Sao Paulo","valor unitário":1530.0000000000,"quantidade acordada":"Não Estipulado","dias para encerramento do acordo":"Cancelados","cnpj cliente":"62.106.505/0001-92","título":"ACORDO COMERCIAL ONCOLÓGICO PONTUAL","produto":"BEVACIZUMABE 100MG FR/AMP | Frasco/Ampola | ROCHE | Frasco/Ampola | ROCHE/LIBBS","fim vigência":"2022-03-31T23:59:00Z","tipo de acordo":"Por período","data solicitação":"28/05/2021","início vigência":"2021-05-28T00:00:00Z"},
{"status do contrato":"Cancelados","categoria produto":"Medicamentos","id contrato":205741,"razão social do cliente":"Cruz Azul de Sao Paulo","valor unitário":6786.2200000000,"quantidade acordada":"Não Estipulado","dias para encerramento do acordo":"Cancelados","cnpj cliente":"62.106.505/0001-92","título":"ACORDO COMERCIAL ONCOLÓGICO PONTUAL","produto":"SANDOSTATIN LAR 30MG FR/AMP (N.P.) | Frasco/Ampola | NOVARTIS | Frasco/Ampola | NOVARTIS","fim vigência":"2022-03-31T23:59:00Z","tipo de acordo":"Por período","data solicitação":"28/05/2021","início vigência":"2021-05-28T00:00:00Z"},
{"status do contrato":"Cancelados","categoria produto":"Medicamentos","id contrato":205741,"razão social do cliente":"Cruz Azul de Sao Paulo","valor unitário":11175.4200000000,"quantidade acordada":"Não Estipulado","dias para encerramento do acordo":"Cancelados","cnpj cliente":"62.106.505/0001-92","título":"ACORDO COMERCIAL ONCOLÓGICO PONTUAL","produto":"TRANSTUZUMAB EMTASINE 160MG FR/AMP | Frasco/Ampola | ROCHE | Frasco/Ampola | ROCHE | Frasco/Ampola | ROCHE","fim vigência":"2022-03-31T23:59:00Z","tipo de acordo":"Por período","data solicitação":"28/05/2021","início vigência":"2021-05-28T00:00:00Z"},
{"status do contrato":"Cancelados","categoria produto":"Medicamentos","id contrato":205741,"razão social do cliente":"Cruz Azul de Sao Paulo","valor unitário":104.8655000000,"quantidade acordada":"Não Estipulado","dias para encerramento do acordo":"Cancelados","cnpj cliente":"62.106.505/0001-92","título":"ACORDO COMERCIAL ONCOLÓGICO PONTUAL","produto":"SORAFENIBE TOSILATO 200MG COMP. | Comprimido | BAYER","fim vigência":"2022-03-31T23:59:00Z","tipo de acordo":"Por período","data solicitação":"28/05/2021","início vigência":"2021-05-28T00:00:00Z"},
{"status do contrato":"Cancelados","categoria produto":"Medicamentos","id contrato":205741,"razão social do cliente":"Cruz Azul de Sao Paulo","valor unitário":5900.0000000000,"quantidade acordada":"Não Estipulado","dias para encerramento do acordo":"Cancelados","cnpj cliente":"62.106.505/0001-92","título":"ACORDO COMERCIAL ONCOLÓGICO PONTUAL","produto":"BEVACIZUMABE 400MG FR/AMP | Frasco | ROCHE | Frasco | ROCHE/LIBBS","fim vigência":"2022-03-31T23:59:00Z","tipo de acordo":"Por período","data solicitação":"28/05/2021","início vigência":"2021-05-28T00:00:00Z"},
{"status do contrato":"Expirados","categoria produto":"Medicamentos","id contrato":1783404,"razão social do cliente":"Unimed Vitória Cooperativa de Trabalho Médico","valor unitário":13980.0000000000,"quantidade acordada":"Não Estipulado","dias para encerramento do acordo":"Expirados","cnpj cliente":"27.578.434/0015-25","título":"ACORDO COMERCIAL - PERJETA e OCREVUS - AX 0001-00394","produto":"PERJETA 420MG/14ML - F/A (?C)","fim vigência":"2025-03-31T23:59:00Z","tipo de acordo":"Por período","data solicitação":"06/01/2025","início vigência":"2025-01-06T00:00:00Z"},
{"status do contrato":"Expirados","categoria produto":"Medicamentos","id contrato":1783404,"razão social do cliente":"Unimed Vitória Cooperativa de Trabalho Médico","valor unitário":40590.0000000000,"quantidade acordada":"Não Estipulado","dias para encerramento do acordo":"Expirados","cnpj cliente":"27.578.434/0015-25","título":"ACORDO COMERCIAL - PERJETA e OCREVUS - AX 0001-00394","produto":"OCREVUS 30MG/ML 10ML - F/A","fim vigência":"2025-03-31T23:59:00Z","tipo de acordo":"Por período","data solicitação":"06/01/2025","início vigência":"2025-01-06T00:00:00Z"},
{"status do contrato":"Expirados","categoria produto":"Medicamentos","id contrato":1668888,"razão social do cliente":"Unimed Vitória Cooperativa de Trabalho Médico","valor unitário":8.8000000000,"quantidade acordada":"Não Estipulado","dias para encerramento do acordo":"Expirados","cnpj cliente":"27.578.434/0015-25","título":"ACORDO REF.MEDICAMENTOS - AX REF 0001-00340","produto":"PROPOFOL 1% 20ML - INJETAVEL","fim vigência":"2025-03-31T23:59:00Z","tipo de acordo":"Por período","data solicitação":"05/08/2024","início vigência":"2024-08-05T00:00:00Z"},
{"status do contrato":"Expirados","categoria produto":"Medicamentos","id contrato":1793196,"razão social do cliente":"Unimed Marília Cooperativa De Trabalho Médico","valor unitário":86.9938000000,"quantidade acordada":"Não Estipulado","dias para encerramento do acordo":"Expirados","cnpj cliente":"66.872.888/0001-60","título":"ACORDO COMERCIAL - ONCO - PONTUAL","produto":"NUBEQA 300MG COMP CX C/120 | Unidade","fim vigência":"2025-03-31T18:14:00Z","tipo de acordo":"Por período","data solicitação":"16/01/2025","início vigência":"2025-01-16T18:14:00Z"},
{"status do contrato":"Expirados","categoria produto":"Medicamentos","id contrato":1793196,"razão social do cliente":"Unimed Marília Cooperativa De Trabalho Médico","valor unitário":109.7300000000,"quantidade acordada":"Não Estipulado","dias para encerramento do acordo":"Expirados","cnpj cliente":"66.872.888/0001-60","título":"ACORDO COMERCIAL - ONCO - PONTUAL","produto":"NEXAVAR 200 MG 60 BAYER - COMPRIMIDO | Comprimido | ACEITA ALTERNATIVAS","fim vigência":"2025-03-31T18:14:00Z","tipo de acordo":"Por período","data solicitação":"16/01/2025","início vigência":"2025-01-16T18:14:00Z"},
{"status do contrato":"Expirados","categoria produto":"Medicamentos","id contrato":1673039,"razão social do cliente":"Cruz Azul de Sao Paulo","valor unitário":11405.0000000000,"quantidade acordada":"Não Estipulado","dias para encerramento do acordo":"Expirados","cnpj cliente":"62.106.505/0001-92","título":"ACORDO COMERCIAL HOSPITALAR - PONTUAL CMED 2025 ","produto":"OFATUMUMABE 20MG/0,4ML (SERINGA PREENCHIDA) | Seringa | NOVARTIS | Seringa | NOVARTIS","fim vigência":"2025-03-31T11:29:00Z","tipo de acordo":"Por período","data solicitação":"16/08/2024","início vigência":"2024-08-16T11:29:00Z"},
{"status do contrato":"Expirados","categoria produto":"Medicamentos","id contrato":1673039,"razão social do cliente":"Cruz Azul de Sao Paulo","valor unitário":535.3000000000,"quantidade acordada":"Não Estipulado","dias para encerramento do acordo":"Expirados","cnpj cliente":"62.106.505/0001-92","título":"ACORDO COMERCIAL HOSPITALAR - PONTUAL CMED 2025 ","produto":"ACALABRUTINIBE 100MG CAPSULA (N.P.) | Capsula","fim vigência":"2025-03-31T11:29:00Z","tipo de acordo":"Por período","data solicitação":"16/08/2024","início vigência":"2024-08-16T11:29:00Z"},
{"status do contrato":"Expirados","categoria produto":"Medicamentos","id contrato":1673039,"razão social do cliente":"Cruz Azul de Sao Paulo","valor unitário":2886.0800000000,"quantidade acordada":"Não Estipulado","dias para encerramento do acordo":"Expirados","cnpj cliente":"62.106.505/0001-92","título":"ACORDO COMERCIAL HOSPITALAR - PONTUAL CMED 2025 ","produto":"BELIMUMABE 400MG FR/AMP (N.P.) | Frasco/Ampola | -","fim vigência":"2025-03-31T11:29:00Z","tipo de acordo":"Por período","data solicitação":"16/08/2024","início vigência":"2024-08-16T11:29:00Z"},
{"status do contrato":"Expirados","categoria produto":"Medicamentos","id contrato":1673039,"razão social do cliente":"Cruz Azul de Sao Paulo","valor unitário":3510.0000000000,"quantidade acordada":"Não Estipulado","dias para encerramento do acordo":"Expirados","cnpj cliente":"62.106.505/0001-92","título":"ACORDO COMERCIAL HOSPITALAR - PONTUAL CMED 2025 ","produto":"PALIVIZUMAB 50MG/0,5ML FR/AMP (N.P.) | Frasco/Ampola | -","fim vigência":"2025-03-31T11:29:00Z","tipo de acordo":"Por período","data solicitação":"16/08/2024","início vigência":"2024-08-16T11:29:00Z"},
{"status do contrato":"Expirados","categoria produto":"Medicamentos","id contrato":1673039,"razão social do cliente":"Cruz Azul de Sao Paulo","valor unitário":14450.0000000000,"quantidade acordada":"Não Estipulado","dias para encerramento do acordo":"Expirados","cnpj cliente":"62.106.505/0001-92","título":"ACORDO COMERCIAL HOSPITALAR - PONTUAL CMED 2025 ","produto":"BENRALIZUMAB 30MG/ML SER.PREENCHIDA 1ML (N.P.) | Seringa | ASTRAZENECA","fim vigência":"2025-03-31T11:29:00Z","tipo de acordo":"Por período","data solicitação":"16/08/2024","início vigência":"2024-08-16T11:29:00Z"},
{"status do contrato":"Expirados","categoria produto":"Medicamentos","id contrato":1788219,"razão social do cliente":"Unimed Marília Cooperativa De Trabalho Médico","valor unitário":1159.4200000000,"quantidade acordada":"Não Estipulado","dias para encerramento do acordo":"Expirados","cnpj cliente":"66.872.888/0001-60","título":"ACORDO COMERCIAL - ONCO - PONTUAL","produto":"ZOLADEX 10.8 MG (ASTRA ZENECA) - SERINGA | Seringa | ACEITA ALTERNATIVAS","fim vigência":"2025-03-31T00:00:00Z","tipo de acordo":"Por período","data solicitação":"15/01/2025","início vigência":"2025-01-15T00:00:00Z"},
{"status do contrato":"Expirados","categoria produto":"Medicamentos","id contrato":1788219,"razão social do cliente":"Unimed Marília Cooperativa De Trabalho Médico","valor unitário":863.0000000000,"quantidade acordada":"Não Estipulado","dias para encerramento do acordo":"Expirados","cnpj cliente":"66.872.888/0001-60","título":"ACORDO COMERCIAL - ONCO - PONTUAL","produto":"BENLYSTA (BELIMUMABE) 120 MG - FRASCO/AMPOLA | Frasco/Ampola | ACEITA ALTERNATIVAS","fim vigência":"2025-03-31T00:00:00Z","tipo de acordo":"Por período","data solicitação":"15/01/2025","início vigência":"2025-01-15T00:00:00Z"},
{"status do contrato":"Expirados","categoria produto":"Medicamentos","id contrato":1788219,"razão social do cliente":"Unimed Marília Cooperativa De Trabalho Médico","valor unitário":107.4460000000,"quantidade acordada":"Não Estipulado","dias para encerramento do acordo":"Expirados","cnpj cliente":"66.872.888/0001-60","título":"ACORDO COMERCIAL - ONCO - PONTUAL","produto":"NEXAVAR 200 MG 60 BAYER - COMPRIMIDO | Comprimido | ACEITA ALTERNATIVAS","fim vigência":"2025-03-31T00:00:00Z","tipo de acordo":"Por período","data solicitação":"15/01/2025","início vigência":"2025-01-15T00:00:00Z"},
{"status do contrato":"Expirados","categoria produto":"Medicamentos","id contrato":1788219,"razão social do cliente":"Unimed Marília Cooperativa De Trabalho Médico","valor unitário":585.2800000000,"quantidade acordada":"Não Estipulado","dias para encerramento do acordo":"Expirados","cnpj cliente":"66.872.888/0001-60","título":"ACORDO COMERCIAL - ONCO - PONTUAL","produto":"KOSELUGO 10MG COMP CX C/ 60 | Comprimido","fim vigência":"2025-03-31T00:00:00Z","tipo de acordo":"Por período","data solicitação":"15/01/2025","início vigência":"2025-01-15T00:00:00Z"},
{"status do contrato":"Expirados","categoria produto":"Medicamentos","id contrato":1788219,"razão social do cliente":"Unimed Marília Cooperativa De Trabalho Médico","valor unitário":4.8800000000,"quantidade acordada":"Não Estipulado","dias para encerramento do acordo":"Expirados","cnpj cliente":"66.872.888/0001-60","título":"ACORDO COMERCIAL - ONCO - PONTUAL","produto":"NOLVADEX - D 10MG COMP CX C/ 30 | Comprimido | -","fim vigência":"2025-03-31T00:00:00Z","tipo de acordo":"Por período","data solicitação":"15/01/2025","início vigência":"2025-01-15T00:00:00Z"},
{"status do contrato":"Expirados","categoria produto":"Medicamentos","id contrato":1788219,"razão social do cliente":"Unimed Marília Cooperativa De Trabalho Médico","valor unitário":342.4000000000,"quantidade acordada":"Não Estipulado","dias para encerramento do acordo":"Expirados","cnpj cliente":"66.872.888/0001-60","título":"ACORDO COMERCIAL - ONCO - PONTUAL","produto":"JAKAVI 10 MG C/ 60 COMPR | Comprimido","fim vigência":"2025-03-31T00:00:00Z","tipo de acordo":"Por período","data solicitação":"15/01/2025","início vigência":"2025-01-15T00:00:00Z"},
{"status do contrato":"Expirados","categoria produto":"Medicamentos","id contrato":1788219,"razão social do cliente":"Unimed Marília Cooperativa De Trabalho Médico","valor unitário":393.0700000000,"quantidade acordada":"Não Estipulado","dias para encerramento do acordo":"Expirados","cnpj cliente":"66.872.888/0001-60","título":"ACORDO COMERCIAL - ONCO - PONTUAL","produto":"ZEJULA 100MG COMP CX C/ 56 | Unidade","fim vigência":"2025-03-31T00:00:00Z","tipo de acordo":"Por período","data solicitação":"15/01/2025","início vigência":"2025-01-15T00:00:00Z"},
{"status do contrato":"Expirados","categoria produto":"Medicamentos","id contrato":1788219,"razão social do cliente":"Unimed Marília Cooperativa De Trabalho Médico","valor unitário":17.9000000000,"quantidade acordada":"Não Estipulado","dias para encerramento do acordo":"Expirados","cnpj cliente":"66.872.888/0001-60","título":"ACORDO COMERCIAL - ONCO - PONTUAL","produto":"ARIMIDEX 1 MG- ASTRAZENECA 28  - COMPRIMIDO | Comprimido | ACEITA ALTERNATIVAS","fim vigência":"2025-03-31T00:00:00Z","tipo de acordo":"Por período","data solicitação":"15/01/2025","início vigência":"2025-01-15T00:00:00Z"},
{"status do contrato":"Expirados","categoria produto":"Medicamentos","id contrato":1788219,"razão social do cliente":"Unimed Marília Cooperativa De Trabalho Médico","valor unitário":4.8666000000,"quantidade acordada":"Não Estipulado","dias para encerramento do acordo":"Expirados","cnpj cliente":"66.872.888/0001-60","título":"ACORDO COMERCIAL - ONCO - PONTUAL","produto":"NOVALDEX-D 20MG COM 30 (ASTRAZENECA) - COMPRIMIDO | Comprimido | ACEITA ALTERNATIVAS","fim vigência":"2025-03-31T00:00:00Z","tipo de acordo":"Por período","data solicitação":"15/01/2025","início vigência":"2025-01-15T00:00:00Z"},
{"status do contrato":"Expirados","categoria produto":"Medicamentos","id contrato":1788219,"razão social do cliente":"Unimed Marília Cooperativa De Trabalho Médico","valor unitário":454.7800000000,"quantidade acordada":"Não Estipulado","dias para encerramento do acordo":"Expirados","cnpj cliente":"66.872.888/0001-60","título":"ACORDO COMERCIAL - ONCO - PONTUAL","produto":"ZOLADEX 3.6 MG (ASTRA ZENECA) - SERINGA | Seringa | ACEITA ALTERNATIVAS","fim vigência":"2025-03-31T00:00:00Z","tipo de acordo":"Por período","data solicitação":"15/01/2025","início vigência":"2025-01-15T00:00:00Z"},
{"status do contrato":"Expirados","categoria produto":"Medicamentos","id contrato":1788219,"razão social do cliente":"Unimed Marília Cooperativa De Trabalho Médico","valor unitário":8592.6000000000,"quantidade acordada":"Não Estipulado","dias para encerramento do acordo":"Expirados","cnpj cliente":"66.872.888/0001-60","título":"ACORDO COMERCIAL - ONCO - PONTUAL","produto":"NUCALA 100MG (MEPOLIZUMABE) SERINGA PREENCH 1ML | Seringa | -","fim vigência":"2025-03-31T00:00:00Z","tipo de acordo":"Por período","data solicitação":"15/01/2025","início vigência":"2025-01-15T00:00:00Z"},
{"status do contrato":"Expirados","categoria produto":"Medicamentos","id contrato":1788219,"razão social do cliente":"Unimed Marília Cooperativa De Trabalho Médico","valor unitário":241.0300000000,"quantidade acordada":"Não Estipulado","dias para encerramento do acordo":"Expirados","cnpj cliente":"66.872.888/0001-60","título":"ACORDO COMERCIAL - ONCO - PONTUAL","produto":"JAKAVI 5 MG C/ 60 COMPR | Unidade","fim vigência":"2025-03-31T00:00:00Z","tipo de acordo":"Por período","data solicitação":"15/01/2025","início vigência":"2025-01-15T00:00:00Z"},
{"status do contrato":"Expirados","categoria produto":"Medicamentos","id contrato":1788219,"razão social do cliente":"Unimed Marília Cooperativa De Trabalho Médico","valor unitário":83.6700000000,"quantidade acordada":"Não Estipulado","dias para encerramento do acordo":"Expirados","cnpj cliente":"66.872.888/0001-60","título":"ACORDO COMERCIAL - ONCO - PONTUAL","produto":"NUBEQA 300MG COMP CX C/120 | Unidade","fim vigência":"2025-03-31T00:00:00Z","tipo de acordo":"Por período","data solicitação":"15/01/2025","início vigência":"2025-01-15T00:00:00Z"},
{"status do contrato":"Expirados","categoria produto":"Medicamentos","id contrato":1788219,"razão social do cliente":"Unimed Marília Cooperativa De Trabalho Médico","valor unitário":47.9800000000,"quantidade acordada":"Não Estipulado","dias para encerramento do acordo":"Expirados","cnpj cliente":"66.872.888/0001-60","título":"ACORDO COMERCIAL - ONCO - PONTUAL","produto":"ESBRIET 267MG (PIRFENIDONA) FRASCO C/ 270 CAPSULAS | Unidade","fim vigência":"2025-03-31T00:00:00Z","tipo de acordo":"Por período","data solicitação":"15/01/2025","início vigência":"2025-01-15T00:00:00Z"},
{"status do contrato":"Expirados","categoria produto":"Medicamentos","id contrato":1788219,"razão social do cliente":"Unimed Marília Cooperativa De Trabalho Médico","valor unitário":7957.3100000000,"quantidade acordada":"Não Estipulado","dias para encerramento do acordo":"Expirados","cnpj cliente":"66.872.888/0001-60","título":"ACORDO COMERCIAL - ONCO - PONTUAL","produto":"TEZSPIRE 210MG/1,91ML SERINGA PREENCH | Unidade","fim vigência":"2025-03-31T00:00:00Z","tipo de acordo":"Por período","data solicitação":"15/01/2025","início vigência":"2025-01-15T00:00:00Z"},
{"status do contrato":"Expirados","categoria produto":"Medicamentos","id contrato":1793195,"razão social do cliente":"Unimed Marília Cooperativa De Trabalho Médico","valor unitário":1040.0000000000,"quantidade acordada":"Não Estipulado","dias para encerramento do acordo":"Expirados","cnpj cliente":"66.872.888/0001-60","título":"ACORDO COMERCIAL - ONCO - PONTUAL","produto":"TAGRISSO 80MG COMP CX C/ 30 | Comprimido | -","fim vigência":"2025-03-31T00:00:00Z","tipo de acordo":"Por período","data solicitação":"16/01/2025","início vigência":"2025-01-16T00:00:00Z"},
{"status do contrato":"Expirados","categoria produto":"Medicamentos","id contrato":1788219,"razão social do cliente":"Unimed Marília Cooperativa De Trabalho Médico","valor unitário":3402.0000000000,"quantidade acordada":"Não Estipulado","dias para encerramento do acordo":"Expirados","cnpj cliente":"66.872.888/0001-60","título":"ACORDO COMERCIAL - ONCO - PONTUAL","produto":"SYNAGIS 50MG - FRASCO/AMPOLA | Frasco/Ampola | ACEITA ALTERNATIVAS","fim vigência":"2025-03-31T00:00:00Z","tipo de acordo":"Por período","data solicitação":"15/01/2025","início vigência":"2025-01-15T00:00:00Z"},
{"status do contrato":"Expirados","categoria produto":"Medicamentos","id contrato":1788219,"razão social do cliente":"Unimed Marília Cooperativa De Trabalho Médico","valor unitário":157.2679000000,"quantidade acordada":"Não Estipulado","dias para encerramento do acordo":"Expirados","cnpj cliente":"66.872.888/0001-60","título":"ACORDO COMERCIAL - ONCO - PONTUAL","produto":"STIVARGA 40MG COM 84CP BAYER - COMPRIMIDO | Comprimido | ACEITA ALTERNATIVAS","fim vigência":"2025-03-31T00:00:00Z","tipo de acordo":"Por período","data solicitação":"15/01/2025","início vigência":"2025-01-15T00:00:00Z"},
{"status do contrato":"Expirados","categoria produto":"Medicamentos","id contrato":1788219,"razão social do cliente":"Unimed Marília Cooperativa De Trabalho Médico","valor unitário":3359.6200000000,"quantidade acordada":"Não Estipulado","dias para encerramento do acordo":"Expirados","cnpj cliente":"66.872.888/0001-60","título":"ACORDO COMERCIAL - ONCO - PONTUAL","produto":"NUCALA 40MG (MEPOLIZUMABE) SERINGA PREENCH 1ML | Unidade","fim vigência":"2025-03-31T00:00:00Z","tipo de acordo":"Por período","data solicitação":"15/01/2025","início vigência":"2025-01-15T00:00:00Z"},
{"status do contrato":"Expirados","categoria produto":"Medicamentos","id contrato":1793331,"razão social do cliente":"Unimed Marília Cooperativa De Trabalho Médico","valor unitário":257.3079000000,"quantidade acordada":"Não Estipulado","dias para encerramento do acordo":"Expirados","cnpj cliente":"66.872.888/0001-60","título":"ACORDO COMERCIAL - ONCO - PONTUAL","produto":"KISQALI 200MG COMP CX C /21 | Unidade | -","fim vigência":"2025-03-31T00:00:00Z","tipo de acordo":"Por período","data solicitação":"21/01/2025","início vigência":"2025-01-21T00:00:00Z"},
{"status do contrato":"Expirados","categoria produto":"Medicamentos","id contrato":1788219,"razão social do cliente":"Unimed Marília Cooperativa De Trabalho Médico","valor unitário":6804.1700000000,"quantidade acordada":"Não Estipulado","dias para encerramento do acordo":"Expirados","cnpj cliente":"66.872.888/0001-60","título":"ACORDO COMERCIAL - ONCO - PONTUAL","produto":"SYNAGIS 100 MG - FRASCO/AMPOLA | Frasco/Ampola | ACEITA ALTERNATIVAS","fim vigência":"2025-03-31T00:00:00Z","tipo de acordo":"Por período","data solicitação":"15/01/2025","início vigência":"2025-01-15T00:00:00Z"},
{"status do contrato":"Expirados","categoria produto":"Medicamentos","id contrato":1693240,"razão social do cliente":"Unimed de Presidente Prudente Cooperativa De Trabalho Médico","valor unitário":524.0000000000,"quantidade acordada":"Não Estipulado","dias para encerramento do acordo":"Expirados","cnpj cliente":"44.863.959/0001-26","título":"ACORDO PONTUAL SET A DEZ 24","produto":"Calquence 100mg - 60cap | Capsula | -","fim vigência":"2024-12-31T23:59:00Z","tipo de acordo":"Por período","data solicitação":"17/09/2024","início vigência":"2024-09-17T00:00:00Z"},
{"status do contrato":"Expirados","categoria produto":"Medicamentos","id contrato":1693240,"razão social do cliente":"Unimed de Presidente Prudente Cooperativa De Trabalho Médico","valor unitário":13100.0000000000,"quantidade acordada":"Não Estipulado","dias para encerramento do acordo":"Expirados","cnpj cliente":"44.863.959/0001-26","título":"ACORDO PONTUAL SET A DEZ 24","produto":"Imfinzi 500 Mg/10 Ml - Sol Inj Fa 10 Ml | Frasco/Ampola | -","fim vigência":"2024-12-31T23:59:00Z","tipo de acordo":"Por período","data solicitação":"17/09/2024","início vigência":"2024-09-17T00:00:00Z"},
{"status do contrato":"Expirados","categoria produto":"Medicamentos","id contrato":1653602,"razão social do cliente":"Unimed Marília Cooperativa De Trabalho Médico","valor unitário":588.3800000000,"quantidade acordada":"Não Estipulado","dias para encerramento do acordo":"Expirados","cnpj cliente":"66.872.888/0001-60","título":"ACORDO COMERCIAL - ONCO - PONTUAL ","produto":"KOSELUGO 10MG COMP CX C/ 60 | Comprimido","fim vigência":"2024-11-22T00:00:00Z","tipo de acordo":"Por período","data solicitação":"20/05/2024","início vigência":"2024-05-22T00:00:00Z"},
{"status do contrato":"Expirados","categoria produto":"Medicamentos","id contrato":1653602,"razão social do cliente":"Unimed Marília Cooperativa De Trabalho Médico","valor unitário":474.3800000000,"quantidade acordada":"Não Estipulado","dias para encerramento do acordo":"Expirados","cnpj cliente":"66.872.888/0001-60","título":"ACORDO COMERCIAL - ONCO - PONTUAL ","produto":"ZOLADEX 3.6 MG (ASTRA ZENECA) - SERINGA | Seringa | ACEITA ALTERNATIVAS","fim vigência":"2024-11-22T00:00:00Z","tipo de acordo":"Por período","data solicitação":"20/05/2024","início vigência":"2024-05-22T00:00:00Z"},
{"status do contrato":"Expirados","categoria produto":"Medicamentos","id contrato":1653602,"razão social do cliente":"Unimed Marília Cooperativa De Trabalho Médico","valor unitário":866.0000000000,"quantidade acordada":"Não Estipulado","dias para encerramento do acordo":"Expirados","cnpj cliente":"66.872.888/0001-60","título":"ACORDO COMERCIAL - ONCO - PONTUAL ","produto":"BENLYSTA (BELIMUMABE) 120 MG - FRASCO/AMPOLA | Frasco/Ampola | ACEITA ALTERNATIVAS","fim vigência":"2024-11-22T00:00:00Z","tipo de acordo":"Por período","data solicitação":"20/05/2024","início vigência":"2024-05-22T00:00:00Z"},
{"status do contrato":"Expirados","categoria produto":"Medicamentos","id contrato":1653602,"razão social do cliente":"Unimed Marília Cooperativa De Trabalho Médico","valor unitário":257.9700000000,"quantidade acordada":"Não Estipulado","dias para encerramento do acordo":"Expirados","cnpj cliente":"66.872.888/0001-60","título":"ACORDO COMERCIAL - ONCO - PONTUAL ","produto":"KISQALI 200MG COMP CX C /21 | Unidade | -","fim vigência":"2024-11-22T00:00:00Z","tipo de acordo":"Por período","data solicitação":"20/05/2024","início vigência":"2024-05-22T00:00:00Z"},
{"status do contrato":"Expirados","categoria produto":"Medicamentos","id contrato":1653602,"razão social do cliente":"Unimed Marília Cooperativa De Trabalho Médico","valor unitário":342.4000000000,"quantidade acordada":"Não Estipulado","dias para encerramento do acordo":"Expirados","cnpj cliente":"66.872.888/0001-60","título":"ACORDO COMERCIAL - ONCO - PONTUAL ","produto":"JAKAVI 10 MG C/ 60 COMPR | Comprimido","fim vigência":"2024-11-22T00:00:00Z","tipo de acordo":"Por período","data solicitação":"20/05/2024","início vigência":"2024-05-22T00:00:00Z"},
{"status do contrato":"Expirados","categoria produto":"Medicamentos","id contrato":1653602,"razão social do cliente":"Unimed Marília Cooperativa De Trabalho Médico","valor unitário":2807.0000000000,"quantidade acordada":"Não Estipulado","dias para encerramento do acordo":"Expirados","cnpj cliente":"66.872.888/0001-60","título":"ACORDO COMERCIAL - ONCO - PONTUAL ","produto":"BENLYSTA (BELIMUMABE) 400 MG - FRASCO/AMPOLA | Frasco/Ampola | ACEITA ALTERNATIVAS","fim vigência":"2024-11-22T00:00:00Z","tipo de acordo":"Por período","data solicitação":"20/05/2024","início vigência":"2024-05-22T00:00:00Z"},
{"status do contrato":"Expirados","categoria produto":"Medicamentos","id contrato":1653602,"razão social do cliente":"Unimed Marília Cooperativa De Trabalho Médico","valor unitário":6856.0000000000,"quantidade acordada":"Não Estipulado","dias para encerramento do acordo":"Expirados","cnpj cliente":"66.872.888/0001-60","título":"ACORDO COMERCIAL - ONCO - PONTUAL ","produto":"SYNAGIS 100 MG - FRASCO/AMPOLA | Frasco/Ampola | ACEITA ALTERNATIVAS","fim vigência":"2024-11-22T00:00:00Z","tipo de acordo":"Por período","data solicitação":"20/05/2024","início vigência":"2024-05-22T00:00:00Z"},
{"status do contrato":"Expirados","categoria produto":"Medicamentos","id contrato":1653602,"razão social do cliente":"Unimed Marília Cooperativa De Trabalho Médico","valor unitário":11490.0000000000,"quantidade acordada":"Não Estipulado","dias para encerramento do acordo":"Expirados","cnpj cliente":"66.872.888/0001-60","título":"ACORDO COMERCIAL - ONCO - PONTUAL ","produto":"KESIMPTA 20MG/0,4ML (CANETA PREENCHIDA) | Unidade","fim vigência":"2024-11-22T00:00:00Z","tipo de acordo":"Por período","data solicitação":"20/05/2024","início vigência":"2024-05-22T00:00:00Z"},
{"status do contrato":"Expirados","categoria produto":"Medicamentos","id contrato":1653602,"razão social do cliente":"Unimed Marília Cooperativa De Trabalho Médico","valor unitário":239.7000000000,"quantidade acordada":"Não Estipulado","dias para encerramento do acordo":"Expirados","cnpj cliente":"66.872.888/0001-60","título":"ACORDO COMERCIAL - ONCO - PONTUAL ","produto":"JAKAVI 5 MG C/ 60 COMPR | Unidade","fim vigência":"2024-11-22T00:00:00Z","tipo de acordo":"Por período","data solicitação":"20/05/2024","início vigência":"2024-05-22T00:00:00Z"},
{"status do contrato":"Expirados","categoria produto":"Medicamentos","id contrato":1653602,"razão social do cliente":"Unimed Marília Cooperativa De Trabalho Médico","valor unitário":1049.9860000000,"quantidade acordada":"Não Estipulado","dias para encerramento do acordo":"Expirados","cnpj cliente":"66.872.888/0001-60","título":"ACORDO COMERCIAL - ONCO - PONTUAL ","produto":"TAGRISSO 80MG COMP CX C/ 30 | Comprimido | -","fim vigência":"2024-11-22T00:00:00Z","tipo de acordo":"Por período","data solicitação":"20/05/2024","início vigência":"2024-05-22T00:00:00Z"},
{"status do contrato":"Expirados","categoria produto":"Medicamentos","id contrato":1653602,"razão social do cliente":"Unimed Marília Cooperativa De Trabalho Médico","valor unitário":3425.6600000000,"quantidade acordada":"Não Estipulado","dias para encerramento do acordo":"Expirados","cnpj cliente":"66.872.888/0001-60","título":"ACORDO COMERCIAL - ONCO - PONTUAL ","produto":"SYNAGIS 50MG - FRASCO/AMPOLA | Frasco/Ampola | ACEITA ALTERNATIVAS","fim vigência":"2024-11-22T00:00:00Z","tipo de acordo":"Por período","data solicitação":"20/05/2024","início vigência":"2024-05-22T00:00:00Z"},
{"status do contrato":"Expirados","categoria produto":"Medicamentos","id contrato":1653789,"razão social do cliente":"Unimed de Presidente Prudente Cooperativa De Trabalho Médico","valor unitário":13020.0000000000,"quantidade acordada":"Não Estipulado","dias para encerramento do acordo":"Expirados","cnpj cliente":"44.863.959/0001-26","título":"ACORDO MAIO A AGOSTO 24 - PONTUAL","produto":"Imfinzi 500 Mg/10 Ml - Sol Inj Fa 10 Ml | Frasco/Ampola | -","fim vigência":"2024-08-31T23:59:00Z","tipo de acordo":"Por período","data solicitação":"23/05/2024","início vigência":"2024-05-23T00:00:00Z"},
{"status do contrato":"Expirados","categoria produto":"Medicamentos","id contrato":1653789,"razão social do cliente":"Unimed de Presidente Prudente Cooperativa De Trabalho Médico","valor unitário":521.0900000000,"quantidade acordada":"Não Estipulado","dias para encerramento do acordo":"Expirados","cnpj cliente":"44.863.959/0001-26","título":"ACORDO MAIO A AGOSTO 24 - PONTUAL","produto":"Calquence 100mg - 60cap | Capsula | -","fim vigência":"2024-08-31T23:59:00Z","tipo de acordo":"Por período","data solicitação":"23/05/2024","início vigência":"2024-05-23T00:00:00Z"},
{"status do contrato":"Expirados","categoria produto":"Medicamentos","id contrato":1617011,"razão social do cliente":"Hospital Palmas Medical S.A - Grupo Kora/Meridional","valor unitário":7.6900000000,"quantidade acordada":"Não Estipulado","dias para encerramento do acordo":"Expirados","cnpj cliente":"12.955.953/0001-92","título":"ACORDO COMERCIAL SHS- PONTUAL-KORA SAUDE","produto":"DIMENIDRATO B6DL INJ. 10ML (DRAMIN DL) - AMPOLA   AMPOLA   TAKEDA","fim vigência":"2024-07-01T23:59:00Z","tipo de acordo":"Por período","data solicitação":"07/03/2024","início vigência":"2024-03-07T00:00:00Z"},
{"status do contrato":"Expirados","categoria produto":"Medicamentos","id contrato":1658182,"razão social do cliente":"Sociedade Hospitalar Santa Thereza Ltda","valor unitário":7.6900000000,"quantidade acordada":"Não Estipulado","dias para encerramento do acordo":"Expirados","cnpj cliente":"25.016.319/0001-36","título":"ACORDO COMERCIAL SHS- PONTUAL-KORA SAUDE","produto":"DIMENIDRATO B6DL INJ. 10ML (DRAMIN DL) - AMPOLA AMPOLA TAKEDA","fim vigência":"2024-07-01T23:59:00Z","tipo de acordo":"Por período","data solicitação":"18/06/2024","início vigência":"2024-06-18T00:00:00Z"},
{"status do contrato":"Expirados","categoria produto":"Medicamentos","id contrato":1617012,"razão social do cliente":"Hospital e Maternidade São Mateus Ltda - Cuibá - MT - Grupo Kora/Meridional","valor unitário":7.6900000000,"quantidade acordada":"Não Estipulado","dias para encerramento do acordo":"Expirados","cnpj cliente":"15.016.827/0001-60","título":"ACORDO COMERCIAL SHS- PONTUAL-KORA SAUDE","produto":"DRAMIN B6 DL 10 ML - INJETÁVEL - TAKEDA","fim vigência":"2024-07-01T23:59:00Z","tipo de acordo":"Por período","data solicitação":"07/03/2024","início vigência":"2024-03-07T00:00:00Z"},
{"status do contrato":"Expirados","categoria produto":"Medicamentos","id contrato":1617013,"razão social do cliente":"Hospital São Bernardo Ltda","valor unitário":7.6900000000,"quantidade acordada":"Não Estipulado","dias para encerramento do acordo":"Expirados","cnpj cliente":"26.878.439/0001-05","título":"ACORDO COMERCIAL SHS- PONTUAL-KORA SAUDE","produto":"DRAMIN B6 DL INJETAVEL 10ML AMPOLA","fim vigência":"2024-07-01T23:59:00Z","tipo de acordo":"Por período","data solicitação":"07/03/2024","início vigência":"2024-03-07T00:00:00Z"},
{"status do contrato":"Expirados","categoria produto":"Medicamentos","id contrato":1617013,"razão social do cliente":"Hospital São Bernardo Ltda","valor unitário":7.6900000000,"quantidade acordada":"Não Estipulado","dias para encerramento do acordo":"Expirados","cnpj cliente":"26.878.439/0001-05","título":"ACORDO COMERCIAL SHS- PONTUAL-KORA SAUDE","produto":"DIMENIDRATO 30MG. VITAMINA B6 50MG. GLICOSE 1G E D-FRUTOSE 1G INJETÁVEL AMPOLA COM 10ML | Ampola | ACEITA ALTERNATIVAS","fim vigência":"2024-07-01T23:59:00Z","tipo de acordo":"Por período","data solicitação":"07/03/2024","início vigência":"2024-03-07T00:00:00Z"},
{"status do contrato":"Expirados","categoria produto":"Medicamentos","id contrato":1617011,"razão social do cliente":"Hospital Palmas Medical S.A - Grupo Kora/Meridional","valor unitário":7.6900000000,"quantidade acordada":"Não Estipulado","dias para encerramento do acordo":"Expirados","cnpj cliente":"12.955.953/0001-92","título":"ACORDO COMERCIAL SHS- PONTUAL-KORA SAUDE","produto":"DRAMIN B6 DL INJ. - AMPOLA C/ 10ML","fim vigência":"2024-07-01T23:59:00Z","tipo de acordo":"Por período","data solicitação":"07/03/2024","início vigência":"2024-03-07T00:00:00Z"},
{"status do contrato":"Expirados","categoria produto":"Medicamentos","id contrato":1617012,"razão social do cliente":"Hospital e Maternidade São Mateus Ltda - Cuibá - MT - Grupo Kora/Meridional","valor unitário":7.6900000000,"quantidade acordada":"Não Estipulado","dias para encerramento do acordo":"Expirados","cnpj cliente":"15.016.827/0001-60","título":"ACORDO COMERCIAL SHS- PONTUAL-KORA SAUDE","produto":"DIMENIDRATO 30MG. VITAMINA B6 50MG. GLICOSE 1G E D-FRUTOSE 1G AMPOLA 10ML","fim vigência":"2024-07-01T23:59:00Z","tipo de acordo":"Por período","data solicitação":"07/03/2024","início vigência":"2024-03-07T00:00:00Z"},
{"status do contrato":"Expirados","categoria produto":"Medicamentos","id contrato":1617018,"razão social do cliente":"Rede Meridional - Instituto de Neurologia de Goiania","valor unitário":7.6900000000,"quantidade acordada":"Não Estipulado","dias para encerramento do acordo":"Expirados","cnpj cliente":"01.011.865/0001-16","título":"ACORDO COMERCIAL SHS- PONTUAL-KORA SAUDE","produto":"DRAMIN B6 DL INJ AMP C/10ML","fim vigência":"2024-07-01T23:59:00Z","tipo de acordo":"Por período","data solicitação":"07/03/2024","início vigência":"2024-03-07T00:00:00Z"},
{"status do contrato":"Expirados","categoria produto":"Medicamentos","id contrato":1617015,"razão social do cliente":"Serviços Hospitalares Yuge","valor unitário":7.6900000000,"quantidade acordada":"Não Estipulado","dias para encerramento do acordo":"Expirados","cnpj cliente":"72.576.143/0001-57","título":"ACORDO COMERCIAL SHS- PONTUAL-KORA SAUDE","produto":"DRAMIN B6 AMPOLA 10 ML INJETAVEL IV","fim vigência":"2024-07-01T23:59:00Z","tipo de acordo":"Por período","data solicitação":"07/03/2024","início vigência":"2024-03-07T00:00:00Z"},
{"status do contrato":"Expirados","categoria produto":"Medicamentos","id contrato":1617022,"razão social do cliente":"Grupo Kora - Angiocardis Diagnósticos e Terapêutica - Goiânia - GO","valor unitário":7.6900000000,"quantidade acordada":"Não Estipulado","dias para encerramento do acordo":"Expirados","cnpj cliente":"04.585.802/0001-61","título":"ACORDO COMERCIAL SHS- PONTUAL-KORA SAUDE","produto":"DRAMIN B6 DL INJ AMP C/10ML","fim vigência":"2024-07-01T23:59:00Z","tipo de acordo":"Por período","data solicitação":"07/03/2024","início vigência":"2024-03-07T00:00:00Z"},
{"status do contrato":"Expirados","categoria produto":"Medicamentos","id contrato":1617015,"razão social do cliente":"Serviços Hospitalares Yuge","valor unitário":7.6900000000,"quantidade acordada":"Não Estipulado","dias para encerramento do acordo":"Expirados","cnpj cliente":"72.576.143/0001-57","título":"ACORDO COMERCIAL SHS- PONTUAL-KORA SAUDE","produto":"DRAMIN B6 AMPOLA 10ML INJETAVEL","fim vigência":"2024-07-01T23:59:00Z","tipo de acordo":"Por período","data solicitação":"07/03/2024","início vigência":"2024-03-07T00:00:00Z"},
{"status do contrato":"Expirados","categoria produto":"Medicamentos","id contrato":1617008,"razão social do cliente":"Consolidador - Rede Meridional S.A.","valor unitário":7.6900000000,"quantidade acordada":"Não Estipulado","dias para encerramento do acordo":"Expirados","cnpj cliente":"00.625.711/0001-51","título":"ACORDO COMERCIAL SHS- PONTUAL-KORA SAUDE","produto":"DRAMIN B6 DL - 10ML AMP","fim vigência":"2024-06-30T23:59:00Z","tipo de acordo":"Por período","data solicitação":"07/03/2024","início vigência":"2024-03-07T00:00:00Z"},
{"status do contrato":"Expirados","categoria produto":"Medicamentos","id contrato":1617008,"razão social do cliente":"Consolidador - Rede Meridional S.A.","valor unitário":5.0600000000,"quantidade acordada":"Não Estipulado","dias para encerramento do acordo":"Expirados","cnpj cliente":"00.625.711/0001-51","título":"ACORDO COMERCIAL SHS- PONTUAL-KORA SAUDE","produto":"HEMOFOL 5.000UI/0,25ML - 0,25ML AMP -MPP","fim vigência":"2024-06-30T23:59:00Z","tipo de acordo":"Por período","data solicitação":"07/03/2024","início vigência":"2024-03-07T00:00:00Z"},
{"status do contrato":"Expirados","categoria produto":"Medicamentos","id contrato":1617009,"razão social do cliente":"Consolidador - Hospital Otoclínica - Grupo Kora/meridional","valor unitário":7.6900000000,"quantidade acordada":"Não Estipulado","dias para encerramento do acordo":"Expirados","cnpj cliente":"23.443.518/0001-03","título":"ACORDO COMERCIAL SHS-PONTUAL--KORA SAUDE","produto":"DRAMIN B6 DL AMPOLA","fim vigência":"2024-06-30T23:59:00Z","tipo de acordo":"Por período","data solicitação":"07/03/2024","início vigência":"2024-03-07T00:00:00Z"},
{"status do contrato":"Expirados","categoria produto":"Medicamentos","id contrato":1597505,"razão social do cliente":"Consolidador - Grupo AEBES","valor unitário":67.4444000000,"quantidade acordada":"1000","dias para encerramento do acordo":"Expirados","cnpj cliente":"28.127.926/0001-61","título":"ACORDO COMERCIAL 90 DIAS - ESCETAMINA","produto":"ESCETAMINA 50MG/ML 10ML F/A (MPP) -  KETAMIN NP","fim vigência":"2024-04-26T23:59:00Z","tipo de acordo":"Por quantidade e período","data solicitação":"26/01/2024","início vigência":"2024-01-26T00:00:00Z"},
{"status do contrato":"Expirados","categoria produto":"Medicamentos","id contrato":1597331,"razão social do cliente":"Unimed de Presidente Prudente Cooperativa De Trabalho Médico","valor unitário":353.5800000000,"quantidade acordada":"Não Estipulado","dias para encerramento do acordo":"Expirados","cnpj cliente":"44.863.959/0001-26","título":"ACORDO NR2006  JAN A MAR�O 24","produto":"Zejula 100 Mg - Cx 56cap","fim vigência":"2024-03-31T23:59:00Z","tipo de acordo":"Por período","data solicitação":"22/01/2024","início vigência":"2024-01-22T00:00:00Z"},
{"status do contrato":"Expirados","categoria produto":"Medicamentos","id contrato":1597331,"razão social do cliente":"Unimed de Presidente Prudente Cooperativa De Trabalho Médico","valor unitário":2425.0000000000,"quantidade acordada":"Não Estipulado","dias para encerramento do acordo":"Expirados","cnpj cliente":"44.863.959/0001-26","título":"ACORDO NR2006  JAN A MAR�O 24","produto":"Xolair 150mg - Sol Inj Ser Pre 1 Ml | Seringa | -","fim vigência":"2024-03-31T23:59:00Z","tipo de acordo":"Por período","data solicitação":"22/01/2024","início vigência":"2024-01-22T00:00:00Z"},
{"status do contrato":"Expirados","categoria produto":"Medicamentos","id contrato":1597331,"razão social do cliente":"Unimed de Presidente Prudente Cooperativa De Trabalho Médico","valor unitário":413.8000000000,"quantidade acordada":"Não Estipulado","dias para encerramento do acordo":"Expirados","cnpj cliente":"44.863.959/0001-26","título":"ACORDO NR2006  JAN A MAR�O 24","produto":"Jakavi 15 Mg  - 60comp","fim vigência":"2024-03-31T23:59:00Z","tipo de acordo":"Por período","data solicitação":"22/01/2024","início vigência":"2024-01-22T00:00:00Z"},
{"status do contrato":"Expirados","categoria produto":"Medicamentos","id contrato":1597331,"razão social do cliente":"Unimed de Presidente Prudente Cooperativa De Trabalho Médico","valor unitário":620.5000000000,"quantidade acordada":"Não Estipulado","dias para encerramento do acordo":"Expirados","cnpj cliente":"44.863.959/0001-26","título":"ACORDO NR2006  JAN A MAR�O 24","produto":"Mekinist 2 Mg - Comp Rev Fr 30comp | Comprimido | -","fim vigência":"2024-03-31T23:59:00Z","tipo de acordo":"Por período","data solicitação":"22/01/2024","início vigência":"2024-01-22T00:00:00Z"},
{"status do contrato":"Expirados","categoria produto":"Medicamentos","id contrato":1597331,"razão social do cliente":"Unimed de Presidente Prudente Cooperativa De Trabalho Médico","valor unitário":413.8000000000,"quantidade acordada":"Não Estipulado","dias para encerramento do acordo":"Expirados","cnpj cliente":"44.863.959/0001-26","título":"ACORDO NR2006  JAN A MAR�O 24","produto":"Jakavi 20mg - 60 comp | Comprimido | -","fim vigência":"2024-03-31T23:59:00Z","tipo de acordo":"Por período","data solicitação":"22/01/2024","início vigência":"2024-01-22T00:00:00Z"},
{"status do contrato":"Expirados","categoria produto":"Medicamentos","id contrato":1597331,"razão social do cliente":"Unimed de Presidente Prudente Cooperativa De Trabalho Médico","valor unitário":269.8600000000,"quantidade acordada":"Não Estipulado","dias para encerramento do acordo":"Expirados","cnpj cliente":"44.863.959/0001-26","título":"ACORDO NR2006  JAN A MAR�O 24","produto":"Tafinlar 75mg - 120cap | Capsula | -","fim vigência":"2024-03-31T23:59:00Z","tipo de acordo":"Por período","data solicitação":"22/01/2024","início vigência":"2024-01-22T00:00:00Z"},
{"status do contrato":"Expirados","categoria produto":"Medicamentos","id contrato":1597331,"razão social do cliente":"Unimed de Presidente Prudente Cooperativa De Trabalho Médico","valor unitário":3875.0000000000,"quantidade acordada":"Não Estipulado","dias para encerramento do acordo":"Expirados","cnpj cliente":"44.863.959/0001-26","título":"ACORDO NR2006  JAN A MAR�O 24","produto":"Cosentyx 150mg/ml - Sol Inj Can Preenchida | Seringa | -","fim vigência":"2024-03-31T23:59:00Z","tipo de acordo":"Por período","data solicitação":"22/01/2024","início vigência":"2024-01-22T00:00:00Z"},
{"status do contrato":"Expirados","categoria produto":"Medicamentos","id contrato":1597176,"razão social do cliente":"Unimed Marília Cooperativa De Trabalho Médico","valor unitário":1039.6667000000,"quantidade acordada":"Não Estipulado","dias para encerramento do acordo":"Expirados","cnpj cliente":"66.872.888/0001-60","título":"ACORDO COMERCIAL - ONCO - PONTUAL (NR2006)","produto":"TAGRISSO 80MG COMP CX C/ 30 | Comprimido | -","fim vigência":"2024-03-31T00:00:00Z","tipo de acordo":"Por período","data solicitação":"15/01/2024","início vigência":"2024-01-08T00:00:00Z"},
{"status do contrato":"Expirados","categoria produto":"Medicamentos","id contrato":1597176,"razão social do cliente":"Unimed Marília Cooperativa De Trabalho Médico","valor unitário":519.6667000000,"quantidade acordada":"Não Estipulado","dias para encerramento do acordo":"Expirados","cnpj cliente":"66.872.888/0001-60","título":"ACORDO COMERCIAL - ONCO - PONTUAL (NR2006)","produto":"KOSELUGO 10MG COMP CX C/ 60 | Comprimido","fim vigência":"2024-03-31T00:00:00Z","tipo de acordo":"Por período","data solicitação":"15/01/2024","início vigência":"2024-01-08T00:00:00Z"},
{"status do contrato":"Expirados","categoria produto":"Medicamentos","id contrato":1597176,"razão social do cliente":"Unimed Marília Cooperativa De Trabalho Médico","valor unitário":10273.7500000000,"quantidade acordada":"Não Estipulado","dias para encerramento do acordo":"Expirados","cnpj cliente":"66.872.888/0001-60","título":"ACORDO COMERCIAL - ONCO - PONTUAL (NR2006)","produto":"KESIMPTA 20MG/0,4ML (CANETA PREENCHIDA) | Unidade","fim vigência":"2024-03-31T00:00:00Z","tipo de acordo":"Por período","data solicitação":"15/01/2024","início vigência":"2024-01-08T00:00:00Z"},
{"status do contrato":"Expirados","categoria produto":"Medicamentos","id contrato":1597176,"razão social do cliente":"Unimed Marília Cooperativa De Trabalho Médico","valor unitário":3852.4000000000,"quantidade acordada":"Não Estipulado","dias para encerramento do acordo":"Expirados","cnpj cliente":"66.872.888/0001-60","título":"ACORDO COMERCIAL - ONCO - PONTUAL (NR2006)","produto":"COSENTYX 150MG (SECUQUINUMABE) - SERINGA PREENCH | Frasco/Ampola | ACEITA ALTERNATIVAS","fim vigência":"2024-03-31T00:00:00Z","tipo de acordo":"Por período","data solicitação":"15/01/2024","início vigência":"2024-01-08T00:00:00Z"},
{"status do contrato":"Expirados","categoria produto":"Medicamentos","id contrato":1596690,"razão social do cliente":"Unimed de Presidente Prudente Cooperativa De Trabalho Médico","valor unitário":2425.0000000000,"quantidade acordada":"Não Estipulado","dias para encerramento do acordo":"Expirados","cnpj cliente":"44.863.959/0001-26","título":"ACORDO NR2006 - SET A DEZ 23","produto":"Xolair 150mg - Sol Inj Ser Pre 1 Ml | Seringa | -","fim vigência":"2023-12-31T23:59:00Z","tipo de acordo":"Por período","data solicitação":"15/12/2023","início vigência":"2023-12-15T00:00:00Z"},
{"status do contrato":"Expirados","categoria produto":"Medicamentos","id contrato":1596690,"razão social do cliente":"Unimed de Presidente Prudente Cooperativa De Trabalho Médico","valor unitário":3894.0000000000,"quantidade acordada":"Não Estipulado","dias para encerramento do acordo":"Expirados","cnpj cliente":"44.863.959/0001-26","título":"ACORDO NR2006 - SET A DEZ 23","produto":"Cosentyx 150mg/ml - Sol Inj Can Preenchida | Seringa | -","fim vigência":"2023-12-31T23:59:00Z","tipo de acordo":"Por período","data solicitação":"15/12/2023","início vigência":"2023-12-15T00:00:00Z"},
{"status do contrato":"Expirados","categoria produto":"Medicamentos","id contrato":1231364,"razão social do cliente":"Unimed de Presidente Prudente Cooperativa De Trabalho Médico","valor unitário":3910.0000000000,"quantidade acordada":"Não Estipulado","dias para encerramento do acordo":"Expirados","cnpj cliente":"44.863.959/0001-26","título":"ACORDO NR2006","produto":"COSENTYX 150 MG/ML SOL INJ CT 1 SER PREENCH VD TRANS X 1 ML + 2 CAN APLIC | SERINGA | -","fim vigência":"2023-08-31T23:59:00Z","tipo de acordo":"Por período","data solicitação":"03/05/2023","início vigência":"2023-05-04T00:00:00Z"},
{"status do contrato":"Expirados","categoria produto":"Medicamentos","id contrato":1231364,"razão social do cliente":"Unimed de Presidente Prudente Cooperativa De Trabalho Médico","valor unitário":2440.9500000000,"quantidade acordada":"Não Estipulado","dias para encerramento do acordo":"Expirados","cnpj cliente":"44.863.959/0001-26","título":"ACORDO NR2006","produto":"XOLAIR 150 MG SOL INJ CT 1 SER PREENC VD TRANS X 1 ML | Seringa | -","fim vigência":"2023-08-31T23:59:00Z","tipo de acordo":"Por período","data solicitação":"03/05/2023","início vigência":"2023-05-04T00:00:00Z"},
{"status do contrato":"Expirados","categoria produto":"Medicamentos","id contrato":746600,"razão social do cliente":"Consolidador - Rede Meridional S.A.","valor unitário":1052.4000000000,"quantidade acordada":"Não Estipulado","dias para encerramento do acordo":"Expirados","cnpj cliente":"00.625.711/0001-51","título":"ACORDO ASTRAZENECA - FARMA PONTUAL - REDE ES","produto":"TAGRISSO 80MG COMP (OSIMERTINIB) QT/MPP","fim vigência":"2023-03-31T23:59:00Z","tipo de acordo":"Por período","data solicitação":"30/08/2022","início vigência":"2022-08-30T00:00:00Z"},
{"status do contrato":"Expirados","categoria produto":"Medicamentos","id contrato":746600,"razão social do cliente":"Consolidador - Rede Meridional S.A.","valor unitário":250.5707000000,"quantidade acordada":"Não Estipulado","dias para encerramento do acordo":"Expirados","cnpj cliente":"00.625.711/0001-51","título":"ACORDO ASTRAZENECA - FARMA PONTUAL - REDE ES","produto":"LYNPARZA 150MG COMP (OLAPARIBE)","fim vigência":"2023-03-31T23:59:00Z","tipo de acordo":"Por período","data solicitação":"30/08/2022","início vigência":"2022-08-30T00:00:00Z"},
{"status do contrato":"Expirados","categoria produto":"Medicamentos","id contrato":746974,"razão social do cliente":"Unimed de Volta Redonda Cooperativa de Trabalho Medico","valor unitário":3437.5000000000,"quantidade acordada":"Não Estipulado","dias para encerramento do acordo":"Expirados","cnpj cliente":"35.917.970/0007-26","título":"ACORDO COMERCIAL - SETEMBRO 2022 - 09.1629-F/22","produto":"SECUQUINUMABE 150MG/ML (COSENTYX) | Seringa | NOVARTIS","fim vigência":"2022-12-31T23:59:00Z","tipo de acordo":"Por período","data solicitação":"19/09/2022","início vigência":"2022-09-19T00:00:00Z"},
{"status do contrato":"Expirados","categoria produto":"Medicamentos","id contrato":731456,"razão social do cliente":"Unimed de Presidente Prudente Cooperativa De Trabalho Médico","valor unitário":427.1300000000,"quantidade acordada":"Não Estipulado","dias para encerramento do acordo":"Expirados","cnpj cliente":"44.863.959/0001-26","título":"ACORDO 5 MESES - NR2006","produto":"JAKAVI 15 MG COM CT BL AL PLAS TRANS X 60 | Comprimido | -","fim vigência":"2022-12-31T23:59:00Z","tipo de acordo":"Por período","data solicitação":"29/07/2022","início vigência":"2022-08-01T00:00:00Z"},
{"status do contrato":"Expirados","categoria produto":"Medicamentos","id contrato":731456,"razão social do cliente":"Unimed de Presidente Prudente Cooperativa De Trabalho Médico","valor unitário":12900.0000000000,"quantidade acordada":"Não Estipulado","dias para encerramento do acordo":"Expirados","cnpj cliente":"44.863.959/0001-26","título":"ACORDO 5 MESES - NR2006","produto":"IMFINZI 500 MG/10 ML SOL INJ CT FA VD TRANS X 10 ML | Frasco/Ampola | -","fim vigência":"2022-12-31T23:59:00Z","tipo de acordo":"Por período","data solicitação":"29/07/2022","início vigência":"2022-08-01T00:00:00Z"},
{"status do contrato":"Expirados","categoria produto":"Medicamentos","id contrato":731456,"razão social do cliente":"Unimed de Presidente Prudente Cooperativa De Trabalho Médico","valor unitário":280.8300000000,"quantidade acordada":"Não Estipulado","dias para encerramento do acordo":"Expirados","cnpj cliente":"44.863.959/0001-26","título":"ACORDO 5 MESES - NR2006","produto":"REVOLADE 50 MG COM REV CT BL AL/AL X 14 | Comprimido | -","fim vigência":"2022-12-31T23:59:00Z","tipo de acordo":"Por período","data solicitação":"29/07/2022","início vigência":"2022-08-01T00:00:00Z"},
{"status do contrato":"Expirados","categoria produto":"Medicamentos","id contrato":731456,"razão social do cliente":"Unimed de Presidente Prudente Cooperativa De Trabalho Médico","valor unitário":3118.8000000000,"quantidade acordada":"Não Estipulado","dias para encerramento do acordo":"Expirados","cnpj cliente":"44.863.959/0001-26","título":"ACORDO 5 MESES - NR2006","produto":"IMFINZI 120 MG/2,4 ML SOL INJ CT FA VD TRANS X 2,4 ML | Frasco/Ampola | -","fim vigência":"2022-12-31T23:59:00Z","tipo de acordo":"Por período","data solicitação":"29/07/2022","início vigência":"2022-08-01T00:00:00Z"},
{"status do contrato":"Expirados","categoria produto":"Medicamentos","id contrato":746974,"razão social do cliente":"Unimed de Volta Redonda Cooperativa de Trabalho Medico","valor unitário":673.3400000000,"quantidade acordada":"Não Estipulado","dias para encerramento do acordo":"Expirados","cnpj cliente":"35.917.970/0007-26","título":"ACORDO COMERCIAL - SETEMBRO 2022 - 09.1629-F/22","produto":"ACALABRUTINIBE 100MG (CALQUENCE) | Capsula | ASTRAZENECA","fim vigência":"2022-12-31T23:59:00Z","tipo de acordo":"Por período","data solicitação":"19/09/2022","início vigência":"2022-09-19T00:00:00Z"},
{"status do contrato":"Expirados","categoria produto":"Medicamentos","id contrato":731456,"razão social do cliente":"Unimed de Presidente Prudente Cooperativa De Trabalho Médico","valor unitário":427.1300000000,"quantidade acordada":"Não Estipulado","dias para encerramento do acordo":"Expirados","cnpj cliente":"44.863.959/0001-26","título":"ACORDO 5 MESES - NR2006","produto":"JAKAVI 20 MG COM CT BL AL PLAS TRANS X 60","fim vigência":"2022-12-31T23:59:00Z","tipo de acordo":"Por período","data solicitação":"29/07/2022","início vigência":"2022-08-01T00:00:00Z"},
{"status do contrato":"Expirados","categoria produto":"Medicamentos","id contrato":731456,"razão social do cliente":"Unimed de Presidente Prudente Cooperativa De Trabalho Médico","valor unitário":256.8500000000,"quantidade acordada":"Não Estipulado","dias para encerramento do acordo":"Expirados","cnpj cliente":"44.863.959/0001-26","título":"ACORDO 5 MESES - NR2006","produto":"KISQALI 200 MG/DOSE COM REV CT BL AL PLAS TRANS X 63 | Comprimido | -","fim vigência":"2022-12-31T23:59:00Z","tipo de acordo":"Por período","data solicitação":"29/07/2022","início vigência":"2022-08-01T00:00:00Z"},
{"status do contrato":"Expirados","categoria produto":"Medicamentos","id contrato":746974,"razão social do cliente":"Unimed de Volta Redonda Cooperativa de Trabalho Medico","valor unitário":632.7700000000,"quantidade acordada":"Não Estipulado","dias para encerramento do acordo":"Expirados","cnpj cliente":"35.917.970/0007-26","título":"ACORDO COMERCIAL - SETEMBRO 2022 - 09.1629-F/22","produto":"TRAMATINIBE 2MG C/ 30 CP (MEKINIST) | Comprimido | NOVARTIS","fim vigência":"2022-12-31T23:59:00Z","tipo de acordo":"Por período","data solicitação":"19/09/2022","início vigência":"2022-09-19T00:00:00Z"},
{"status do contrato":"Expirados","categoria produto":"Medicamentos","id contrato":746974,"razão social do cliente":"Unimed de Volta Redonda Cooperativa de Trabalho Medico","valor unitário":1038.3400000000,"quantidade acordada":"Não Estipulado","dias para encerramento do acordo":"Expirados","cnpj cliente":"35.917.970/0007-26","título":"ACORDO COMERCIAL - SETEMBRO 2022 - 09.1629-F/22","produto":"OSIMERTINIBE 80MG CMP (TAGRISSO) (N) (VD) | Comprimido | 24","fim vigência":"2022-12-31T23:59:00Z","tipo de acordo":"Por período","data solicitação":"19/09/2022","início vigência":"2022-09-19T00:00:00Z"},
{"status do contrato":"Expirados","categoria produto":"Medicamentos","id contrato":746974,"razão social do cliente":"Unimed de Volta Redonda Cooperativa de Trabalho Medico","valor unitário":140.0000000000,"quantidade acordada":"Não Estipulado","dias para encerramento do acordo":"Expirados","cnpj cliente":"35.917.970/0007-26","título":"ACORDO COMERCIAL - SETEMBRO 2022 - 09.1629-F/22","produto":"ELTROMBOPAG OLAMINA 25MG CMP (REVOLADE) (VD) | Comprimido | 16","fim vigência":"2022-12-31T23:59:00Z","tipo de acordo":"Por período","data solicitação":"19/09/2022","início vigência":"2022-09-19T00:00:00Z"},
{"status do contrato":"Expirados","categoria produto":"Medicamentos","id contrato":731456,"razão social do cliente":"Unimed de Presidente Prudente Cooperativa De Trabalho Médico","valor unitário":238.1000000000,"quantidade acordada":"Não Estipulado","dias para encerramento do acordo":"Expirados","cnpj cliente":"44.863.959/0001-26","título":"ACORDO 5 MESES - NR2006","produto":"JAKAVI 5 MG COM CT BL AL PLAS TRANS X 60","fim vigência":"2022-12-31T23:59:00Z","tipo de acordo":"Por período","data solicitação":"29/07/2022","início vigência":"2022-08-01T00:00:00Z"},
{"status do contrato":"Expirados","categoria produto":"Medicamentos","id contrato":211664,"razão social do cliente":"Cruz Azul de Sao Paulo","valor unitário":11175.4200000000,"quantidade acordada":"Não Estipulado","dias para encerramento do acordo":"Expirados","cnpj cliente":"62.106.505/0001-92","título":"ACORDO COMERCIAL ONCOLÓGICO PONTUAL","produto":"TRANSTUZUMAB EMTASINE 160MG FR/AMP | Frasco/Ampola | ROCHE | Frasco/Ampola | ROCHE | Frasco/Ampola | ROCHE","fim vigência":"2022-03-31T23:59:00Z","tipo de acordo":"Por período","data solicitação":"02/08/2021","início vigência":"2021-08-02T00:00:00Z"},
{"status do contrato":"Expirados","categoria produto":"Medicamentos","id contrato":246839,"razão social do cliente":"Cruz Azul de Sao Paulo","valor unitário":230.0000000000,"quantidade acordada":"Não Estipulado","dias para encerramento do acordo":"Expirados","cnpj cliente":"62.106.505/0001-92","título":"ACORDO COMERCIAL ONCOLÓGICO PONTUAL","produto":"RUXOLITINIBE 5MG COMP. (N.P.) | Comprimido | NOVARTIS","fim vigência":"2022-03-31T23:59:00Z","tipo de acordo":"Por período","data solicitação":"16/09/2021","início vigência":"2021-09-16T00:00:00Z"},
{"status do contrato":"Expirados","categoria produto":"Medicamentos","id contrato":190635,"razão social do cliente":"Unimed Fortaleza Cooperativa de Trabalho Medico Ltda.","valor unitário":696.6000000000,"quantidade acordada":"1","dias para encerramento do acordo":"Expirados","cnpj cliente":"05.868.278/0002-80","título":"PEDIDO DE COTAÇÃO - FIDELIZAÇÃO 01 ANO - MEDICAMENTOS NOVARTIS PART 01","produto":"MIDOSTAURINA 25MG CAPS VO","fim vigência":"2022-03-31T23:59:00Z","tipo de acordo":"Por quantidade e período","data solicitação":"19/04/2021","início vigência":"2021-04-19T00:00:00Z"},
{"status do contrato":"Expirados","categoria produto":"Medicamentos","id contrato":200585,"razão social do cliente":"Unimed de Volta Redonda Cooperativa de Trabalho Medico","valor unitário":993.4300000000,"quantidade acordada":"30","dias para encerramento do acordo":"Expirados","cnpj cliente":"35.917.970/0007-26","título":"ACORDO COMERCIAL TRIMESTRAL  MAIO - JUNHO - JULHO 2021","produto":"OSIMERTINIBE 80MG COMP (TAGRISSO)","fim vigência":"2021-07-31T23:59:00Z","tipo de acordo":"Por quantidade e período","data solicitação":"14/05/2021","início vigência":"2021-05-14T00:00:00Z"},
{"status do contrato":"Expirados","categoria produto":"Medicamentos","id contrato":91325,"razão social do cliente":"Unimed São José do Rio Preto - Complexo de Saúde","valor unitário":965.0000000000,"quantidade acordada":"150","dias para encerramento do acordo":"Expirados","cnpj cliente":"45.100.138/0003-62","título":"ACORDO COMERCIAL: Medicamentos ASTRA ZENECA (TAGRISSO)","produto":"OSIMERTINIB 80 MG CPDS - COMPRIMIDO | Comprimido | ACEITA ALTERNATIVAS","fim vigência":"2020-03-31T00:00:00Z","tipo de acordo":"Por quantidade e período","data solicitação":"16/07/2019","início vigência":"2019-07-16T00:00:00Z"},
{"status do contrato":"Expirados","categoria produto":"Medicamentos","id contrato":85651,"razão social do cliente":"Consolidador - Rede Mater Dei - BH","valor unitário":951.7400000000,"quantidade acordada":"120","dias para encerramento do acordo":"Expirados","cnpj cliente":"16.676.520/0001-59","título":"COMPRA DE CONTRATO DE MEDICAMENTO - NUDISSON","produto":"TAGRISSO 80 MG COMP OSIMERTINIBE","fim vigência":"2019-03-31T00:00:00Z","tipo de acordo":"Por quantidade e período","data solicitação":"23/01/2019","início vigência":"2019-01-23T00:00:00Z"},
{"status do contrato":"Expirados","categoria produto":"Medicamentos","id contrato":83151,"razão social do cliente":"Unimed São José do Rio Preto - Complexo de Saúde","valor unitário":164.0400000000,"quantidade acordada":"84","dias para encerramento do acordo":"Expirados","cnpj cliente":"45.100.138/0003-62","título":"Acordo Comercial Onco - Vigente até 31/03/2019","produto":"REGORAFENIBE 40 MG | Unidade | NULL","fim vigência":"2019-03-31T00:00:00Z","tipo de acordo":"Por quantidade e período","data solicitação":"29/10/2018","início vigência":"2018-10-29T00:00:00Z"},
{"status do contrato":"Expirados","categoria produto":"Medicamentos","id contrato":83151,"razão social do cliente":"Unimed São José do Rio Preto - Complexo de Saúde","valor unitário":170.7000000000,"quantidade acordada":"1200","dias para encerramento do acordo":"Expirados","cnpj cliente":"45.100.138/0003-62","título":"Acordo Comercial Onco - Vigente até 31/03/2019","produto":"MESILATO DE DABRAFENIBE 50MG 120 CAP","fim vigência":"2019-03-31T00:00:00Z","tipo de acordo":"Por quantidade e período","data solicitação":"29/10/2018","início vigência":"2018-10-29T00:00:00Z"},
{"status do contrato":"Expirados","categoria produto":"Medicamentos","id contrato":80158,"razão social do cliente":"Hospital Esperança SA - Cardio Pulmonar da Bahia S.A.","valor unitário":38.0000000000,"quantidade acordada":"Não Estipulado","dias para encerramento do acordo":"Expirados","cnpj cliente":"02.284.062/0015-01","título":"CONTRATO ROCEFIN IV 1G NR 2006","produto":"Rocefin IV 1g | Frasco/Ampola | Roche","fim vigência":"2019-03-31T00:00:00Z","tipo de acordo":"Por período","data solicitação":"20/08/2018","início vigência":"2018-08-20T00:00:00Z"},
{"status do contrato":"Outros","categoria produto":"Medicamentos","id contrato":1788247,"razão social do cliente":"Associação Beneficente Evangélica de Joinville","valor unitário":929.0000000000,"quantidade acordada":"Não Estipulado","dias para encerramento do acordo":"Outros","cnpj cliente":"84.694.405/0001-67","título":"Acordo Comercial NR2006","produto":"Dispositivo intra uterino Mirena 20mcg/24h | Unidade","fim vigência":"2026-03-31T14:45:00Z","tipo de acordo":"Por período","data solicitação":"15/01/2025","início vigência":"2025-01-15T14:45:00Z"},
{"status do contrato":"Outros","categoria produto":"Medicamentos","id contrato":1788247,"razão social do cliente":"Associação Beneficente Evangélica de Joinville","valor unitário":898.0000000000,"quantidade acordada":"Não Estipulado","dias para encerramento do acordo":"Outros","cnpj cliente":"84.694.405/0001-67","título":"Acordo Comercial NR2006","produto":"Dispositivo intra uterino Kyleena | Unidade | Bayer SA","fim vigência":"2026-03-31T14:45:00Z","tipo de acordo":"Por período","data solicitação":"15/01/2025","início vigência":"2025-01-15T14:45:00Z"},
{"status do contrato":"Vigentes","categoria produto":"Medicamentos","id contrato":4333204,"razão social do cliente":"Unimed De Jundiai Cooperativa De Trabalho Medico","valor unitário":14058.3600000000,"quantidade acordada":"Não Estipulado","dias para encerramento do acordo":null,"cnpj cliente":"56.727.134/0012-16","título":"Farma Pontual - Roche","produto":"Pertuzumabe 420mg inj | Frasco/Ampola | ROCHE","fim vigência":null,"tipo de acordo":"Sem vigência","data solicitação":"07/10/2025","início vigência":null},
{"status do contrato":"Vigentes","categoria produto":"Medicamentos","id contrato":4333204,"razão social do cliente":"Unimed De Jundiai Cooperativa De Trabalho Medico","valor unitário":25707.2100000000,"quantidade acordada":"Não Estipulado","dias para encerramento do acordo":null,"cnpj cliente":"56.727.134/0012-16","título":"Farma Pontual - Roche","produto":"Obinutuzumabe 1000mg fr 40ml","fim vigência":null,"tipo de acordo":"Sem vigência","data solicitação":"07/10/2025","início vigência":null},
{"status do contrato":"Vigentes","categoria produto":"Medicamentos","id contrato":4333204,"razão social do cliente":"Unimed De Jundiai Cooperativa De Trabalho Medico","valor unitário":25019.3400000000,"quantidade acordada":"Não Estipulado","dias para encerramento do acordo":null,"cnpj cliente":"56.727.134/0012-16","título":"Farma Pontual - Roche","produto":"Atezolizumabe 1200mg | Frasco/Ampola | Roche","fim vigência":null,"tipo de acordo":"Sem vigência","data solicitação":"07/10/2025","início vigência":null},
{"status do contrato":"Vigentes","categoria produto":"Medicamentos","id contrato":4333204,"razão social do cliente":"Unimed De Jundiai Cooperativa De Trabalho Medico","valor unitário":2059.5700000000,"quantidade acordada":"Não Estipulado","dias para encerramento do acordo":null,"cnpj cliente":"56.727.134/0012-16","título":"Farma Pontual - Roche","produto":"Tocilizumabe 200mg/10ml - Frasco-ampola | Frasco/Ampola | ROCHE","fim vigência":null,"tipo de acordo":"Sem vigência","data solicitação":"07/10/2025","início vigência":null},
{"status do contrato":"Vigentes","categoria produto":"Medicamentos","id contrato":4333202,"razão social do cliente":"Unimed De Jundiai Cooperativa De Trabalho Medico","valor unitário":1292.3500000000,"quantidade acordada":"Não Estipulado","dias para encerramento do acordo":null,"cnpj cliente":"56.727.134/0012-16","título":"Farma Pontual - Ipsen","produto":"CABOMETYX 60mg ","fim vigência":null,"tipo de acordo":"Sem vigência","data solicitação":"07/10/2025","início vigência":null},
{"status do contrato":"Vigentes","categoria produto":"Medicamentos","id contrato":4333204,"razão social do cliente":"Unimed De Jundiai Cooperativa De Trabalho Medico","valor unitário":8322.6600000000,"quantidade acordada":"Não Estipulado","dias para encerramento do acordo":null,"cnpj cliente":"56.727.134/0012-16","título":"Farma Pontual - Roche","produto":"Trastuzumabe Entansina 100mg | Frasco/Ampola | ROCHE","fim vigência":null,"tipo de acordo":"Sem vigência","data solicitação":"07/10/2025","início vigência":null},
{"status do contrato":"Vigentes","categoria produto":"Medicamentos","id contrato":4333202,"razão social do cliente":"Unimed De Jundiai Cooperativa De Trabalho Medico","valor unitário":1292.3500000000,"quantidade acordada":"Não Estipulado","dias para encerramento do acordo":null,"cnpj cliente":"56.727.134/0012-16","título":"Farma Pontual - Ipsen","produto":"Cabozantinibe 60mg cp","fim vigência":null,"tipo de acordo":"Sem vigência","data solicitação":"07/10/2025","início vigência":null},
{"status do contrato":"Vigentes","categoria produto":"Medicamentos","id contrato":4333202,"razão social do cliente":"Unimed De Jundiai Cooperativa De Trabalho Medico","valor unitário":3986.0000000000,"quantidade acordada":"Não Estipulado","dias para encerramento do acordo":null,"cnpj cliente":"56.727.134/0012-16","título":"Farma Pontual - Ipsen","produto":"Lanreotide 120 mg Seringa preenchida | Ampola | IPSEN","fim vigência":null,"tipo de acordo":"Sem vigência","data solicitação":"07/10/2025","início vigência":null},
{"status do contrato":"Vigentes","categoria produto":"Medicamentos","id contrato":4333204,"razão social do cliente":"Unimed De Jundiai Cooperativa De Trabalho Medico","valor unitário":10566.6300000000,"quantidade acordada":"Não Estipulado","dias para encerramento do acordo":null,"cnpj cliente":"56.727.134/0012-16","título":"Farma Pontual - Roche","produto":"Rituximabe 1400mg fr 11,7ml subcutaneo","fim vigência":null,"tipo de acordo":"Sem vigência","data solicitação":"07/10/2025","início vigência":null},
{"status do contrato":"Vigentes","categoria produto":"Medicamentos","id contrato":4333204,"razão social do cliente":"Unimed De Jundiai Cooperativa De Trabalho Medico","valor unitário":39992.1900000000,"quantidade acordada":"Não Estipulado","dias para encerramento do acordo":null,"cnpj cliente":"56.727.134/0012-16","título":"Farma Pontual - Roche","produto":"Ocrelizumabe 300mg | Frasco/Ampola | ROCHE","fim vigência":null,"tipo de acordo":"Sem vigência","data solicitação":"07/10/2025","início vigência":null},
{"status do contrato":"Vigentes","categoria produto":"Medicamentos","id contrato":4333204,"razão social do cliente":"Unimed De Jundiai Cooperativa De Trabalho Medico","valor unitário":12749.4200000000,"quantidade acordada":"Não Estipulado","dias para encerramento do acordo":null,"cnpj cliente":"56.727.134/0012-16","título":"Farma Pontual - Roche","produto":"Trastuzumabe 600mg - subcutaneo","fim vigência":null,"tipo de acordo":"Sem vigência","data solicitação":"07/10/2025","início vigência":null},
{"status do contrato":"Vigentes","categoria produto":"Medicamentos","id contrato":4333204,"razão social do cliente":"Unimed De Jundiai Cooperativa De Trabalho Medico","valor unitário":819.6100000000,"quantidade acordada":"Não Estipulado","dias para encerramento do acordo":null,"cnpj cliente":"56.727.134/0012-16","título":"Farma Pontual - Roche","produto":"Tocilizumabe 80mg fr 4mL | Frasco/Ampola | ROCHE","fim vigência":null,"tipo de acordo":"Sem vigência","data solicitação":"07/10/2025","início vigência":null},
{"status do contrato":"Vigentes","categoria produto":"Medicamentos","id contrato":4333202,"razão social do cliente":"Unimed De Jundiai Cooperativa De Trabalho Medico","valor unitário":1213.9900000000,"quantidade acordada":"Não Estipulado","dias para encerramento do acordo":null,"cnpj cliente":"56.727.134/0012-16","título":"Farma Pontual - Ipsen","produto":"Cabozantinibe 40mg cp","fim vigência":null,"tipo de acordo":"Sem vigência","data solicitação":"07/10/2025","início vigência":null},
{"status do contrato":"Vigentes","categoria produto":"Medicamentos","id contrato":4333204,"razão social do cliente":"Unimed De Jundiai Cooperativa De Trabalho Medico","valor unitário":13549.6400000000,"quantidade acordada":"Não Estipulado","dias para encerramento do acordo":null,"cnpj cliente":"56.727.134/0012-16","título":"Farma Pontual - Roche","produto":"Trastuzumabe Entansina 160mg","fim vigência":null,"tipo de acordo":"Sem vigência","data solicitação":"07/10/2025","início vigência":null},
{"status do contrato":"Vigentes","categoria produto":"Medicamentos","id contrato":4333202,"razão social do cliente":"Unimed De Jundiai Cooperativa De Trabalho Medico","valor unitário":1213.9900000000,"quantidade acordada":"Não Estipulado","dias para encerramento do acordo":null,"cnpj cliente":"56.727.134/0012-16","título":"Farma Pontual - Ipsen","produto":"CABOMETYX 40mg ","fim vigência":null,"tipo de acordo":"Sem vigência","data solicitação":"07/10/2025","início vigência":null},
{"status do contrato":"Vigentes","categoria produto":"Medicamentos","id contrato":4333202,"razão social do cliente":"Unimed De Jundiai Cooperativa De Trabalho Medico","valor unitário":606.9900000000,"quantidade acordada":"Não Estipulado","dias para encerramento do acordo":null,"cnpj cliente":"56.727.134/0012-16","título":"Farma Pontual - Ipsen","produto":"CABOMETYX 20mg ","fim vigência":null,"tipo de acordo":"Sem vigência","data solicitação":"07/10/2025","início vigência":null},
{"status do contrato":"Vigentes","categoria produto":"Medicamentos","id contrato":4333204,"razão social do cliente":"Unimed De Jundiai Cooperativa De Trabalho Medico","valor unitário":1376.7800000000,"quantidade acordada":"Não Estipulado","dias para encerramento do acordo":null,"cnpj cliente":"56.727.134/0012-16","título":"Farma Pontual - Roche","produto":"Tocilizumabe 162mg - seringa | Seringa | ROCHE","fim vigência":null,"tipo de acordo":"Sem vigência","data solicitação":"07/10/2025","início vigência":null}
]