Sheet: Resumodevendasporrepresen
A1: PONTUAL FARMACEUTICA
A2: CONTROLADORA (Consolidado)
A3: Resumo de vendas por representante de vendas
A4: 01 Julho 2025 - 20 Fevereiro 2026
A7: Representante de vendas | B7: Julho 2025 | D7: Agosto 2025 | F7: Setembro 2025 | H7: Outubro 2025 | J7: Novembro 2025 | L7: Dezembro 2025 | N7: Janeiro 2026 | P7: Fevereiro 2026 | R7: Total
B8: Total da transação | C8: Total da transação de contribuição | D8: Total da transação | E8: Total da transação de contribuição | F8: Total da transação | G8: Total da transação de contribuição | H8: Total da transação | I8: Total da transação de contribuição | J8: Total da transação | K8: Total da transação de contribuição | L8: Total da transação | M8: Total da transação de contribuição | N8: Total da transação | O8: Total da transação de contribuição | P8: Total da transação | Q8: Total da transação de contribuição | R8: Total da transação | S8: Total da transação de contribuição
A9: - Sem Representante de vendas - | B9: 1.082738545E7 | C9: 1.082738545E7 | D9: 9207631.76 | E9: 9207631.76 | F9: 1.271252367E7 | G9: 1.271252367E7 | H9: 1.823765082E7 | I9: 1.823765082E7 | J9: 1.592367028E7 | K9: 1.592367028E7 | L9: 1.67167763E7 | M9: 1.67167763E7 | N9: 1.33149407E7 | O9: 1.33149407E7 | P9: 2325791.5 | Q9: 2325791.5 | R9: SUM(RC[-16],RC[-14],RC[-12],RC[-10],RC[-8],RC[-6],RC[-4],RC[-2]) -> 9.926637048E7 | S9: SUM(RC[-16],RC[-14],RC[-12],RC[-10],RC[-8],RC[-6],RC[-4],RC[-2]) -> 9.926637048E7
A10: CAIO MARCANTONIO | B10: 1753278.7 | C10: 1753278.7 | D10: 2006227.62 | E10: 2006227.62 | F10: 2869395.36 | G10: 2869395.36 | H10: 2679826.08 | I10: 2679826.08 | J10: 2152125.0 | K10: 2152125.0 | L10: 3083171.05 | M10: 3083171.05 | N10: 3075924.97 | O10: 3075924.97 | P10: 1067979.95 | Q10: 1067979.95 | R10: SUM(RC[-16],RC[-14],RC[-12],RC[-10],RC[-8],RC[-6],RC[-4],RC[-2]) -> 1.8687928729999997E7 | S10: SUM(RC[-16],RC[-14],RC[-12],RC[-10],RC[-8],RC[-6],RC[-4],RC[-2]) -> 1.8687928729999997E7
A11: NATHALIA RODRIGUES RAMOS MAINIER
A12: NATHALIA RODRIGUES RAMOS MAINIER | B12: 1173174.56 | C12: 1173174.56 | D12: 3232670.92 | E12: 3232670.92 | F12: 1227206.21 | G12: 1138464.27 | H12: 4305026.48 | I12: 4305026.48 | J12: 1269240.66 | K12: 1236151.18 | L12: 965023.89 | M12: 965023.89 | N12: 640128.77 | O12: 623585.69 | P12: 21397.8 | Q12: 4855.8 | R12: SUM(RC[-16],RC[-14],RC[-12],RC[-10],RC[-8],RC[-6],RC[-4],RC[-2]) -> 1.2833869290000003E7 | S12: SUM(RC[-16],RC[-14],RC[-12],RC[-10],RC[-8],RC[-6],RC[-4],RC[-2]) -> 1.2678952790000001E7
A13: BRUNA FARIA SÁ
A14: BRUNA FARIA SÁ | B14: 5099440.03 | C14: 5099440.03 | D14: 6092300.71 | E14: 6092300.71 | F14: 5784257.43 | G14: 5784257.43 | H14: 5642556.54 | I14: 5642556.54 | J14: 9812965.15 | K14: 9812965.15 | L14: 8574543.99 | M14: 8574543.99 | N14: 5680740.8 | O14: 5680740.8 | P14: 1785259.29 | Q14: 1785259.29 | R14: SUM(RC[-16],RC[-14],RC[-12],RC[-10],RC[-8],RC[-6],RC[-4],RC[-2]) -> 4.847206394E7 | S14: SUM(RC[-16],RC[-14],RC[-12],RC[-10],RC[-8],RC[-6],RC[-4],RC[-2]) -> 4.847206394E7
A15: ADRIANA PIRES DE ARAUJO | B15: 4227118.95 | C15: 4227118.95 | D15: 2298354.12 | E15: 2298354.12 | F15: 4851974.83 | G15: 4760611.64 | H15: 6041383.89 | I15: 5968284.72 | J15: 8907418.54 | K15: 8763229.9625 | L15: 8217584.57 | M15: 8174395.4375 | N15: 7766290.98 | O15: 7665168.6975 | P15: 1812343.96 | Q15: 1795801.96 | R15: SUM(RC[-16],RC[-14],RC[-12],RC[-10],RC[-8],RC[-6],RC[-4],RC[-2]) -> 4.4122469839999996E7 | S15: SUM(RC[-16],RC[-14],RC[-12],RC[-10],RC[-8],RC[-6],RC[-4],RC[-2]) -> 4.36529654875E7
A16: ANA CAROLINE DA SILVA XAVIER
A17: ANA CAROLINE DA SILVA XAVIER | B17: 2980400.78 | C17: 2980400.78 | D17: 1399913.81 | E17: 1399913.81 | F17: 2952073.45 | G17: 2949452.2 | H17: 2319156.9 | I17: 2246057.73 | J17: 2441796.04 | K17: 2330696.9425 | L17: 4171606.91 | M17: 4128417.7775 | N17: 2681055.27 | O17: 2596476.0675 | P17: 640083.63 | Q17: 640083.63 | R17: SUM(RC[-16],RC[-14],RC[-12],RC[-10],RC[-8],RC[-6],RC[-4],RC[-2]) -> 1.958608679E7 | S17: SUM(RC[-16],RC[-14],RC[-12],RC[-10],RC[-8],RC[-6],RC[-4],RC[-2]) -> 1.9271498937499996E7
A18: JULIA W GATINHO COSTA | B18: -73700.76 | C18: -73700.76 | D18: 254046.79 | E18: 254046.79 | F18: 918472.0 | G18: 918472.0 | H18: 0.0 | I18: 0.0 | J18: 0.0 | K18: 0.0 | L18: 0.0 | M18: 0.0 | N18: 304059.84 | O18: 304059.84 | P18: 0.0 | Q18: 0.0 | R18: SUM(RC[-16],RC[-14],RC[-12],RC[-10],RC[-8],RC[-6],RC[-4],RC[-2]) -> 1402877.87 | S18: SUM(RC[-16],RC[-14],RC[-12],RC[-10],RC[-8],RC[-6],RC[-4],RC[-2]) -> 1402877.87
A19: TALITA B COSTA | B19: 152625.2 | C19: 152625.2 | D19: 21875.98 | E19: 21875.98 | F19: 138357.62 | G19: 138357.62 | H19: 109259.42 | I19: 109259.42 | J19: 138558.02 | K19: 138558.02 | L19: 226282.33 | M19: 226282.33 | N19: 179667.37 | O19: 179667.37 | P19: 49346.88 | Q19: 49346.88 | R19: SUM(RC[-16],RC[-14],RC[-12],RC[-10],RC[-8],RC[-6],RC[-4],RC[-2]) -> 1015972.82 | S19: SUM(RC[-16],RC[-14],RC[-12],RC[-10],RC[-8],RC[-6],RC[-4],RC[-2]) -> 1015972.82
A20: Total - ANA CAROLINE DA SILVA XAVIER | C20: SUM(R[-3]C:R[-1]C) -> 3059325.22 | E20: SUM(R[-3]C:R[-1]C) -> 1675836.58 | G20: SUM(R[-3]C:R[-1]C) -> 4006281.8200000003 | I20: SUM(R[-3]C:R[-1]C) -> 2355317.15 | K20: SUM(R[-3]C:R[-1]C) -> 2469254.9625 | M20: SUM(R[-3]C:R[-1]C) -> 4354700.1075 | O20: SUM(R[-3]C:R[-1]C) -> 3080203.2775 | Q20: SUM(R[-3]C:R[-1]C) -> 689430.51 | S20: SUM(R[-3]C:R[-1]C) -> 2.1690349627500005E7
A21: BHEATRIZ M BRAND BAPTISTA | B21: 141032.34 | C21: 141032.34 | D21: 382184.92 | E21: 382184.92 | F21: 762132.13 | G21: 759510.88 | H21: 1036552.55 | I21: 963453.38 | J21: 694030.4 | K21: 582931.3025 | L21: 1020449.06 | M21: 977259.9275 | N21: 1107648.73 | O21: 1023069.5275 | P21: 123398.79 | Q21: 123398.79 | R21: SUM(RC[-16],RC[-14],RC[-12],RC[-10],RC[-8],RC[-6],RC[-4],RC[-2]) -> 5267428.920000001 | S21: SUM(RC[-16],RC[-14],RC[-12],RC[-10],RC[-8],RC[-6],RC[-4],RC[-2]) -> 4952841.0675
A22: Leticia N da Silva | B22: 0.0 | C22: 0.0 | D22: 0.0 | E22: 0.0 | F22: 0.0 | G22: 0.0 | H22: 43989.48 | I22: 43989.48 | J22: 54309.47 | K22: 54309.47 | L22: 71814.17 | M22: 71814.17 | N22: 11003.82 | O22: 11003.82 | P22: 12664.0 | Q22: 12664.0 | R22: SUM(RC[-16],RC[-14],RC[-12],RC[-10],RC[-8],RC[-6],RC[-4],RC[-2]) -> 193780.94 | S22: SUM(RC[-16],RC[-14],RC[-12],RC[-10],RC[-8],RC[-6],RC[-4],RC[-2]) -> 193780.94
A23: MARIA EDUARDA SOUZA FARIAS | B23: 0.0 | C23: 0.0 | D23: 0.0 | E23: 0.0 | F23: 0.0 | G23: 0.0 | H23: 0.0 | I23: 0.0 | J23: 0.0 | K23: 0.0 | L23: 182311.81 | M23: 182311.81 | N23: 97738.88 | O23: 97738.88 | P23: 0.0 | Q23: 0.0 | R23: SUM(RC[-16],RC[-14],RC[-12],RC[-10],RC[-8],RC[-6],RC[-4],RC[-2]) -> 280050.69 | S23: SUM(RC[-16],RC[-14],RC[-12],RC[-10],RC[-8],RC[-6],RC[-4],RC[-2]) -> 280050.69
A24: MATEUS AUGUSTO LEME CRISPIM | B24: 1172706.92 | C24: 1172706.92 | D24: 2982453.19 | E24: 2982453.19 | F24: 4115646.11 | G24: 4115646.11 | H24: 3842917.73 | I24: 3842917.73 | J24: 4068251.42 | K24: 4068251.42 | L24: 5403874.7 | M24: 5403874.7 | N24: 2785057.14 | O24: 2785057.14 | P24: 643868.01 | Q24: 643868.01 | R24: SUM(RC[-16],RC[-14],RC[-12],RC[-10],RC[-8],RC[-6],RC[-4],RC[-2]) -> 2.5014775220000003E7 | S24: SUM(RC[-16],RC[-14],RC[-12],RC[-10],RC[-8],RC[-6],RC[-4],RC[-2]) -> 2.5014775220000003E7
A25: Vanusa Garcia Da Silva | B25: 2611251.86 | C25: 2611251.86 | D25: 2388347.32 | E25: 2388347.32 | F25: 3749822.52 | G25: 3658459.33 | H25: 3333722.91 | I25: 3260623.74 | J25: 3759569.43 | K25: 3615380.8525 | L25: 5985767.2 | M25: 5942578.0675 | N25: 6632251.41 | O25: 6531129.1275 | P25: 1025676.21 | Q25: 1009134.21 | R25: SUM(RC[-16],RC[-14],RC[-12],RC[-10],RC[-8],RC[-6],RC[-4],RC[-2]) -> 2.948640886E7 | S25: SUM(RC[-16],RC[-14],RC[-12],RC[-10],RC[-8],RC[-6],RC[-4],RC[-2]) -> 2.90169045075E7
A26: Total - BRUNA FARIA SÁ | C26: SUM(R[-12]C:R[-11]C,R[-6]C:R[-1]C) -> 1.631087532E7 | E26: SUM(R[-12]C:R[-11]C,R[-6]C:R[-1]C) -> 1.581947684E7 | G26: SUM(R[-12]C:R[-11]C,R[-6]C:R[-1]C) -> 2.308476721E7 | I26: SUM(R[-12]C:R[-11]C,R[-6]C:R[-1]C) -> 2.2077142740000002E7 | K26: SUM(R[-12]C:R[-11]C,R[-6]C:R[-1]C) -> 2.9366323119999997E7 | M26: SUM(R[-12]C:R[-11]C,R[-6]C:R[-1]C) -> 3.368147821E7 | O26: SUM(R[-12]C:R[-11]C,R[-6]C:R[-1]C) -> 2.687411127E7 | Q26: SUM(R[-12]C:R[-11]C,R[-6]C:R[-1]C) -> 6059556.77 | S26: SUM(R[-12]C:R[-11]C,R[-6]C:R[-1]C) -> 1.7327373148000005E8
A27: Carlos Eduardo Ochoa | B27: 5902111.76 | C27: 5902111.76 | D27: 3802437.44 | E27: 3802437.44 | F27: 4493939.24 | G27: 4493939.24 | H27: 5947365.06 | I27: 5947365.06 | J27: 5869880.08 | K27: 5869880.08 | L27: 5213444.99 | M27: 5213444.99 | N27: 6309170.7 | O27: 6309170.7 | P27: 1355233.68 | Q27: 1355233.68 | R27: SUM(RC[-16],RC[-14],RC[-12],RC[-10],RC[-8],RC[-6],RC[-4],RC[-2]) -> 3.889358295E7 | S27: SUM(RC[-16],RC[-14],RC[-12],RC[-10],RC[-8],RC[-6],RC[-4],RC[-2]) -> 3.889358295E7
A28: CARTEIRA INTERNA | B28: 0.0 | C28: 0.0 | D28: 182213.37 | E28: 182213.37 | F28: 708401.23 | G28: 708401.23 | H28: 636342.97 | I28: 636342.97 | J28: 2240789.02 | K28: 2240789.02 | L28: 3722865.98 | M28: 3722865.98 | N28: 4372465.39 | O28: 4372465.39 | P28: 925693.98 | Q28: 925693.98 | R28: SUM(RC[-16],RC[-14],RC[-12],RC[-10],RC[-8],RC[-6],RC[-4],RC[-2]) -> 1.2788771940000001E7 | S28: SUM(RC[-16],RC[-14],RC[-12],RC[-10],RC[-8],RC[-6],RC[-4],RC[-2]) -> 1.2788771940000001E7
A29: Daniela do Carmo Borges | B29: 389263.99 | C29: 389263.99 | D29: 120573.11 | E29: 120573.11 | F29: 78660.13 | G29: 78660.13 | H29: 113889.36 | I29: 113889.36 | J29: 100884.75 | K29: 100884.75 | L29: 83102.49 | M29: 83102.49 | N29: 134641.63 | O29: 134641.63 | P29: 0.0 | Q29: 0.0 | R29: SUM(RC[-16],RC[-14],RC[-12],RC[-10],RC[-8],RC[-6],RC[-4],RC[-2]) -> 1021015.46 | S29: SUM(RC[-16],RC[-14],RC[-12],RC[-10],RC[-8],RC[-6],RC[-4],RC[-2]) -> 1021015.46
A30: FABIANA L MARTINS | B30: 1393559.64 | C30: 1393559.64 | D30: 1536331.58 | E30: 1536331.58 | F30: 1433623.34 | G30: 1433623.34 | H30: 1129010.96 | I30: 1129010.96 | J30: 1328260.35 | K30: 1328260.35 | L30: 2525037.99 | M30: 2525037.99 | N30: 3632322.24 | O30: 3632322.24 | P30: 207827.04 | Q30: 207827.04 | R30: SUM(RC[-16],RC[-14],RC[-12],RC[-10],RC[-8],RC[-6],RC[-4],RC[-2]) -> 1.3185973139999999E7 | S30: SUM(RC[-16],RC[-14],RC[-12],RC[-10],RC[-8],RC[-6],RC[-4],RC[-2]) -> 1.3185973139999999E7
A31: FABIANO FARAH
A32: ALESSANDRA JUSTI | B32: 228198.28 | C32: 228198.28 | D32: 150363.9 | E32: 150363.9 | F32: 73022.92 | G32: 73022.92 | H32: 35276.51 | I32: 35276.51 | J32: 160382.03 | K32: 160382.03 | L32: 113995.82 | M32: 113995.82 | N32: 44773.33 | O32: 44773.33 | P32: 10686.21 | Q32: 10686.21 | R32: SUM(RC[-16],RC[-14],RC[-12],RC[-10],RC[-8],RC[-6],RC[-4],RC[-2]) -> 816698.9999999999 | S32: SUM(RC[-16],RC[-14],RC[-12],RC[-10],RC[-8],RC[-6],RC[-4],RC[-2]) -> 816698.9999999999
A33: GISLAINE R SILVA | B33: 355052.07 | C33: 355052.07 | D33: 184109.5 | E33: 184109.5 | F33: 393159.37 | G33: 393159.37 | H33: 1353274.31 | I33: 1353274.31 | J33: 1415845.53 | K33: 1415845.53 | L33: 1318442.67 | M33: 1318442.67 | N33: 2096485.54 | O33: 2096485.54 | P33: 139014.14 | Q33: 139014.14 | R33: SUM(RC[-16],RC[-14],RC[-12],RC[-10],RC[-8],RC[-6],RC[-4],RC[-2]) -> 7255383.13 | S33: SUM(RC[-16],RC[-14],RC[-12],RC[-10],RC[-8],RC[-6],RC[-4],RC[-2]) -> 7255383.13
A34: JOÃO V AMARAL | B34: 507568.12 | C34: 507568.12 | D34: 579563.55 | E34: 579563.55 | F34: 424123.22 | G34: 424123.22 | H34: 726861.22 | I34: 726861.22 | J34: 500778.98 | K34: 500778.98 | L34: 560841.98 | M34: 560841.98 | N34: 303073.31 | O34: 303073.31 | P34: 39046.2 | Q34: 39046.2 | R34: SUM(RC[-16],RC[-14],RC[-12],RC[-10],RC[-8],RC[-6],RC[-4],RC[-2]) -> 3641856.58 | S34: SUM(RC[-16],RC[-14],RC[-12],RC[-10],RC[-8],RC[-6],RC[-4],RC[-2]) -> 3641856.58
A35: Total - FABIANO FARAH | C35: SUM(R[-3]C:R[-1]C) -> 1090818.47 | E35: SUM(R[-3]C:R[-1]C) -> 914036.9500000001 | G35: SUM(R[-3]C:R[-1]C) -> 890305.51 | I35: SUM(R[-3]C:R[-1]C) -> 2115412.04 | K35: SUM(R[-3]C:R[-1]C) -> 2077006.54 | M35: SUM(R[-3]C:R[-1]C) -> 1993280.47 | O35: SUM(R[-3]C:R[-1]C) -> 2444332.18 | Q35: SUM(R[-3]C:R[-1]C) -> 188746.55 | S35: SUM(R[-3]C:R[-1]C) -> 1.171393871E7
A36: KLEBERSON TODESCHINI
A37: Camilla Araujo Inacio | B37: 0.0 | C37: 0.0 | D37: 0.0 | E37: 0.0 | F37: 0.0 | G37: 0.0 | H37: 6849.5 | I37: 6849.5 | J37: 0.0 | K37: 0.0 | L37: 15692.94 | M37: 15692.94 | N37: 30070.73 | O37: 30070.73 | P37: 0.0 | Q37: 0.0 | R37: SUM(RC[-16],RC[-14],RC[-12],RC[-10],RC[-8],RC[-6],RC[-4],RC[-2]) -> 52613.17 | S37: SUM(RC[-16],RC[-14],RC[-12],RC[-10],RC[-8],RC[-6],RC[-4],RC[-2]) -> 52613.17
A38: Jaqueline Mayara De Araujo | B38: 4072044.99 | C38: 4072044.99 | D38: 6835822.2 | E38: 6835822.2 | F38: 6707801.35 | G38: 6707801.35 | H38: 5658496.39 | I38: 5658496.39 | J38: 4051062.05 | K38: 4051062.05 | L38: 6342292.7 | M38: 6342292.7 | N38: 3223509.71 | O38: 3223509.71 | P38: 840281.34 | Q38: 840281.34 | R38: SUM(RC[-16],RC[-14],RC[-12],RC[-10],RC[-8],RC[-6],RC[-4],RC[-2]) -> 3.7731310730000004E7 | S38: SUM(RC[-16],RC[-14],RC[-12],RC[-10],RC[-8],RC[-6],RC[-4],RC[-2]) -> 3.7731310730000004E7
A39: THAYS COSTA | B39: 1321448.42 | C39: 1321448.42 | D39: 872856.15 | E39: 872856.15 | F39: 706320.6 | G39: 706320.6 | H39: 2089950.8 | I39: 2089950.8 | J39: 1579990.88 | K39: 1579990.88 | L39: 2723307.82 | M39: 2723307.82 | N39: 1546362.09 | O39: 1546362.09 | P39: 519498.87 | Q39: 519498.87 | R39: SUM(RC[-16],RC[-14],RC[-12],RC[-10],RC[-8],RC[-6],RC[-4],RC[-2]) -> 1.1359735629999999E7 | S39: SUM(RC[-16],RC[-14],RC[-12],RC[-10],RC[-8],RC[-6],RC[-4],RC[-2]) -> 1.1359735629999999E7
A40: Total - KLEBERSON TODESCHINI | C40: SUM(R[-3]C:R[-1]C) -> 5393493.41 | E40: SUM(R[-3]C:R[-1]C) -> 7708678.350000001 | G40: SUM(R[-3]C:R[-1]C) -> 7414121.949999999 | I40: SUM(R[-3]C:R[-1]C) -> 7755296.6899999995 | K40: SUM(R[-3]C:R[-1]C) -> 5631052.93 | M40: SUM(R[-3]C:R[-1]C) -> 9081293.46 | O40: SUM(R[-3]C:R[-1]C) -> 4799942.53 | Q40: SUM(R[-3]C:R[-1]C) -> 1359780.21 | S40: SUM(R[-3]C:R[-1]C) -> 4.914365953E7
A41: RAPHAEL LUIZ RODRIGUES RAMOS
A42: Guilherme de Siqueira Ferreira da Silva | B42: 0.0 | C42: 0.0 | D42: 0.0 | E42: 0.0 | F42: 88741.94 | G42: 0.0 | H42: 0.0 | I42: 0.0 | J42: 33089.48 | K42: 0.0 | L42: 0.0 | M42: 0.0 | N42: 16543.08 | O42: 0.0 | P42: 16542.0 | Q42: 0.0 | R42: SUM(RC[-16],RC[-14],RC[-12],RC[-10],RC[-8],RC[-6],RC[-4],RC[-2]) -> 154916.5 | S42: SUM(RC[-16],RC[-14],RC[-12],RC[-10],RC[-8],RC[-6],RC[-4],RC[-2]) -> 0.0
A43: HIRVING A CASTRO | B43: 0.0 | C43: 0.0 | D43: 11504.0 | E43: 11504.0 | F43: 0.0 | G43: 0.0 | H43: 0.0 | I43: 0.0 | J43: 0.0 | K43: 0.0 | L43: 0.0 | M43: 0.0 | N43: 0.0 | O43: 0.0 | P43: 0.0 | Q43: 0.0 | R43: SUM(RC[-16],RC[-14],RC[-12],RC[-10],RC[-8],RC[-6],RC[-4],RC[-2]) -> 11504.0 | S43: SUM(RC[-16],RC[-14],RC[-12],RC[-10],RC[-8],RC[-6],RC[-4],RC[-2]) -> 11504.0
A44: NAYARA D DOS SANTOS | B44: 0.0 | C44: 0.0 | D44: 0.0 | E44: 0.0 | F44: 2911.64 | G44: 2911.64 | H44: 0.0 | I44: 0.0 | J44: 0.0 | K44: 0.0 | L44: 0.0 | M44: 0.0 | N44: 0.0 | O44: 0.0 | P44: 0.0 | Q44: 0.0 | R44: SUM(RC[-16],RC[-14],RC[-12],RC[-10],RC[-8],RC[-6],RC[-4],RC[-2]) -> 2911.64 | S44: SUM(RC[-16],RC[-14],RC[-12],RC[-10],RC[-8],RC[-6],RC[-4],RC[-2]) -> 2911.64
A45: THAIS FERREIRA ALVES | B45: 0.0 | C45: 0.0 | D45: 0.0 | E45: 0.0 | F45: 88741.94 | G45: 0.0 | H45: 0.0 | I45: 0.0 | J45: 33089.48 | K45: 0.0 | L45: 0.0 | M45: 0.0 | N45: 16543.08 | O45: 0.0 | P45: 16542.0 | Q45: 0.0 | R45: SUM(RC[-16],RC[-14],RC[-12],RC[-10],RC[-8],RC[-6],RC[-4],RC[-2]) -> 154916.5 | S45: SUM(RC[-16],RC[-14],RC[-12],RC[-10],RC[-8],RC[-6],RC[-4],RC[-2]) -> 0.0
A46: VITORIA L BRAVO VIEIRA
A47: VITORIA L BRAVO VIEIRA | B47: 3803140.46 | C47: 3803140.46 | D47: 3877348.95 | E47: 3877348.95 | F47: 5968153.98 | G47: 5879412.04 | H47: 4210106.14 | I47: 4203256.64 | J47: 6507888.26 | K47: 6474798.78 | L47: 5713725.8 | M47: 5698032.86 | N47: 4492129.84 | O47: 4445516.03 | P47: 722211.88 | Q47: 705669.88 | R47: SUM(RC[-16],RC[-14],RC[-12],RC[-10],RC[-8],RC[-6],RC[-4],RC[-2]) -> 3.529470531E7 | S47: SUM(RC[-16],RC[-14],RC[-12],RC[-10],RC[-8],RC[-6],RC[-4],RC[-2]) -> 3.508717564E7
A48: IGOR LUCAS D SILVA | B48: 7846685.89 | C48: 7846685.89 | D48: 8886894.98 | E48: 8886894.98 | F48: 9497304.16 | G48: 9497304.16 | H48: 8992034.8 | I48: 8992034.8 | J48: 7749138.84 | K48: 7749138.84 | L48: 7409169.6 | M48: 7409169.6 | N48: 9054396.57 | O48: 9054396.57 | P48: 1484222.18 | Q48: 1484222.18 | R48: SUM(RC[-16],RC[-14],RC[-12],RC[-10],RC[-8],RC[-6],RC[-4],RC[-2]) -> 6.091984702E7 | S48: SUM(RC[-16],RC[-14],RC[-12],RC[-10],RC[-8],RC[-6],RC[-4],RC[-2]) -> 6.091984702E7
A49: MARCIA D ALMEIDA VIEIRA | B49: 264937.81 | C49: 264937.81 | D49: 76904.22 | E49: 76904.22 | F49: 122714.78 | G49: 122714.78 | H49: 14267.5 | I49: 14267.5 | J49: 315609.69 | K49: 315609.69 | L49: 297235.37 | M49: 297235.37 | N49: 0.0 | O49: 0.0 | P49: 0.0 | Q49: 0.0 | R49: SUM(RC[-16],RC[-14],RC[-12],RC[-10],RC[-8],RC[-6],RC[-4],RC[-2]) -> 1091669.37 | S49: SUM(RC[-16],RC[-14],RC[-12],RC[-10],RC[-8],RC[-6],RC[-4],RC[-2]) -> 1091669.37
A50: YAN F MUNDIM BRICIO | B50: 35786.02 | C50: 35786.02 | D50: 133741.03 | E50: 133741.03 | F50: 34828.35 | G50: 34828.35 | H50: 49562.9 | I50: 49562.9 | J50: 46655.97 | K50: 46655.97 | L50: 199291.84 | M50: 199291.84 | N50: 54413.64 | O50: 54413.64 | P50: 0.0 | Q50: 0.0 | R50: SUM(RC[-16],RC[-14],RC[-12],RC[-10],RC[-8],RC[-6],RC[-4],RC[-2]) -> 554279.75 | S50: SUM(RC[-16],RC[-14],RC[-12],RC[-10],RC[-8],RC[-6],RC[-4],RC[-2]) -> 554279.75
A51: Total - VITORIA L BRAVO VIEIRA | C51: SUM(R[-4]C:R[-1]C) -> 1.195055018E7 | E51: SUM(R[-4]C:R[-1]C) -> 1.297488918E7 | G51: SUM(R[-4]C:R[-1]C) -> 1.5534259329999998E7 | I51: SUM(R[-4]C:R[-1]C) -> 1.3259121840000002E7 | K51: SUM(R[-4]C:R[-1]C) -> 1.4586203280000001E7 | M51: SUM(R[-4]C:R[-1]C) -> 1.360372967E7 | O51: SUM(R[-4]C:R[-1]C) -> 1.3554326240000002E7 | Q51: SUM(R[-4]C:R[-1]C) -> 2189892.06 | S51: SUM(R[-4]C:R[-1]C) -> 9.765297178E7
A52: Total - RAPHAEL LUIZ RODRIGUES RAMOS | C52: SUM(R[-10]C:R[-7]C,R[-1]C) -> 1.195055018E7 | E52: SUM(R[-10]C:R[-7]C,R[-1]C) -> 1.298639318E7 | G52: SUM(R[-10]C:R[-7]C,R[-1]C) -> 1.5537170969999999E7 | I52: SUM(R[-10]C:R[-7]C,R[-1]C) -> 1.3259121840000002E7 | K52: SUM(R[-10]C:R[-7]C,R[-1]C) -> 1.4586203280000001E7 | M52: SUM(R[-10]C:R[-7]C,R[-1]C) -> 1.360372967E7 | O52: SUM(R[-10]C:R[-7]C,R[-1]C) -> 1.3554326240000002E7 | Q52: SUM(R[-10]C:R[-7]C,R[-1]C) -> 2189892.06 | S52: SUM(R[-10]C:R[-7]C,R[-1]C) -> 9.766738742000002E7
A53: Total - NATHALIA RODRIGUES RAMOS MAINIER | C53: SUM(R[-41]C,R[-27]C:R[-23]C,R[-18]C,R[-13]C,R[-1]C) -> 4.360384733E7 | E53: SUM(R[-41]C,R[-27]C:R[-23]C,R[-18]C,R[-13]C,R[-1]C) -> 4.6302811739999995E7 | G53: SUM(R[-41]C,R[-27]C:R[-23]C,R[-18]C,R[-13]C,R[-1]C) -> 5.4779453849999994E7 | I53: SUM(R[-41]C,R[-27]C:R[-23]C,R[-18]C,R[-13]C,R[-1]C) -> 5.733860814E7 | K53: SUM(R[-41]C,R[-27]C:R[-23]C,R[-18]C,R[-13]C,R[-1]C) -> 6.243655125E7 | M53: SUM(R[-41]C,R[-27]C:R[-23]C,R[-18]C,R[-13]C,R[-1]C) -> 7.086925715E7 | O53: SUM(R[-41]C,R[-27]C:R[-23]C,R[-18]C,R[-13]C,R[-1]C) -> 6.274489787000001E7 | Q53: SUM(R[-41]C,R[-27]C:R[-23]C,R[-18]C,R[-13]C,R[-1]C) -> 1.2291586089999998E7 | S53: SUM(R[-41]C,R[-27]C:R[-23]C,R[-18]C,R[-13]C,R[-1]C) -> 4.1036701342E8
A54: Total | C54: SUM(R[-45]C:R[-44]C,R[-1]C) -> 5.618451148E7 | E54: SUM(R[-45]C:R[-44]C,R[-1]C) -> 5.751667111999999E7 | G54: SUM(R[-45]C:R[-44]C,R[-1]C) -> 7.036137288E7 | I54: SUM(R[-45]C:R[-44]C,R[-1]C) -> 7.825608503999999E7 | K54: SUM(R[-45]C:R[-44]C,R[-1]C) -> 8.051234653E7 | M54: SUM(R[-45]C:R[-44]C,R[-1]C) -> 9.06692045E7 | O54: SUM(R[-45]C:R[-44]C,R[-1]C) -> 7.913576354E7 | Q54: SUM(R[-45]C:R[-44]C,R[-1]C) -> 1.568535754E7 | S54: SUM(R[-45]C:R[-44]C,R[-1]C) -> 5.2832131263E8